title,reviews,scores,genres
버블스 퍼즐 블래스트 !,"광고 영구제거 사용해도 일부 보상을 얻기위해서는 또 광고를 봐야하는 형식이 이해가 안됩니다. 그리고 주어진 횟수안에 특정색 버블이나 블럭 없애는 미션에서 마지막 횟수에서 딱 맞게 다 제거해도 실패로 처리되는건 버그인지 수정해주시면 좋겠습니다. 턴이 1남았을때 겨우 다 없애고 턴이0으로 보이면서 승리가 되야하는데, 그냥 패배가 되어버리네요 만약 이게 의도된거라면 퍼즐게임에 있어서는 안될 쓰레기같은 룰인거같네요. 처음에 뒤로 가기나 게임 종료하는 곳이 없이 맨 아래에 있는 광고만 자꾸 눌러져서 게임을 강제 종료해야 했었는데, 스테이지 6까지 하고 나니 홈 버튼과 종료하는 곳이 생겼네요 :-) 홈 버튼을 누르니 마을 꾸미는 것도 나오고, 공룡이 돌아다니는데 귀여워요. 아직 처음이지만 게임하는것도 그렇게 많이 어려운것 같지 않아서 좋네요 :-) 게임 한판 할때마다 광고가 나와서 돌아버리겠어요. 업뎃이후로 광고도 무슨 30초 보고 5초 또 봐야 X버튼 나와서 진짜 빡쳐요 너무너무너무너무 열받아요. 화나서 광고삭제에 돈쓰게 만들계획같은데 넘어가지 않을예정입니다 1. 광고가 너무 많음 이런류 게임은 초기엔 하트를 더 얻기위해 광고를 봤었지만 지금은 게임 몇라운드 안했는데 중간중간 계속해서 광고가 나옴 굉장히 불편함 2. 버블이 안정적이지 않고 움직이다 보니 쉽게 깰수있는 상황이 어려워지기도하고 어려운 상황이 갑자기 쉽게 풀리는 경우도 있음 이거는 나쁘지않은것 같음 아기자기하고 재미있어요~ 근데 회복약들 같은 아이템들은 어디서 확인할 수 있는거죠? 아무리 찾아도 보이지가 않네요ㅠㅠ 회복약들을 받으면 알아서 회복이 되는건지 모르겠어요ㅠㅠ 건물들이 회복을 도와준다는데 얼마나 도와주는건지도 잘 모르겠고요^^; 이런 부분들에서 살짝 애매한것들 빼고 게임 자체는 귀엽고 재밌어요:) 광고제거 바로 삼! 추억의 캐릭터들 너무 귀엽고 브금도 추억돋네요 ㅋㅋㅋ 다만 건물 레벨업 하면 뭐가 좋아지는지 알려주셨으면 좋겠어요.. 아무 생각없이 집 5레벨 찍었는데 뭐가 좋아진건지 눈으로 확인이 안되니까 괜히 했나 싶고.. 인겜 재화는 천천히 하다보면 쌓이니 괜찮은거 같아요(별 많이 벌고 싶다) 재설치하고 같은 계정 로그인했는데 그 많은 건물중에 2개가 증발되었더군요-_-(맵에서 해당 건물이미지는 그대로인데 눌러보면 없는 상태로 나옴,집 하나 없어져서 게이지도 훅 내려가버림) 거기까진 저장데이터에 문제가 있었다칩시다! 근데 건물 증발된 그 자리에 새건물인 집 레벨1짜리 새로 세우고 게임 몇판하다가 눌러보니 원래 건물인 집 레벨6로 돌아와있더군요 종료했다가 재접속 몇번해보고 집6 그대로 있길래 안심했거든요 게이지도 회복됐고요 그러나! 레벨낮은 집 하나 되팔고 그 빈자리에 복구된 집6을 옮겨놓고, 집6이 있던 자리에 다이아50...
전체 리뷰 예전에 했었던 버블버블이 생각나서 사전예약을 하고 나오자마자 다운받아서 잠깐 해봤는데 어렵지도 않고 간단하니 시간 때우기 좋겠네요. 근데, 아래 ㄹㅣ뷰도 있는데, 아래 광고는 거슬리네요. 중간에 나오는 것도 아니고. 암튼 버블버블을 추억도 되고 간단하니까 시간 때우기용 게임을 원하신다면 바로 이겜입니다요~ 리뷰기록 남아있는 것 확인했습니다(리뷰들 중에 제가 쓴거 일일이 찾아가면 확인 가능). 원래 리뷰 남기고 나면 수정할 수 있게 뜨는 걸로 알고 있는데, 페이지 들어오면 무조건 작성만 있어서 오해했습니다. 리뷰 삭제에 관한 오해는 죄송합니다. 게임하다 광고때문에 빡쳐서 리뷰 수정하러 왔어요(애초에 안써졌던거 같지만). 별 하나 뺍니다. 추억도 떠올리고 캐릭터며 다 좋은데 광고가 생각보다 많이 나옵니다. 하트를 얻거나 혹은 특정 아이템을 얻기 위해 이용자가 직접 광고보기를 눌러서 보는 광고갸 아니라, 스테이지 하나 끝나면 광고가 나와요...
전체 리뷰 광고 영구 제거 템 샀는데 광고가 안 없어지네요. 그냥 템 패키지 중 하나인 건지 ㅠㅠ 어제 구매했는데 가능하면 환불하고 싶어요. 템이나 건물에 대한 설명도 집같은 경우 배치된 집 총 수와 남은 수가 게이지로만 나타나서 정확하게 알 수 없어요. 곡식창고같은 경우 '식량을 생산한다'라고 되어 있는데 다른 리뷰보고 배고픔 해소가 게이지?로 채워진다는 답변보고 알았어요. 혹시 외국겜을 번역할 때 생긴 문제인건지 설명이나 정보가 직관적이지 않고 불친절해요. 캐릭터들도 귀엽고 플레이만 열심히 하면 재화도 충분히 쌓여서 스트레스가 없네요 느긋하게 해도 재밌다는 점에서 가산점 주고갑니다! 굳이 단점을 꼽자면 너무 단순한거? 차차 업데이트 되면서 다양한게 나왔으면 좋겠네요 :) 공룡캐릭터도 귀엽고 재밌는대요. 앞전에 했던 단계는 별3개안되고 2개되서 그런대 또다시 단계 선택해서 못하나요? 혹시 어디있는대 제가 못찾는건가요?;; 단계선택 맵지도가 있었으면 좋겠습니다. 재밌게잘하고있어요ㅋㅋㅋ근데 1180 까지 깨고나니 심심해서 초기화해서 다시하고 싶은데 어떻게해야할까여? 설정이나 이런덴 없고 광고제거아이템을 사놔서 계정삭제를 할수도없고 방법좀알려주세요ㅋㅋ 재밌어요! 버블들이 자꾸 움직여서 만들어지는 의도치 않은 상황들이 참 독특하네요. 리뷰가 지워 진건가요? 게임은 예전방식이 아닌 터치식입니다. 아쉬운점은 듀트리얼시 설정이 보이지 않음. 게임 횟수마다 광고가 나오는데, 광고가 나올시 음악을 정지시키거나 시간을 보려 탭을 내려도 무조건 광고를 봐야 넘어가는 구조라 짜증나네요. 저번에도 문의글+메일로 문의 드렸는데 전혀 이해가 가지 않아서 다시 여쭤봅니다. 게임은 스테이지가 오르면 오를수록 미니룬이 추가되는데 그 미니룬을 케어 할 요소가 매우 아주 매우 적습니다. 사육장이 배고픔 관리면 농장은 뭔가요? 농장 클릭 시 내용은 미니룬 식량 생성인데 게이지가 아무리 풀이여도 계속 배고파하는데요..?땅은 좁고 건물 레벨은 10까지고 지금 스테이지 806인데 미니룬 전체 상태 이상이에요; 스테이지만 깨는 게임이라면 모를까 미니룬이라는 요소를 추가하셨으면 밸런스는 맞춰주셔야죠.보석 주는것도 돈주는것도 매우 짜디 짭니...
전체 리뷰 미니룬 상태이상 뭐 어쩌라는거야 진짜 작작해라 겜하러 들어갈 때마다 미니룬 때문에 빡쳐서 겜하기 싫어질 정도 그리고 버블 물리엔진 사기 작작 좀 쳐라 무지개인거 보고 누르는 순간 기가 막히게 살짝 움직이면서 다른거로 바뀌면 겜 꺼버리고 싶음 뭐든 작작하자 미니룬 갖고 장난치는 것만 개선되도 결제할 용의 있다 재밌게 플레이 하고 있습니다! 다만 배터리가 너무 빨리 닳아요ㅠㅠ 충전 속도보다 닳는 속도가 더 빨라서 충전이 안 되는 현상이 벌어집니다ㅠㅠ 전체연령가 게임에서 12세이상의 좀비게임 광고가 80프로 정도 나옵니다. 광고를 30~40초 동안 계속 봐야 한다는게 혐오스럽습니다. 아이들도 하는 게임에..이렇게 연령에 맞지 않는 광고는 제거해주시길 바랍니다. 광고가이렇게심한게임은처음이네요 게임한판에 광고한번이라니 게임 자체는 귀엽고 쉬운데 광고가 너무 많다.... 처음에만 광고가 없지 중간에는 플레이 누를때랑 리플레이 누를때마다 항상 광고... 다좋은데 광고만없으면 좋겠음요 한판에 광고한개씩 들어가잖아욪 일단 게임자체는 할 만 하네요. 광고 제거할려면 돈을 내야 하지만... 퍼즐버블 for kakao 할 때의 음악도 나왔지만... 게임진행 시, 보글보글의 음악을 리메이크 잘 했습니다. 재밌게 하고 있는데요, 배고픔을 해결하기 위한 정미소랑 여러가지 건물을 세웠는데 어떻게 수확할 수 있을까요?ㅜㅜ 튜토리얼이나 방법 설명이 조금 아쉽네요 재밌어요.버블보블캐릭터도 귀엽게 나왔고,어려운것도 얼마없고 광고도 거의없어요.광고로 왜 화내는건지모르겠네요.다른 전투겜처럼 화나거나하지도 않고 차분하게할수있습니다.강추합니다! 광고 너무 많음. 짜증나서 못하겠어요. 별 줄수가 없네요 요즘 할 게임이 없어서 심심했는데 이렇게 재미있는 게임을 만들어 주셔서 감사합니다 그리고요 출석 할때마다 상품을 주 셔서 감사합니다. 퍼즐게임 좋아하시는 분들께 이 게임 강추 합니다. 그래서 저는 별 5개 드립니다. 너무 재밋어요! 옛날에 버블버블했었는데 너무 난이도가 어려워서 중도하차했었거든요 근데 이번엔 여러아이템도 나오고 그래서 너무 좋네요!!!! 예전 오락실에서의 추억여행 ㅋ 은근히 중복되는 마력의 게임 다좋습니다 재밌고요 그치만 광고제거 구입했는데 광고가 뜨네요 재밋어서 계속하는데요.오류가 있어요ㅠ 땅에 다 건물지어놧는데 암것도 없는거에요 그래서 다이아써서 건물지었는데 재접속하니 전에지어둔건물로 바뀌어있네요ㅠ 두번이나 그래서 다이아40갠가50개 버렷어요ㅠ 광고가 나오는거 빼곤 정말 재밌고 완벽한게임같아요 그리고 광고는 다른게임들의 비해 조금나와서 정말 좋은거같아요 잠깐잠깐 하기에는 좋습니다 재밌네요 BGM도 추억이고요 근데 광고제거를 샀는데 이어하기 같은경우에는 광고제거가적용 안되는건가요?? 결과창 끝나고 나오는 광고는 없어진걸보니 제대로 결제한것같긴한데 재미 있어요 근데 골드로 치료제 구매 할수 있게 해주세요~골드는 쌓이고 쓰잘데가 없어요 게임 뭐 이래 분명히 무지개로 눌렀는데 불꽃으로 바뀌고 지 멋대로 바뀌고 개발을 왜 이렇게 해 게임 초기화 기능은 없는가요. 아예 싹 지우고 첫번째 스테이지부터 다시 시작하고 싶은데 아무리 찾아봐도 없네요... 보글보글 버블스 게임 재미가 있습니다, 광고가 많이 없어요 가끔씩 있긴 하지만 시간이 가는줄 모르고 게임을 즐기고 있습니다, 스피디했으면 더 재미있었을 듯요 풍선 누르고 또 누를 때까지 기다려야 해요 계속 꼼지락 움직이지 않을 때도요 한국 사람 속 터지게 만들 작정으로 그랬다면 기립박수 감입니다 캐릭터도 귀엽고 쉽고 간단하니 시간 때우기 좋습니당 이 게임 강력 추천합니다~!! 한번씩 해보세유 ?????내가 쓴거 어디갔음???리뷰도 삭제하시는듯 이런 겜 처음이다 진짜 광고를 했으면 관리를하던가;; 이건뭐 광고보려고하는게임인지ㅋㅋㅋ 이틀하고 삭제합니다^^망겜 간만에 가볍게 즐길 수 있는 게임이 나와서 너무 좋네욤!! 게다가 추억의 보글보글이라니!!!개다가 왠지 캐릭터가 더 귀여워진 거 같아요♡ 재밌어요 재밌는데 214탄 어케깨요.....? 깨신분 있으신가욤ㅠㅠㅠㅠㅠㅠ 그리고 캐릭터들에 대한 설명이 잘없어요 배가 왜 고픈건지.. 집도 식량창고도 넉넉한데요... 익숙한 배경음에 추억돋기도 하고 색감도 아기자기하니 귀여워요 아직 몇단계 못 갔지만 재미있네요☺☺ 광고를 시청하라는건지 게임을 하라는건지 모르겠네..광고 엄청 많이 나옴..광고보다 열받아 게임 삭제~! 분명히 알림 해제 했는데 푸쉬 알림 징하게 보내네요. 별점 수정하고 그냥 지웁니다. 한번 플레이 해봤는데 기존의 퍼즐버블보다 재미있고, 도시건설 컨텐츠까지 들어가 있네요... 정말 대단합니다! 버블버블아바타와 퍼즐마추는 모험이라 재밌고 신나며 간단해서 좋지만 다양한 이벤트도 나오면 좋겠고 오래 운영해주시고 감사하고 존경하며 건강하세요😍😄 하루에 광고를...몇개를.봐야되는거죠 ㅋㅋㅋㅋ 진행하려면 거진 30~40번은 봐야하는듯... 오랜만에 게임하는데 안 질리고 재밌네요~ 광고가 좀 자주 나오긴 하는데 기다릴만 해요 넘 기엽고 광고도 적당하다 생각해요 ㅠ^ㅠ 이런 사랑스러운 게임 넘 조아요 끝까지 할게요 XD 스테이지별로 미션이 달라서 흥미롭네요. 옛기억을 떠올려 보글보글인줄 알았다는요ㅜㅜ 보글보글도 개발 부탁드려요 너무나도 깔끔한 퍼즐게임에 향수자극 보글보글 캐릭터 최고의 퍼즐 게임 입니다. 어서 플레이 해보세요. 오락실에서 하던 명작 게임이 돌아왔네요. 항상 게임할 때마다 생각이 많아지는 게임으로 기억하고 있어요. ㅎ 퍼즐이 복잡하긴하지만 게임은 사전예약할만큼 기대를 많이해서 그런지 재미있네요;; ""버블 퍼즐 블래스트!""를 잼나게 하겠습니다. 그리고 연결오류 나지않게 유지해 주셨으면 좋겠습니다. 흔하디 흔한 스테이지 형식 퍼즐겜. 어느순간 막혀서 과금 안하면 못뚫게돼있음 시대가 어느시대인데 광고제거를 넣질않나 ㅋㅋ 시대에 뒤처지는겜 복잡하지 안고 광고가 많이 안나와서 좋고 조금은 유치 하지만 재밌어요. 재밌어요^^ 막힐때도 있지만 ㅋㅋㅋㅋ 효과음이 완전 추억~~♡ 진짜 기다리고 기다렸던 게임인데🤫내가일때문에 너무바빠서 다운로드 너무늦게했네용ㅋ재미있습니다 강제로 광고 보게하고 스킵버튼도 없는게 좀 너무 하네.. 심지어 내 리뷰 지웠써ㅠㅠㅋ 다이아 100개 모아서 옷 샀는데 원래 있는거랑 겹친다고 골드 3000원을 주네요ㅋㅋ 골드는 공룡들이 알아서 주는거고 다이아 100개는 몇날며칠 게임해야 받는건데 단가가 맞다고 생각합니까??? 개발자는 생각 좀 하고 사쇼 30만도 아니고 3천이 뭐임 넘재미나요 아이도 어른도 즐거운 게임♡7살도 잘하네요 그림체도 넘 귀요미네요 게임 클리어하면 갑자기 소리가 크게 나옴 게임할땐 작게 나오고 볼륨을 어떻게 맞춰놔야할지 모르겠음 개임이 단순하고 광고도 많이 안 나와서 좋아요. 시간가는줄 모르게 너무 재미있어서 계속 하게 되네요 강추합니다~ 재미있어요 옛날생각도 나고 쉽게 할수가 있어서좋아요 재밌네요 추억의 브금도 좋구요 나중에 미니 게임으로 보글보글 같은 거 나오면 좋을듯 ㅋㅋㅋ 어릴때 오락실에서 자주하던 보글보글 퍼즐버블버블도 재미있었는데 추억 돋네요 보글보글송도 씬나요 🤣 공룡 상태이상 하루에 한두번 제한하면 안되나? 돈얻는거 보다 나가는게 더 큼. 치료하면 딴걸로 끙끙거리고 치료하고 또들어오면 이번에는 딴거임 ㅋㅋ 재밌어요~ 폭탄이나 등등 한번에 터질때 일시적으로 멈춰요 재미있게 잘 하고있습니다. 그런데 무브부스터가 먼가요 재밌음ㅋㅋㅋ 근데 이 게임 편하게 하려면 광고제거 꼭 사야할듯 광고 개귀찬네 귀여워 재밌어 노래추억돋아 좋다. 재밌어요 근데 24일부터 접속 보상이 하나도 없어요 접속해도 우편함에도 없구요 게임 잘하고 있었는데 어제부터 광고 나오면 게임으로 다시 돌아갈수 없게 됐어요 재부팅 해야 되는데 한번 하고 껐다 켜고 하기 짜증나서 지움 ㅡㅡ 광고가 계속나와요ㅡㅡ왜이렇게많이나오는지 했던게임들중 최악임 미니룬들이 아무리 배고픔게이지 풀로 채워주고 배고픔방지 건물지어도 몇십분만에 배고프다고 뜸 돈생산보다 상태이상 뜨는게 더 자주떠서 아이템값이 더나감 미니룬 많을 수록 손해보는구조임 BM이 존재 하면서도 광고로 칠해져있는게 어이없는 게임 왠만해선 안하는걸 추천 광고 안보기 상품을 구입 했는데 왜 계속 광고가 나오는지.. 옛날생각나고 좋네요. 아기자기하고 귀여워요 시간 때우기용으로 할려고 했는데, 정말 시간가는줄 모르겠네요!! 옛날 갬성도 생각나고 좨미있네요ㅎ 시간 가는줄 몰를정도로 하고 있네요 두말할 것 없이 재미습니다. 재밌게 즐기게습니다. 고맙습니다. 너무신선하고 좋아요! 피로가 풀립니다 정말 오랜만에 보는 캐릭터네요 ㅎㅎ 정말 재미있어요^^ 지금 접속하면 하트 60분무료 하면서 알람떠서 들어가보면 안주네요 ㅡㅡ 이벤트도 아직 날짜가 남아 있는데도 들어가면 마감되었다고 나오고 왜 그러는거죠 단순하면섣 짬시간 즐기기 재미있어요.ㅅㅅ 무과금으로1040판까지모아둔보석아이템광고찬스등을사용하며버텨왔는데챌린지모드로들어서자마자나의한계가느껴졌다지금60분무제한아이템을받았지만절대로챌린지모드17판을이어나갈자신이없다오늘하루종일17판을해결못하고있기때문이다챌린지모드를계속진행하려면현질을해야하는데난현질을안할꺼기때문에이글을마지막으로게임을접는다못깨는판왠종일스트레스받기가싫다버블스제작진분들번창하시고사업잘되길빈다그럼이만... 정신없이 일주일넘게 빠져서 했어요 ㅋㅋ 1000탄까지깼는데 그 뒤는 언제 업그레이드되나요?? 집지을 땅도모잘라요 ㅠ 광고ㅡㅡ한판마다 광고뜸.. 별점 오점은 직원인가용? ㅋㅋㅋ 미니룬들은 늘 배고파하고 보상이나 아템은 거의 없다시피하구옄ㄱㄱㅋ (있다고하는분들이 신기) 무지개를 눌렀는데 다른아이템으로 바뀌는경우도 있구여 버블움직임이 일관적이지않아섴ㅋㅋㅋ 하다가 씅나서 끄기두 햇구여 ㅋㅋㅋㅋ 그냥 .... 뜻대로 안되는게 인생사인가 싶고 하다보면 성불하고 사리나올것같아서 게임지워여 ㅋㅋㅋㅋㅋㅋ 평점좋은분들은 부처신가여.. ? 귀염귀염하고 쉽고 재밌네요 일단 잼있네요 지금까지는 광고도 적네요 게임은 잼있는거 같은데 게임 중간중간 광고 전 이제 떠납니다 굿바이 저는 재밌네요. 광고 싫으신분들은 결제하세요. 캐릭 지워 놓으면 딱 광고 구걸게임 별한개도 아깝다 추억도 생각나서 시작햇는데 역시나 재미있네요~~ 단순하면서도사운드도관찬고좋으네요 재미있어서 결제했는데 이어하기는 광고가 없어지지않나요??",4.2,퍼즐
Rovio Classics: Angry Birds,"4-12 스테이지에서 모든 구조물 파괴해도 최대 93%까지만 차서 독수리 깃털 획득이 안됩니다. 또, 오프라인상태에서 플레이하면 하얀색글자와 배경으로 메뉴에 광고가 나오는데 메뉴창을 나가도 게임 끝까지 지워지지 않습니다. 오류 빠른 수정 부탁드립니다. 추억의 앵그리버드 클래식이 리메이크 된것이 매우 좋습니다! 다만 애피소드가 조금 적은 느낌이고 마이티리그랑 아이템이 없어서 조금 아쉽습니다 그래도 재밌습니다. 정말 재밌습니다 제가 이 게임을 2013년에 처음으로 했는데 예나 지금이나 여전하네요 비록 리메이크된 이 앱은 유료지만 스테이지도 충분히 있고 다 깨더라도 마이티 이글 등 할게 많아서 살 만합니다 여전히 갓겜이네요👍👍 최고입니다 1-7과 같은 특정 각도에 더해 그마저도 운에 좌지우지 되는 요소들만 빼면 클래식 앵그리버드를 그대로 가져온 재밌는 게임 정말 10년전 그감성 그대로 돌아간거 같네요. 저렴한 금액에 끝내주는 퀄리티에 정말 완벽하네요 별을 더 못드리는게 아쉽네요 ㅠ 강추합니다 👍 1-7, 황금알-5의 공략이 거의 개변된 수준으로 매커니즘이 은근슬쩍 바뀌어서 공략이 힘들어짐. 물리엔진이랑 레드 위력은 그대로 두지 왜;; 단돈 1.300원에 광고 없는 앵그리버드를 즐기고 싶다면 강추! 로비오 계정을 만들면 세이브 데이터도 저장 가능. 퀄리티 올랐습니다 그리고 효과음이 달라졌고 맵도 달라졌어요 나머지는 똑같아요 앵버 클래식아!!!! 어디갔다 이제왔냐!!!!!! 유료로 전환된 거 같은데 그래도 1300원이 전혀 아깝지 않은 전설의 귀환! 쌍수 들고 대환영합니다! 에피소드가 몇 개 없어서 아쉬웠어요. 추후 다 업데이트 되는 거죠? 와.. 진짜 옛날로 돌아간 기분이 들었는데 리오랑 스타워즈도 재출시 해주세요 ㅠㅠ 오랜만에 플레이 하니깐, 기분 좋네요.😀 요즘게임이 얼마나 꾸데기인지보여주네요 팔라독같은 옛날게임도 유료화해서 팔면 좋겠다는 생각이 듭니다. 초심 돌아와서 매우 즐겁다!!!! 진짜 오랜만이네요 스타워즈도 이렇게 새로 내주면 좋겠네요.. 추억의 앵그리 버드 다시 돌아와서 기쁘도다 판타스틱함. 10/10 전설의 게임이 돌아왔다 ""어릴 적으로 돌아간 기분이에요!"" ""퓨어바닐라 쿠키"" 앵그리버드 최고!!! 옛날 생각 나네요 추억이 돋네요 명작의 귀환 내가 최초다 다시 돌아온 추억의게임 아이템이랑 레벨이 없어져 조금 아쉽네요. 앵그리버드의 발전을 기대합니다 추억돋네 return of king 개꿀잼 my best game 클래식 그리웠습니다 근본........ 근본 게임",4.8,퍼즐
Bubble Pop Origin! Puzzle Game,"왜 리뷰가 하나도 없지? 내 폰이 이상한건가..ㅋㅋㅋ 아무튼 제가 5점을 드린 이유는 먼저 데이터 끄면 광고 하나도 안 나와요. 그리고 딱 공 색도 바뀌고 선도 있어서 어떻게 쏘면 되는지 딱 알 수가 있어요. 제가 이 게임 하려고 얼마나 찾아봤는지 알아요ㅠㅠ 근데 딱 찾았습니다. 원래 제가 리뷰랑 점수 보고 설치하는데 하나도 없는거예요. 그래가지고 딱 이 번 한번만 더 깔고 또 마음에 안드는거면 바로 삭제하고 다신 안할려고 했어요. 찾으니까 너무 좋네요ㅎ 여러분 안심하고 설치하셔도 되요. 엄청 좋습니다! 처음하는데 재밌는거 같아요 귀엽고 아기자기한 디자인에 톡톡터지는 BGM 그리고 앙증맞은 구슬을 맟추는 캐주얼 까지 하지만 한가지 아쉬운점은 난이도에요 가면갈수록 더어려워지고 구슬을 맟추는것도 힘들어요 ㅠㅠ 그점만 개선하면 좋겠어요 게임하는 거 안 좋아해서, 휴대폰에 게임 다운받은 건 이번이 처음인데, 재밌네요. 신나게 하다보니, 스트레스도 풀리고 좋아요. 지루하지않아요 재미나네요 쉬워서 머리식힐 때 좋고 재밌네요. 꽤 괜찮은 게임이네... 벽을 튕기네 튕겨...모으기 재밌네...선택잘함. 간단하게 할수있어 재밋네요 지루하지않고 진짜로 중국 게임 하는게 아니다 진짜 짜증나고 막 화가난다 한국에서 떠나가라 진짜 떼놈 맞습니다 할만하네요 아직까진 재미있어요. ㅣ 시간보내기좋아요 심심할때 하기 좋음~ 재밌어요 진짜 :재밌어요시간때우기로는조아요 진짜 리뷰가 단 1개밖에 없자너ㅋㅋㅋㅋㅋ I actually did already contact you guys through the game about the issue already... 재밌음 너무 쉬움 👍 재미있내요",4.6,퍼즐
버블헌터 오리진: 오락실 버블게임,버블에 고증인 정확성을 잘 살렸고 잼있습니다. 덕분에 히어로즈?게임이란것도 알게되었습니다. 올만에 오락실에서 했던 버블게임이 생각납니다. 너무 어렵지도 않고 재밌어요^^ 시간가는줄도 모르고 하고있어요 !! 예전에 오락실에서 하던 게임이 생각나네요 ㅎㅎ 가볍게 킬링타임용으로 강추합니다!! 나름 잘 만들어진 느낌.. 계속 해보겠습니다 이상하게 계~~~속~! 하게 되는 거 뭐지^^ 잼이나요! 잘 맞춰서 한방에 다 떨구려는 욕심이.. ㅋㅋ 중독성있고 재밌네요~~ 넘 넘 잼나요~ 이러다 밤 샐듯요 ㅎㅎ 2시간동안 시간 가는줄 몰랐어요. 옛날 생각나네요 쉽고 재밌어요. 존1니 재밌음 최고네요 안녕재밋네 재밌어요!! nice game. 재미있어요 Great Game! Good~~~~ 최고최고,3.4,퍼즐
