title,reviews,scores,genres
World of Tanks Blitz,"초심자들은 중전차를 추천합니다. 중전차는 라인을 만들어서 버터야 하는 압박이 있지만, 기본적으로 체력과 장갑이 버텨주기에 다른 전차에 비하면 초심자들에게 좋습니다. 자신이 고인물 정도라면 중형전차를 모셔도 좋습니다. 중형전차는 그냥 이도저도 아닌 전차라서 상황을 봐서 행동해야 하기에 초심자들에게 적절하지 않습니다. 맵의 특성과 라인 등을 정확히 숙지하는게 좋습니다. 내가 한 게임중에서 많이 재밌는 편인데 탱크 키우기가 쉽지가 않다는 것 등등 마이너스 요인이 조금 있다. 여타 모바일 탱크 게임과 비교해서는 워썬더 정도밖에 견줄 게 없을 정도로 탱크가 잘 구현이 되어있다. 다만 골드탱크와 수집가탱크는 사실상 현질 전용에 상당한 능력차이가 있고 전투 중 병1신같은 ai때문에 충분히 이길 판을 못이기는 경우가 있다. 골드를 모으는 경우 클랜에 들어가면 1주에 100개씩은 사료마냥 줘서 그나마 견딜 수 있었다. 솔직히 말해서 탱크를 키우누 이 과정이 매우 노가다이며 8단계까지는 잘올라간다 해도 9단계 부터 전차를 키우고 사는것이 너무나도 힘들다. 유저들과 전투를 하는건 사실상 모바일에서 최고인듯 하지만 현질을 하지 않으면 시간이 매우 오래 걸리는 게임이다. 조금만 현질 유도를 낮추고 전체적인 벨런스를 조정 해주면 좋겠다. 월드 오브 탱크는 w같음이 한결같음. 1. 팀원 운빨겜, 나 혼자 아무리 잘한다 한들, 이 게임은 명백히 모두가 다같이 잘해야 해서 팀원이 못하면 거의 답 없음. 2. 전차 티어가 올라갈수록 수익이 한정적임, 나중에는 게임 이기고 지고가 중요한게 아니라 생존해도 -5000골드 손해보는 기적의 게임. 3. 2번 사항으로 인해 탄생한 킬딸러들, 킬 먹을려고 이 꽉 물고 안 쏨 ※딱 잘라 이야기 하자면 현 매칭 시스템과 보상 시스템이 계속 유지된다면 그냥 4티까지 찍고 접는게 가장 행복함, 4티 말부터 이 게임에 대한 정이 싹 사라짐. ...
전체 리뷰 업데이트 관련 문제 없이 플레이를 즐길 수 있다는 공지가 올라왔으나 업데이트가 불가능하다. 게임에 접속하면 업데이트를 하라며 플레이 스토어로 이동시키지만 정작 스토어에서는 업데이트 버튼이 뜨지 않고 플레이, 제거 버튼만 있다. 플레이를 누를 시 다시 업데이트를 하라며 스토어로 이동시킨다. 도대체 어떻게 하라는건지 알 수가 없다. 그래픽은 최고 탱크도 모바일답게 귀엽고 배경화면 효과등등 흔잡을때없는 게임이라생각 그래픽개발자 대단하네요 능력자 인정해요 근데 게임진행은 스트레스만 받음 현질 노가다를 해도 허무하게 손절친 게임 줌 공격시 포탄 사라지는경우가 허다하고 슈팅게임인데 쏜포가 한번씩 사라진다ㅡㅡ 기껏 8티어에 9티어포달고 풀옵만들었더니 7티어 장갑도 못뚫어 똑같은 전차랑 1대1해도 다 빨갛게보이니 때리지도 못해 하지마란소린가요 근데 상대방은 다 때림ㅡㅡ 10티어3대 9티어 3대등등 구입했지만 손절했네여 게임을 즐겨야되는데 왜 손절치게만드는지 이해가 안되네...
전체 리뷰 게임자체는 재미있는데 네트워크와 아무관련없이 플레이도중 랙이 걸리거나 포탄을 발사하지 못하는 등의 버그가 있습니다. 그리고,전투를 할때 그 전차와 같은티어로 전투가 이루어졌으면 좋겠습니다 모바일 탱크게임중에 이만한 게임이 없음. 물리학이나 탱크의 고증, 탱크의 종류를 따라올 모바일게임은 별로 없는듯. 게임플레이 자체는 팀플이라 협동이 안되면 질수도 있고 이길수도 있음. 그 덕분에 게임이 더욱 재밌게 느껴지는 것 같음. 현질유도 부분은 커보일 수 있으나 그만큼 게임을 열심히 뛰면 어느정도 해소됨. 이벤트에 열심히 참여해도 프리미엄 계정은 어느정도 얻을 수 있고 이를 이용한다면 크레딧과 경험치는 쉽게 벌 수 있음. 살짝 아쉬운 건 구조물이 파괴될때 좀 더 사실적으로 적용되었음 좋겠음. 한꺼번에 무너지지 말고 위나 아래서...
전체 리뷰 예전엔 그냥 다른 게임과 똑같은 튜토리얼이였지만 많이 발전했네요 앞으로도 계속 응원하겠습니다 그리고 특정 상황에서 전차가 한번에 퍼지면 더 좋을 것 같아요(탄약적재함 폭발 제외)아니면 워썬더처럼 측면 관통하면 일정 확률로 승무원 전부 부상입는거 그런거주세요 계속 달려나가주세요 감사합니다 (갑자기 서버 연결이 끊겨졌다 해서 안들어가지네요 이건 좀 고쳐주세요) 전차 수집하는 재미가 있어서 수 만판을 하더라도 잘 안질린다. 잘 할수록 스트레스 받는 신기한 게임이고, 보통 잘 하려면 최소 1만판은 타야하는 고인물게임이다. 리뷰 중 대다수가 징징거리는 글이라서 믿고 거르고 일단 해보고 생각해도 될 정도로 게임으로의 재미가 확실히 있다. 보통 모바일 fps나 슈팅게임과는 달리 전차의 포탑과 차체가 따로 조작되기에 적응하기 어려울 수 있다. P2W이 적어서 현질 좀 한다고 승률 2% 더 높은 사람 이기는 일은 거의 없을 정도로 실력에 의존되나 그 실력보다도 팀 플레이가 더 중요해서 팀을 이끌거나 ...
전체 리뷰 제가 했는데 중형전차를 추천합니다 구축 전차는 고정 포랒서 회전속도도 느러 죽을때가많음 초보들은 독일 미국 소련 강력 추천하고 할수있다면 옆구리나 뒤를 공격하고 경전차는 속도가 빠르지만 어디박으면 뒤지기쉬우니까 운전 잘하고 무빙 잘한다면 경전차하고 체력든든한게 최고다하면 중전차 하세요 5티어만 벗어나면 정말 재밌습니다. 현질유도는 심한 편은 아니네요. 다만 크레딧 획득 확률만 조금 올려 주셨으면 정말 감사하겠습니다!!!!! 이 게임 너무 재밌어요,꼭 한번 플레이 해보세요. 개발자님들 이런 게임 만들어주셔서 정말 행복합니다.워게이밍 코리아 힘내세요!!!! 정말 재미있고 현실감있네요. 그런데 골드모으기가 정말 헐치않네요. 더많은 헤택과 무료전차도 주었으면 해요. 이것만 해결하면 완벽한 게임 될거예요. 리뷰 꼭 참작드려요. 게임 자체는 잘 만들어졌는데 모바일로 플레이할 경우 게임 로딩 시간이 너무 길어 정상적인 게임을 할 수가 없는 상태이네요 저번 업데이트 때도 그렇고 지금도 여전하네요 저만 겪는 현상이 아닌걸로 봤을 때 기기문제는 아닌 것같고 무슨 문제일까요... 이벤트 모드도 적어도 잠수유저만이라도 신고할수 있게 해주세요 잠수유저 처벌이 너무 안됩니다.. 그리고 이벤트모드마다 핑이 계속 터지는데 조정이 필요할거같아요 취향에 따라 재미있을 수도있고 없을 수도있는 게임 탱크들이 많아 다양성도 좋음 마음만 먹는다면 무과금도 플레이가능 상대를 타격했을때의 타격감이 좋고 은근 머리쓰는 게임 다만 이벤트가 부족한 편이고 팀원에 따라 승패가 결정되는 것 때문에 개인의 노력에 승패가 미치긴 힘듬 또한 잔렉 많음 계속 플레이하면서 느낀점인데 피격 사운드가 너무 구립니다. 탱크 피격당할때 쇳덩이가 맞는게 아니라 뭔 나무 둥치 두들기는듯한 소리가 나는게 너무 별롭니다. 그래픽 품질은 최상이고 슈팅게임, 탱크 좋아하는 사람은 취향저격 게임이고 명작인건 인정할수밖에 없지만 스트레스가 큰 게임임 팀원에 따라 승패가 갈리고 패배시 얻는 경험치와 크레딧이 적어지는데 소수빼고 실력 너무 안좋고 악질적인 이용자들은 고의로 패배유도, 트롤링하는놈도 있고 워게이는 이벤트같은거 업뎃은 잘 하지만 서버관리는 안해서 공유기 바로옆에서 해도 핑튀고 핑은 정상이여도 렉 심하고 그리고 10판정도 하다 중간에 연결 끊어져버려서 완전히 종료했다가 키는경우가 매일 발생함 문의 넣어도 매크로답변만 하고 안쳐고침 진짜 하면 할수록 ...
전체 리뷰 한마디만 할게요 재미있네요 그런데 유럽쪽에있는 Progetto 46들끼리 소대를 만들어서 매 판마다가 그 클립식탱크 때문에 계속게임이 패배하는데 이거는 쫌 대책이 필요하지않나요? 저는 개인적으로 클립식 탱크들이 소대를 하지못하게 하는것이 좋다고생각하는데 아니 업뎃하고 게임접속..게임입장..그 외에 옵션 설정도 왜이리 오래걸리나요..다 로딩걸리고 it강국 답지않게 게임이 원활하게 돌아가지가 않네요 아무리 한국인들 실력이 좋아도 대놓고 차별하면 안되죠. 유튜브 보니까 한국인이랑 동남아사람이랑 자동조준에서 제공받는 기능이 다르네요? 한국인은 적 전차를 조준점으로 정확히 겨눠야 비로소 자동조준 켜주고 동남아사람은 HUD 자체가 달라서 큰 조준원에 대충 겨눠도 자동조준 켜주는게 뭡니까. 게임은 실력으로 해야죠. 내 이게임을 7년째 그리고 현재 10티어 연구전차는 모두 마친상태 골탱 130개정도 보유중입니다. 물론 컴탱도 하고요. 리뷰를 보믄 사람들은 게임을 깔때 하나만 유의 해주셔요. 이게임는 현질하면 유리해요 골탱이라는 시스템 컴탱보단 훨 쉽죠 그리고 연구도 쉽게 가능하고요. 10티어를 달려는 노력은 정말 힘들지만 노력으로 안이뤄지는건 없다고 봐요. 10티어까지 모두가 금방간다면 다들 10티어타다가 질려서 가겟죠? 하나씩 하나씩 돈모으고 경험치 모아서 업그레이드해나가면서 타보셔요. 이벤트도 많잖아요? 다양한 물품도 주고 골탱도 주니까요 ...
전체 리뷰 현질보다 팀웍, 실력, 전략이 중요한 게임. 4티어 전까진 혼자서도 무쌍이 가능하지만 이후로는 침착하게 플레이 해야 제대로된 전투가 가능합니다. 우선 골탱(현질탱크)을 탄다면 쉽게 고티어 탱크를 탈 수는 있겠지만 OP탱크 몇개를 제외한 스펙으로 보면 은탱과 별 차이도 없고 오히려 은탱이 더 뛰어난 경우가 대다수에요. 그래서 현질한다고 이기는게 아니라 과금과 무과금의 격차가 크지 않다는 장점이 있죠. 오히려 1년 이상 꾸준히 게임하면 과금자체가 필요 없을 정도니까요. 저는 3년째인데 골탱은 평균 스펙은 좋지만 나사가 하나씩 빠져있어서...
전체 리뷰 하면 할 수록 현질을 하고픈 마법의 게임! 하지만 너무 재밌다! 근데 좀 기타국가에 실제로 없는 전차 좀 없애면 안 될까요..... ㅠㅠ . 현실성하고 게임성이 너무 떨어집니다. 거기다가 밸런스 파괴까지... 이부분이 정말 아쉽네요.. 실제 있었던 전차로 전투를 한다는 점에서 애초에 맘에 들었는데 6-7단계 쯤으로 가니까 실제로 없는 전차가 판을 치네요.. 이거 빼고는 대부분 다 좋습니다.! 무료 게임이여도 적당한 노가다와 광고시청으로 잘 플레이 할 수 있고 그래픽도 괜찮다는 점, 게임 시스템이 복잡하지 않다는 점이 매우 마음에듭니...
전체 리뷰 개발사의 조작감에 대한 개발력이 매우 미숙한 편입니다. 7티어 전차를 뽑을 때 까지 플레이 해 보았는데, 전차 컨트롤 자체도 굉장히 불편할 뿐만 아니라, 경전차 자체의 특유성인 맞지 않고 움직여야 하는 것 때문에 움직이는 것 자체도 불편한데다가 오토에임까지 엉망이라서 경전차는 다른 전차들 보다 말도 안되는 수준으로 밸런스가 안맞습니다. 서버 핑 자체도 호주서버를 이용하기 때문에 불안정하며, 그 때문에 경전차는 그에 대한 피해를 더 많이 받는 편입니다. 문제를 전혀 개선 할 여지가 없어보이는 것 같아 아쉽네요 5년차 게임 유저입니다. 열심히 업데이트를 하는것은 좋지만 기존에 하던 유저도 좀 생각해주시면 좋겠습니다 1년정도 쉬다 왔는데 티파니 등 4티어 이하 전차가 다 쓰래기가 되면 어떻합니까? 자주포 전차가 자주포역할을 못해게 만드는것은 아니라고 생각합니다 뉴비들을 모을려면 전차를 개편하는것이 아닌 시스템을 개편하시는게 더 좋았을듯 합니다 (전의 UI, 벨런스등 예전이 더 좋았음) 게임은 재미있는데 탄을 제대로 쐈는데 유폭이 될 탄인데 그냥 탄이 사라지는데 조금 그렇네요. 이것때문에 별점 4점입니다 3.25일 또 업데이트 22. 2. 16 또 업데이트가 안돼요.. 왜 자꾸 이런 문제가 생길까 ? 멍청한 업그레이드 담당자 제발 잘라 버리자 22.1.4 또 업데이트 21.12.27 또 업데이트 그런데 업데이트 하라는 말만 되돌이표처럼... 현재 업데이트 안되고 있는 중입니다 . 담당자는 제발 살펴보세요 . 왜 업그레이드가 안 되는지 ? ....21년 11월 19일 또 업데이트 ㅎㅎㅎ 업대이트 하면 며칠간 먹통되는 현상.. ㅠㅠ 바보들이 운영하는 회사 적당히 좀 하자 ... 뭔 업데이트를 수시로 하나? 1년에 1번만 좀 하자... ...
전체 리뷰 재밌다. 근데 역사적 고증 전차 추가는 괜찮은데 현질 전차좀 줄이면 좋겠다. Is3 하고 obj 이 오버파워다 모바일 탱크 게임은 이 탱크 게임을 따라옴 게임이 없습니다. 하지만 하다보면 메우 화날때가 있으니 주의를 요합니다. 참고로 초보는 중전차를 추천합니다. XX 아니 탱크가 하나씩 없어져!!!!!!!!!! 게다가 시간을 겁나 쏟아야되 핵쟁이도 있고 게임 관리 어떻게 하는거야!!! 현질을 안하고도 충분한 노력과 노가다로 키울수 있는 게임. 10티어 전차 하나 뽑으면 성취감도 좀 느껴지고 뿌듯함 그 다음에 다시 10티어 전차 하나 만들 생각에 버겁지만 그 과정에서 자신과 맞는 전차도 만날 수 있는거고 저는 개인적으로 만족합니다. 현질을 해야 탈 수 있는 프리미엄 전차들은 성능은 확실히 좋으니 돈벌이 할때 가장 좋습니다. 휴대폰의 베젤 사이즈가 점점 작아지면서 수리도구의 버튼은 점점 오른쪽으로 오는데 수리도구의 버튼이 10% 크기 증가가 끝이다. 수리도구 버튼은 누르기 어렵고 수리해야할 부품은 많고 상당히 불편하다 게임 재미있게하고있는 유저입니다. 어제부터 계속 접속이 안되네요 업데이트떠서 업데이트도했는데 지웠다가 다시 설치해도 아예 접속이 안되네요 저만 그런가요? 다좋은데 발사소리가너무.... 전차인데 꽉막힌소리같아요 좀더웅장하고 큰 발사음이나 피격음이있을텐데.... 아주아주 재미가있음니다 탱크사는건 힘드지만 그래도 재미있어요 꼭한번해보세요~^^ (월드 오브 탱크 화이팅!) 게임 퀄리티나 그래픽도 나쁘지않다.하지만 계정을 생성하기가 다소 어렵고 나는 구글과 페이스북연동을 해도 계정이 없다고 뜬다.그래서 게스트계정으로만 계속하고있다. 희귀탱크좀 구하기 쉽게 해주세요~~어나힐레이터 같은거~~한개 사려면 최소 일년이야~~~~젠장 동영상시청후 하루 50골드보상해주는거 사라지고 게임후 동영상시청하면 보너스포인트주는것도 다없애버렸네ㆍ 너무하네‥ 무조건 캐쉬로 사라는건가??? 소소하게 골드 포인트 모으는 재미가 없어져버렸네 재밌습니다 그런데 광고를 시청하면 보상을주는 시스템은 사라진건가요? 광고버튼이 나오질않네요 워게이밍 계정을 못만들면 게임지워도 복구가 안되니까 불편하고 환불도 안될뿐더러 한번이기면 다음판은 거의 무조건 지는게임 진짜 워게이밍 계정 없애고 지워져도 복구할수 있으면 좋겠음 소련 전차는 많이 조준력이 너무 낮고 10판을 한다고해도 이기는건 한2~3번 이기고 7~8번 짐 1. 평일 9~10시만 되면 무조건 프레임 끊김. 2. 실력별로 매칭이 안 돼서 팀에 무조건 트롤 존재. 고수는 고수대로, 하수는 하수대로 화남. 3. 유료로 파는 사기급 스펙의 전차들이 많은데, 특히 7티어 방은 유료 전차들이 다 씹어먹음. 게다가 유료 전차는 크레딧(게임 내 돈)을 잘 벌어오지만 일반 전차는 그렇지 않아 무과금 고티어는 항상 크레딧 부족에 허덕임. 4. 밸런스 붕괴. 일반 전차 중 핵지뢰 전차가 존재. 전차 테크트리를 타면서 중간에 포도 구리고 장갑도 약하고 느려 터진 폐기물 전차를 타게 되면 게임이 고통스러움....
전체 리뷰 완전 재미 있습니다:) 조종이 살짝 어렵습니다~ + 팀워크 없는 개인주의가 많으므로 잘하시길 개같네 이벤트로 프리미엄 전차 간간히 뿌리고 퀄리티 높은 그래픽으로 눈이 힐링됩니다. 하지만 고의적인 트롤링을 하는 사람이 너무 많아서 지는 경우가 과반수입니다. 이점을 고쳐주시면 좋을거 같습니다. ... 다 좋아요. 그런데 183화력이 PC보다 칼질당해서 왔고, 거기다가 바펜트리거형 E-100도 없고, 삭제된건 알겠는데 블리츠에서만이라도 있게 해주세요. 그리고 183데미지도 PC버전 수준으로 업그레이드 시켜주시구요. 그리고 FV4005도 183mm주포로 교체해주세요. FV4005는 고증에 마 춰주셨으면 하는 바램입니다. 사람도 7명으로는 적으니까 최소한 10명이서 한 팀을 이룰 수 있게 해주세요. 블리츠에서도 자주포라는 병과를 주셨으면 좋겠네요. 그러면 더 할 만 해질것 같아요. 더군다나 접속지연 등도 해결 부탁드리겠습니다....
전체 리뷰 다른건 다좋음 근데 맵이 너무 단순하고 비슷함 컴탱의 맵으로는 비교하면 안되지만 그래도 너무 단순하고 같은 래파토리 마냥 몇천판씩 계속 하다보면 질림 아니면 한판에 플레이어 수를 늘려주면 좋을듯 실제 탱크를 모는 것 같은 생동감과 딜을 넣을 때 재미는 있는데 플래이를 반복할수록 속답답해 뒤질것같고 이상한 rng는 매번 탄을 소멸시키고 월탱 전선잡는 법 등 공부할수록 팀원들의 행동거지에 감탄하는 게임. 초반에 재미만 좀 보고 그 이상으로 모든 탱크트리를 탄다던지 그런생각 하지마셈 시간낭비임. ps) 그리고 영국은 독이다 무조건 걸러라 초반에 영국선택했다가 망함 ㄹㅇ 소뽕게임ㅋㅋ 하.. 클랜 쳇팅창이 아예 안열리고 연결이 끈어젔다고 뜨고 클랜원들과 소대 플래이도 할수없고 쳇팅도 할수없어 답답 하네요 빠른 점검 부탁해요 재미는 있는데 모바일데이터로 연결하면 왜 연결이 안되나요? 와이파이는되던데;; 생각보다 재미있음. 하다보면 질릴때가 있은데 그때는 월탱블리츠 영상 보면서 뽕채우고 하면 좋음ㅋㅋ 게임에서 탱크 추천임 초반에 는 소련전차를 추천함. 중반 정도가면 미국전차 도 같이 섞어쓰면 괜찮음. 리뷰로 무작정 밸런스좀 이러면서 뭐라하지 말고 탱크 업글하거나 살때 좀 알아보고 사셈 밸런스 안맞는게 아니라 자기가 못하는거임 아니 자꾸 전차들이 순간이동을 합니다. 까끔씩 핑이 700까지 올라가는 경우도 있고 평균적으로 핑이200이상 입니다. 이 높은 핑으로 인해 게임에 큰 영향을 저한테 주고 있습니다. 핑때문에 한순간에 이게임을 지워버릴수 있습니다. 핑 최적화 좀 ㅎㅎ 일단 골탱이 일반탱크와 성능이 크게 다를게 없습니다. 반면에 현질해야 살 수 있는 탱크는 너무 성능이 일반탱크와 차이가 큽니다. 물론 현질이니까 그럴 수 있지만 게임의 판도를 아예 뒤바꿀정도로 성능차이가 매우 큽니다. 다음으로 서버 잔렉이 좀 많습니다. 여기까지는 그저그런 문제일 수 있지만 다음 문제는 좀 심각합니다. 발포할때 체감상 0.7초정도 늦게 발포되는데 이 0.7초 엄청 크게 작용합니다. 심지어 가끔씩 자신이 쏜 포탄이 사라지는 버그도 있는듯합니다. 포탄궤도도 안보이고 착탄이펙트도 없는데 버그라면 얼른 고쳐주셨으면 좋겠습니...
전체 리뷰 중국인, 동남아 애들만 없으면 갓겜. 현질해서 사는 탱이 지나치게 좋다라고 하는데, 확실히 몇몇(그래봐야 4대)은 그런 탱이 있음. 다른 현질탱들은? 그중에 똥탱도 있고, 좋은 탱들도 본인 실력이 따라주지 않으면 쓸데없음. 그런 면에서 밸런스는 잘 맞음. 그러나 아시아 서버의 중국인, 동남아인들 게임 기본도 모르는채로 아군에게 민폐주고 하는거때매 빡침. 8.4 업댓 플스만 안되는 이유가 뭔지? 절대 이게임은 모든 탱크가 모든면이 완벽해 밸런스가 맞는게임이 아닙니다 경전차, 중형전차, 중전차, 구축전차 라는 병과가 있고 각 병과마다 장단점이 존재합니다 경전은 속도가 좋지만 장갑이 약한 대신 시야가 넓어 정찰에 좋고 중형은 가장 준수한 편인 탱크고 중전은 거의 다 장갑이 두텁고 포가 쓸만한 대신 기동이 느린 편 입니다 그리고 구축은 대부분 장갑이 얇지만 포가 매우 뛰어난 포를 장착했기 때문에 본인의 성향에 맞는 병과를 고르시면 좋겠습니다 제발 경전차 고르고 돌격하다가 맞아 죽고 밸런스 망겜 빼애액 하지 마시고요;; 조작감도 좋고 타격감도 좋고 전차 밸런스도 몇몇 전차만 빼면 좋습니다. 근데 왜 평점 1점을 줬냐 일단 최적화가 개똥망을 넘어서 그냥 발로 한 수준입니다. 솔직히 렉걸리는 문제는 그래픽 최소로 하면 해결되지만 최적화문제로 핑이 차이나는건 어떻게 할 수가 없어요 아시아 서버 기준으로 아군,적군 전차가 순간이동 한다거나 핑때매 포탄이 날아가다가 사라지고 적 전차가 엄폐물에 숨어있어서 나오려는곳을 보고있다가도 갑자기 불쑥 나와서 쏘고는 다시 엄폐물 뒤로 숨어요. 이건 제대로 플레이가 불가능합니다; 그나마 러시아 서버가 핑이 좋다는데 서버...
전체 리뷰 게임중에 팅기더니 '서버 연결이 끊어졌습니다'나오더니 로그인이안됨... 요즘은 플레이만 많이하면 보상같은게있어서 전보다 티어올리는데에 힘이되서 이제막시작한 플레이어한테 아주도움이된다고 생각합니다. 게임은 진짜 재미있어졌는데 몇몇 전차 밸런스 좀 맞춰주시고 요즘세로나온 맵들이 너무 재미없어요 좀고쳐주셨으면 좋겠습니다 주포소리도 바꿔주셨으면 좋겠습니다 전에있던앱이 사라져서 아쉽네요 (blitz modder) 제가제일 좋아하는게임이라 믿고 기다리겠습니다. 지금 계속하다보면 문제점이 많아요 그러나 관리는 하는 것은 눈에들어오는데 작년까지만 해도 플레이하는 것과 전차도 골탱만 남기고 수집 전차가 되고 또한 이벤트는 전부 현질 유도가 대부분 입니다 다시 옛날처럼 많은 것이 변화된 게임이 되길 기다림니다 물론 좋은점도 많이 있어서 그나마 버티고 있습니다 출시 초기때부터 했지만 빠지면 헤어나올수없는 게임. 접은지 좀 되었지만 시작하면 물불안가리고 앞으로만 가지 좀 말고 아군탱과 적탱 리스트 확인하며 어디가 약할지 생각하시고 방향을 선택. 중형은 정찰이 최우선이고 그래야 상대가 어디로 가는지 알수있고 중전은 라인버텨주고 구축은 그뒤에서 지원만해줘도 거의 이기는 게임. 팀 잘못만나면 10판이상 내리질수도있고 그래서 열받아 접는 게임. 상대가 중전이 엄청 강세인데 우리 중형들 갑자기 중전 라인으로 돌격해서 순삭되면 서서히 뚜껑열리는 게임. 갤럭시 s21 울트라 사용자인데.. 모든 광고보기 기능이 안됩니다.. 이유가 뭘까요? 장점 1.일단 재밌음 킬링타임용으로 하기좋음 2.최적화 잘함 원작이 PC인 게임인만큼 용량과 그래픽같은 요소들이 저장공간이나 게임성능에 엄청난영향을 줄것인데 최대한 그래픽 줄이고 맵크기 / 전차수 반토막내서 최적화 시킴 3.부품 키우면서 성장시키는 맛이 있음 단점 1.경험치 얼마안줌 전차를 구입할려고 필요한 경험치수를 보면 65K이러는데 진작 게임에서 주는보상은 백단위 심지어 필요부품까지 더하면 어마어마한 양의 시간이 필요함 2.과금유저와 무과금 유저의 차이 다른게임도 마찬가지지만 여기도 심함 일단 프리미엄전차 일반트리에 있는 전차...
전체 리뷰 스팀 wot로 플래이중인 유저입니다. 현질유저 들도 별로 없고 해보니까 다양하게 탱크 수집 가능합니다 단점은 밸런스가 30%?확률로 언밸런스하개 매칭이 되는 경우가 있습니다. 제가 바라는건 밸런사 조절입니다. 흠.. 나왔던 모드 중에서 저 중력 모드, 업라이징 모드, 현실 모드 등 더 있었던 걸로 기억하는데 이런 특별한 모드들을 특정 기간만 오픈하지 말고 차라리 아케이드 모드라고 따로 만들어서 랜덤으로 하거나 선택으로 게임을 했으면 좋겠어요. 아니면 예를 들어서 어느 기간에는 현실 모드를 오픈했다가 마지막 날에 이어서 다른 저 중력 모드를 오픈하는 거죠. 사실은 저 중력 모드가 저에게 너무나도 큰 영향을 미쳐서 저 중력 모드에서 헤어 나올 수가 없네요. 아 그런데 유저들의 피드백을 좀 더 쉽고 빠르게 들을 수 있게 적극적으로 운영해 주셨...
전체 리뷰 7티어 이상 갈려니 시간도 걸리고 매판 이겨야해서 좀 별로 인 듯 하네요. 그리고 이벤트나 상점에 나오는 전차를 사기위해 현질을 해야 되니....이 부분은 전차 한가지를 선택하는 이벤트가 자주 나오면 좋겠네요~~게임은 재미있네요 이 부분들만 수정을 하면 좋을 것 같네요~~다들 이 게임 즐겜하세요. 추천!!!!!!!!!100% 과금요소가 있지만 과금은 밀덕들에 선택요소지 탱크 자체에 성능차이는 거의없다. 하다가 질리면 다른겜하다가 다시돌아오게된다 무조건 난 3번째 돌아왔다 이거 부계정으로 잘되는 겜같음 그리고 기관총도 쏠수있으면 좋을것 같음 워썬더 비슷하게 이번 패치 잘한듯 합니다 뉴비들도 여유있고 즐겁게 플레이 가능하고 무엇보다 벌기 힘든 크레딧을 벌기 쉽게 되어 전 만족합니다 수준별 com과 대전모드가 있으면 좋겠어요.[ai모드] 게임하는 사람이 적어서 연결이 되지 않습니다. 너무 오래 기다리게 됩니다. 시간은 모든것이다! 초급자도 할수있는 전투모드가 필요합니다. 실력차가 커서 입문 유저가 떠나기 쉬워 보입니다. 승패외 즐길 수 있는 디테일이 부족합니다.1.바위 파괴와 비산, 낙석(주변 전차에 데미지)2.집의 창문과 문의 파괴(모든것)3. 쓰러뜨린 나무와 떨어뜨린 큰돌의 이동로 차단(밀기,포격)4.나무 포격으로 파괴와 흔들린 나무의 낙엽 효과5.포격으로 절벽의흙 쏟아짐(산사태)6.포탄의 화염 효과 미미함...
전체 리뷰 버그게임. 정상 작동 될 땐 재밌는데 그런 판은 5판중 1~2판 뿐. 이 게임을 6년간 해왔는데 게임이 점점 엉망이 되어감. 옛날이 그립다. 추억의 게임, 이젠 삭제한다...... 아니 전투하다가 갑자기 전투하기전으로 돌아가면 어쩌자는건가여 지금은 접속도 안되네요 이게임에 급식이 많은건지;; 왜이렇게 수준이 떨어지는지;; 월탱은원래 9.10티어 올리는건 헬입니다 pc에서도 대다수유저가 골드를 이용해 자경을 함께해서 올립니다.또한 매치메이킹에대해 말이 많은데 예를들어 현 월탱 블리츠는 5,8티어가 가장 많아서 4티어 7티어는 상대적으로 5,8탑방에 매치가 많이 됩니다.그리고 한티어차이는 충분히 이깁니다 pc는 4티어가 6탑방 5티어가 8탑방가는건 기본입니다. 본인 프로필을 눌러 승률을 보세요 55넘지못하면 팀탓 하지 마시길 바랍니다. 본인 실력도 팀이랑 같은겁니다. 그리고 전차 약점도 다 알려...
전체 리뷰 게임을 플레이하는데 있어서 모바일인데도 그래픽이 수준급이고 박진감이 넘쳐서 좋은데 게임을 다시 깔고 리소스를 다운받을때 너무 시간이 많이 걸려 스트레스를 받습니다. 그래서 재설치했을 때 리소스 좀 다운받지 않도록 해 주세요. 클라우드에 진행상황을 보관해서 게임을 다시 깔았을 때 리소스를 다운받을 필요없이 클라우드에서 진행상황을 불러와서 할 수 있는 방법도 있고 정말 다양한 방법들이 있는데 너무 짜증이 납니다. 제가 힐링을 하고 스트레스를 푸려고 게임을 하는건데 오히려 스트레스를 받고 가니 영 마음에 들지 않습니다. 그래서 현재는 삭...
전체 리뷰 솔직히 이겜 옜날같지 않음 2015년부터 해오면서 느낀건데 전에는 업데이트한후 첫 주말에는 프리미엄 계정도 2일씩 줬었고 주기적으로 업데이트 하면서 새로운 전차라인도 추가하고 버그수정도 진행했었음. 물론 서버는 안좋았지만. 근데 지금은 솔직히 개발진을 줄이고 다른게임에 배치한거같음 패치도 띄엄띄엄하고 새로운 전차라인 떡밥도 안나오고..아무튼 재밌게 했는데 예전같지 않아서 많이 아쉬움 어제부터 갑자기 데이터 동기화시간이 상당히 길어졌습니다... 얼마나 길어졌냐면,3분동안 그화면 그대로입니다. 전투 진입시에도 마찬가지로 3분동안 매칭 화면만 보고있어야 합니다,,, 그동안 게임은 시작되어있고,,, 지웠다가 다시 깔아도 그대로인데 빨리 고칠수 있기를 희망합니다 엑박패드 블루투스 연결로 조작할수 있을거라 기대했는데 안되네요 음... 일단 핑에 대한 렉이 너무 심하네요 그리고 프리미어 전차가 잘안나오는 것도있고요 근데 갓겜인건 맞아요 다양한 탱크와 각 탱크마다의 특징들이 잘 나타나 있어요 그래서 어떡해 사용하냐에 따라 천차 만별이거 같아요 뉴비 유저분들은 저격좀 안했으면 하네요 구축 제외 그리고 처음 하는 분들을 위한 튜토리얼을 추가 해주세요 공방 가면 헐다운,역티,궤도 흡수,티타입등 기술들을 많이 쓰는데 처음하는 분들은 그걸 모를것 같습니다 튜토리얼 개선해주세요 다좋은데... 저티어들을 위해서 라는명목으로 저티어 전차들이 몇몇삭제되고 포들도 몇개 없어졌죠.. 그런데 고폭탄 위주로 사용하거나 데미지가 강한 포들을 너프를 어느정도 시키더라도 다시 복귀시켰으면 좋겟습니다. 저티어에서 연구할것도 별로 없고 고티어로 올라가자니 돈이 부담되서 4~5티어에서 머물고있는데 장비나 전차를 새로이 만들고 시험해보는 것이 좀 줄어들어서 아쉬운듯한느낌이 듭니다. 그리고 1~3티어는 나라별로 1개정도벆에없어 살짝심심한 느낌도 나고요. 그저 개인적인바램입니다 양아치냐 경전차는 10분이지나도 들어가질못하네 돈들여서 투자해야지만 접속시키는거냐 뭐야 7.1 업데이트를 하고 별5개에서 별1개로 추락함. 노트텐플을 사용중이어서 UI도 넓게 사용중이었는데 어느순간 말도없이 갑자기 화면을 축소시켜서 깔끔하던 화면이 중국에서 제작한 조잡한 게임보다도 인터페이스가 구려졌다. 복구 안하면 앞으로 현질은 없을 것입니다. 돈 벌려면 똑바로 일하십쇼 한줄평으로 말씀드리자면 워게이밍이 괜히 워게이로 불리는겠는가 입니다 단점들을 찾아보자면 1. 서버상태 우선 이게임은 서버핑이 매우 안좋기로 유명하며 심한날엔 전차가 날아다니는 광경을 보실수 있습니다 2. 매칭시스템 나름대로 괜찮다 생각하는 유저도 많지만 가끔,혹은 자주 밸런스가 안맞는경우가 많습니다(하지만 이상하게도 이길수가있는 신기한 게임) 3. 팀원 이게임을 해보신분이라면 아실테지만 입터는 인간들, 머리에 우동사리 차있는 인간들이 매우 많습니다 게다가 트롤러도 간간히 보이죠 이게임을 주 종목으로 삼으실분은 고혈압은 패시브로 달고...
전체 리뷰 게임은 빠르게 진행되는데 잡히는 시간이 길어서 흐름이 끊겨 지루함 감이 있습니다. 잡히는동안 대기화면을 띄우는 대신 채팅을 할수있게 한다면 게임의 흐름이 끊기지 않고 채팅 시스템도 더 활성화 될것입니다. 그리고 평점 시스템 사실상 의미가 없어서 트롤러들이 활개를 치는데 평점이 낮을수록 게임 잡히는 시간을 더 늘려주세요 트롤러들 때문에 게임 할 맛이 안납니다. 6년차 탱창 인생입니다. 이 게임은 진입장벽이 매우 높습니다. 지금 시작하는 당신이 이 게임에 대하여 따로 공부하지 않는다면 매우 어려울겁니다. 하지만 어느 게임보다 밸런스가 잘 잡혀 있습니다. 탱크마다 약점이 있고 강점이 있으며 그걸 맵에 적용해 어떻게 활용하는지에 따라 달라집니다. 탱크는 사람처럼 말랑말랑한 속살을 가지고 있지않습니다. 쏘는대로 딜이 들어가는게 아니라는겁니다. 왜 내가 쏘는 탄은 다 안뚫리는지 푸념하지 마시고 내가 쏜 탄의 관통력과 적 전차의 방호력을 생각하십시오. 그리고 승률 60~70인 사람들도 여러분들과 같...
전체 리뷰 씁...뭐라 해야 할지... 일단 이 게임을 1년동안 한 유저로서의 주관적인 평가입니다. 일단 신규 유입 유저들이 어려움을 많이 겪을듯 합니다. 4티어 전차부터는 5티어 전차들에게 끌려가는 경우가 수두룩하기 때문에 저도 접을뻔했네요. 그 외에도 인터넷 끊김 문제등 개선방안이 절실하지만 아직은 버틸만 합니다. 부활모드에서 게임시 재장전이 지속되고 발사가 안되는 현상있음 나갔다오면 해결되지만 또 재발하거나 그사이 죽는경우가 있어서 개선해야할것 같습니다. 특히 포 발사시에도 로스율이 뜨지않음에도 발사가 늦게 되며 직진만 할수있는 경우도있음 탱크 벨런스는 우수한 편이다. 기동성, 장갑, 화력 등 능력들이 균형있는 중형전차, 강한 화력과 장갑으로 전선을 유지하는 중전차, 후방에서 강력한 화력으로 아군을 지원하는 구축전차와 빠른 기동성으로 적을 발견하고 적의 후방을 치는 경전차 등 다양한 전차의 종류가 있으므로 그 특성을 알고 플레이하기를 바란다 다 좋습니다. 하지만 한팀당 인원수 최소 10명이상. 또한 맵이 더 맓어져서 중전차, 구축, 중형전차 등등 좀더 전술적인 플래이를 하고싶으며 전차장 보이스는pc버전과 동일하면 좋겠습니다. 또한 컴터 월탱과 호환되었우면 하는 좋은 바램이있네요. 월탱은 정말 잘만둔 겜이라 상각합니다 컨트롤이 좋고, 조준경을 끼면 적이 움직임에 따라 주포가 자동으로 움직여 쉽게 적을 처치하는 것이 좋습니다. 또, 일부 장애물을 부술 수 있다는 것이 좋네요. 그런데 리소스 다운로든가 뭔가가 좀 오래 걸리고 용량도 많이 차지하네요. 이것좀 어떻게 해주세요. 저는 pc로 월오탱을 즐기는 유저입니다! 모바일도 재미있어서 깔아봤는데 역시는 역시였네요... 꿀잼입니다! 하지만 모바일인 만큼 퀄리티나 이런게 조금 떨어집니다 랙도 좀 걸리구요 그리고 모바일이든 pc든 탱크 모으기가 너무 빡셉니다 또 바라는게 있는데 탱크에 달려있는 기관총을 쏘게할수 있으면 좋겠습니다 마지막으로 자주포가 없는게 아쉽네요 pc는 있는데... 그래도 넘나 재밌습니닷! 전차를 좋아하거나 탱크게임을 좋아하는 사람에는 딱 안성맞춤 게임으로 추천 하겠습니다. 그리고 탱크를 많이 아는것은 아닌데 그래도 탱크를 보면 깐지와 그 탱크만의 매력에 빠져서 이 게임만 4년을 하다가 지금은 안하고 있지만 오늘 다시 깔아서 할 생각이 있고요. 제가 제일 좋아하는 탱크는 없지만 그래도 딱 재미있는 게임으로 추천하고 싶고 데이터나 배터리 이런게 많이 달아버리는게 좀 그렇지만 이 갓겜을 하기 위해서는 어쩔 수 없습니다. 그리고 제가 또 1년만에 지금 다시 접속하지만 옛날에 많이 키운 탱크를 보면 지금 다시 깔아도 재미있습...
전체 리뷰 하면서 느낀점 1.현질유도 일단 개인적인 생각이지만 현질유도가 좀 높아요 좋은 전차를 얻을려면 물론 노력해서 할수도 있습니다 하지만 현질을 안하면 상당히 오래걸리고 힘들어요 현질을 해서만 얻을수 있는 전차도 있고요 2.그리고 버그가 있습니다 이거는 다른 게임들도 포함되는 문제니까 넘어갈게요 3.무과금이 힘들다 이게임을 하면서 느낀점이 좋은 전차를 현질해서 얻은 사람과 현질을 안하는 무과금유저의 차이가 큽니다 4.적은보상 월오탱을 하다보니 1판하고 들어오는 보상이 상당히 적어요 저만 그렇게 느끼는지는 모르겠지만 보상이 상.당.히 적습...
전체 리뷰 게임 사람인원수 7ㄷ7이 아닌 9ㄷ9로 올려주세요. 요즘 새로운 전차 만드는 것에 빠진거 같은데, 그야 그것도 나쁘지 않다고 생각해요. 그래도 골탱으로 9티어 10티어에 뉴비들이 와서 경력있는 유저분들을 민폐 끼치게 해선 안된다고 생각해요. 애시당초 골탱자체를 만드는것 자체가 별로라고 생각함. + 전차간의 밸런스가 매우 안맞아요. 진짜 어떤 전차는 12판에 한번 볼정도였어요.. 아마 강력하고 인기있는 전차들만 골라서 하기 때문이겟죠.. 결론적으로 사람인원수를 늘려주고 게임 승률과 판수로 사람들을 짝짓게 해서 게임을 진행시켜주고 전차...
전체 리뷰 모바일 게임이나 PC로 하게되는 게임이네요. 모바일 조작이 매우 어려워요. 오른속으로 화면도 돌리면서 탄을 쏴야하는데, 엄지손가락 한개가 바쁘네요. 상대방 전차를 조준하고 손가락을 뗄 때 탄이 쏴졌으면 좋겠네요 2015년 부터 하고 있는데 가히 추천할만 합니다. 밀덕이라면 월탱은 필수 코스이지요. 전차 수집하는 재미도 있고 또 국가별로 나뉘어져있어서 각 나라 고유의 탱크를 몸소 체험할 수 있습니당. PC로는 스팀 버전으로도 출시 돼 있어서 쾌적하게 하고 싶을 땐 주로 PC로 합니당. 서버 자체도 별로고, 티어트리들도 개판입니다. 조금만 핑이 올라도, 전차가 조종하기 매우 매우 힘들어질정도로 까다로워지고, 밸런스 문제도 많이 심각합니다. 이게임을 시작하지 않으시길 추천드려요...ㅎ 솔직히 모바일게임들중 이겜의 물리엔진과 그래픽의 조화는 원탑이라 할수잇을정도며 fps로서의 타격감 또한 만만치 않다. 유저사이에 트롤로 인한싸움이나 개인전적관리및 포의 분산도 (확률적), 인터넷 환경 문제로 스트레스를 받을수 잇지만 이러한 단점은 훌륭한 게임성으로 거의 묻어진다.(실제로 이겜 욕하면서 끊는사람 잘 못봄) 다양한 전차들과 다양한 전장들이 있고 상당히 재미있는 게임이지만 경전차 혹은 중형전차들이 여러 전략을 구사하기에는 다소 좁은 맵들이 많는 것 같습니다. 맵의 수보다는 맵의 질이 더 좋은 게임이 되었으면 합니다. 얼핏 보면 전차타고 온라인상에서 플레이어들과 전투하면서 재밌게 즐길 수 있는 게임이지만, 맵에 대한 이해와 자신의 역할, 자신과 아군 상대 전차까지 완벽히 이해하고 있어야하는 고난이도라고 할 수 있는 게임이다. 3~5년 넘게 한 고인물 유저들이 주를 이루고 있으며, 초보자들은 게임 난이도가 상당히 높다고 생각할 수 있다. 처음에는 1~5티어 전차를 몰며 재미를 느끼고, 게임에 대한 이해를 높이고 어느덧 적응이 된 것 같으면 6~7티어 전차로 내 실력을 키운다는 느낌으로 하고, 그리고 10티어를 두 세대 뽑을 때 쯤이면 어느새 고여있...
전체 리뷰 일부러 매칭상태를 끔찍하게 만듦으로써 짜증을 느낀 유저가 강해지기 위해 과금하도록(패배에 대한 분노를 과금으로 이어지게)유도하는 아주 더러운 수법을 쓰는 게임. 옛날엔 덜그랬는데 이벤트 한정전차들이 대거 나오기 시작하면서 대놓고 꼬우면 과금하라는 플레이 경험을 선사하고 있다. 정신건강과 아까운 시간을 위해서 플레이 하지 않는걸 추천합니다.",4.2,전략
