title,reviews,scores,genres
스도쿠 - 클래식 스도쿠 퍼즐,"아니 재밌긴 한데 어떤 난이도든 몇번을 해봐도 너무 쉬워요;; 첨엔 그냥 운이 좋아서 쉬운게 걸렸겠거니 싶었는데 전문가모드도 짧으면 10분 이하 길어도 20분 이하.... 그래도 접근성이나 조작법도 괜찮고 UX도 편리해서 계속 하게되네요. 실수 세번 제한둔것도 나름 괜찮구요. 치명적인 단점이 존재합니다. 첫째. 메모의 기능을 활용할 때 그 자리에 올 수 없는 숫자는 메모조차 할 수 없다는 것입니다. 이렇게 되면 플레이어는 메모기능을 잘 이용만 하면 아무 생각없이 게임을 클리어하게 되거나, 자신의 생각이 맞는지 확인하는 용도로 이용하게 되어 힌트를 사용할 필요도 없어질 뿐더러 3번틀렸을 시 기회를 대가로 하여 나타나는 광고도 사실상 무의미하게 되어버립니다. 둘째. 메모의 자리에 그 자리에 올 수 없는 숫자는 자동으로 지워집니다. 이러한 이유로 아무생각없이 해도 게임이 클리어가 되어 결국 스토쿠가 플레이어에...
전체 리뷰 게임 자체는 맘에 드는데 광고가 지나치게 많이 뜨고 광고가 나오는 중에는 광고를 중지하는 기능도 없어 광고가 끝날 때까지 무조건 기다려 닫기(x)를 해야하는데 정말 짜증나고 욕나온다. 광고 중에도 닫기는 할 수 있도록 했으면 좋겠다. 처음엔 적응이 안되서 너무 어려웠는데 몇번 하다보니까 어느새 적응이 되서 재밌고 하나하나 깰때마다 신기하고 머리도 써야해서 여러모로 재밌네요!! 이건 뭐 디자인측면에서 완전히 잘못됐습니다.광고 작작넣고 그냥 인앱결제류 만드네요. 처음엔 그냥저냥 깔끔하고 좋았는데 업데이트를 한건지 갈수록 광고가 심해져서 이젠 한판 하고나면 1분짜리 광고를 스킵없이 봐야 합니다. 게임한판 중~고급은 2분 안으로 끝나고 익스퍼트는 돼야 7분 넘어가는데도요. 이건뭐 차라리 인앱결제를 하고 말지 클리어하고 보상을 받아도 모자랄판에 시간만 축내며 패널티를 먹이고 있으니 유저 입장에서 솔직히 할맛 안납니다. 게임의 재미와 클리어의 달성감보다 광고로 인한 손해가 적어야 플레이를 하지 이 게임이 스도쿠 처...
전체 리뷰 무슨 끝까지 봐야하는 광고가 수시로 나옵니까? 정도껏 나와야 참고 게임하지 끝나면 나오고 추가 빠른 연필이나 힌트 얻을려면 또 광고 나오고 시작하면 또 광고 나오고 그렇다고 중간에 끊을수도 없는 전부 봐야하고 무료라도 정도껏이지 질리게 만드네요. 0점 주고 싶은데 없어서 1점 줍니다 광고 실화? 적당히 있으면 말을 안하지 게임 한판 끝나면 30초 광고 뜨고 3번틀리면 광고 또 뜨고 겜하기 넘 힘들어요.. 없애라는 말은 아니고 좀 적당히 넣지 거의 도배수준ㅠ 갑자기 라이팅 모드가 사라져서 설정 뒤적이고 하다 안돼서 지우고 다시 깔았더니 기존에 사용할 때와 화면이 달라서 보니 일일 미션 같은 것이 사라져 있었습니다 그래서 다시 지우고 깔기를 몇 번 반복해서 인건지 시간상 하루가 지나서 인건지 화면이 기존에 사용하던 때와 같아졌고 라이팅 모드도 다시 생겼길래 계정 동기화를 했더니 라이팅 모드도 사라지고 카프리콘에 들어가서 화면을 위아래로 움직이거나 게임시작을 누르면 튕겼습니다 여러번 삭제했다가 다시 깔고 계정 동기화를 해봤지만 같은 현상이라 그냥 삭제 후 다히 깔아서 계정 동기화하지 않고 ...
전체 리뷰 광고좀 적당히 넣으세요. 광고스킵이라도 되던가 무슨 게임하나할려하면 30초짜리 영상 3개를 봐야하는겁니까? 이럴거면 다른게임 찾아서 하지 재밌고 할게 없을 때 하기 좋은 게임이에요.아이가 스도쿠를 워낙 좋아해서 한 번 해봤는데 재미있어 하네요.하지만 광고가 너무 많이 나오고 길어요.ㅠㅠ 게임은 깔끔하고 재밌고 좋아요 첫날만 리뷰 유도하려고 광고가 없고 둘째날부터는 광고가 많긴해요 그래도 재밌습니다 게임은 재미있지만 게임마다 광고가 있고 광고가 너무 길어서 별 2개 뺐어여 너무어렵지만지식을아려줘서별5표그리고 너무 넘나 😍 재밌습니다 그리고이런개임 지식을알려줘는 개임을만들어주서 감사합니다 그리고 저초등 2 임니다 어쨌든이개임을마들어주서서 감사합니다 다른 스도쿠들보다 체계적이고 중간배틀있어서 재밌는데 광고가 너무난무하네요~~ 완전 지루하고 재미 없어요.그리고 광고는 얼마나 많은지 별 1개 드립니다 한 판당 광고 하나 너무 심하다;; 이게 스도쿠 앱인지 광고보는 앱인지 궁금할 정도 ※3번틀리면 그후로 틀릴때마다 광고봐야해서 빡친다는분들 보세요 설정(톱니바퀴모양) 누르고 '실수 한도' 해제하면 몇번이고 틀려도 광고 안나옵니다 다만 매판 끝나면 나오는 광고는 어쩔수없네요... 재미있고 적당히 어렵습니다. 처음엔 '단단한' 모드도 어렵게 해결했는데 이젠 '단단한' 은 좀 쉽고 '전문가' 모드는 여전히 어렵네요 ㅎㅎ 힌트 쓰거나 찍어서 맞춰야 해결하는 경우도 있고 해결하는데 1시간 넘게걸리는경우도있고..ㅠ 그래도 재밌습니다. 단점은 이거 하면 배터리가 너무 빨리달아요. 백그라운드에 켜놓기만해도 배터리 엄청빨리담......
전체 리뷰 좌우 위아래 똑같은 숫자가 없는데 어떻게 틀렸다는걸 알수가 있는지 궁금한데 가르켜주는 사람은 없고 해서 더 하면 왜 틀린거지 궁금증만 쌓이다 스트레스 받을거 같아 게임 안할려구요. 게임은 즐길려고 하잖아요. 처음엔 저도 재미있다고 즐겼습니다. 초급 처음 에 재미있었는데요. 중급 왜 틀렸는지를 모르겠네요. 빠빠~ 광고 겁나 많고 심지어 게임한판끝나고 넘어갈때 광고용 버튼만 먼저나오고 2초?정도있다 일반버튼 나오는건뭐임 적당히많아야지 광고를 유도하기나 하고 선 개 넘네 진짜 리뷰 잘 안쓰는데.. 1판에 광구 2,3개는 너무하지 않나 싶다. 뭐만 하려하면 스킵이나 x표 보이지도 않는 광고가 계속 나오니 짜증나서 이만 하차. 광고 너무 심한거 아님? 재미있게 했었는데 광고가 도를 지나쳐서 삭제함 수도쿠 게임간 나오는 광고는 이해합니다. 그러나 첫게임 시작전 장시간 멈추게 할 수도 없는 새로운 게임광고는 정말 짜증나게 합니다. 난 수도쿠만 하고 싶어요. 광고는 많아도 재미있었는데 언제부턴가 숫자넣는 입력방식이 갑자기 바뀌어서 자꾸 틀려지고 적응이 안되서 못하겠음. 광고가 많아도 너무많아 도저히 이어서 할수가없는 정도네요.문제푸는거보다 광고보는시간이 더 많은거처럼 느껴지는..삭제할랍니다. 광고너무 많음. 한게임당 기본 광고 2개. 힌트등 뭘주는데 줄때마다 앞뒤로 광고 광고보다죽을듯 에휴씨... 한게임당 광고 두세개는 넘하지...그것도 건너뛰기 스킵버튼 잘려나가 마냥 무려 1분동안 봐야하는 망할 센트X 광고!!!!! 참다참다 이런 리뷰 첨쓰네!!!! 게임자체는 깔끔하고 군더더기없이 이용이 편리하게 잘만들어졌어요 하지만 초반에는 안그러더니 일정시간이 지나니까 광고가쏟아지는데 게임중간에 갑자기 광고가나오거나 잠깐 카톡만보내고와도 광고가나와요 아무리 무료버전이라 광고를 봐야한다해도 게임이 끝나고 혹은 시작하기전에 봐야한다거나 성공댓가를 더받기위해서 봐야한다던가 한다면 납득할수있고 기꺼이볼거예요 싫으면 돈내고하지뭐 라고 쉽게생각하기엔 게임이용자에대한 기본 예의가 없는것같아요 광고를 보기싫다가 아니라 게임의 맥락자체를 끊어버리는건 싫으면 결제해라는 태도인건데 구지 결제까지하면서 즐길 퀄...
전체 리뷰 시간 때우기 용으로도 괜찮네요. 시간 가는 줄 모르겠어요. 광고도 별로 없고 초급 중급 등등으로 자기에 맞는 난이도로 선택할 수 있어요. 머리쓰는거 귀찮고 싫으신 분들은 비추천합니다. 평소 스도쿠 좋아합니다. 공짜로 할수 있는데 광고 이정도면 과하지 않은거 같아요 틀린 갯수가 너무 적어요.그리고 광고가 너무 많이 나오네요. 이거는 진짜 재미있고 머리도 좋아지는것 가타서 좋네요 심심할때 즐겨 할수있을거 같습니다 그런 의미로 저는 별5개! 게임은 잘만든 것 같은데 광고가 많고 광고에서 나가는게 친절하지 않네요. 스도쿠 어렵게만 생각했는데 쉽고 생각할수있고 재미있어요 머리도 쓰고 이벤트 게임도 재미 있고 배틀도 아주 재미 있습니다 광고가 많다는게 단점이만 재미있어서 계속 하고있습니다. 광고도 얼마 안나오네요 광고가 많이 나온다고 들었는데 재미있어요 심심할때 두뇌운동할때 좋은것같네요 근데 광고가 좀 많아요 광고가 넘 심해서 흐름이 깨지고 짜증남.광고도 어느정도야지 수도쿠에는 문제 없는데 광고가 너무 많아도 너무 많습니다. 이정도면 한 게임에 하나정도...;;광고좀 줄여주심 진짜 아무 문제 없는데 광고 때문에 2개 드립니다 문제난이도가 적정한거같아요. 근데 새게임으로 넘어가는 중간에 광고는 너무 지나치네요. 닫기버튼도없구요. 대부분의 중간광고가 사운드가 포함된 광고라 조용한 자리에서 스토쿠하다가 갑자기 광고소리가 크게 들려 난감할때가 한두번이 아니네요. 광고가 수익인건 이해하지만 강제노출과 닫기버튼이없는건 너무 지나치고 불편합니다. 불쾌하기까지 합니다 수도쿠 .정말 시간 잘가게 만들고,푹 빠지게 하는 게임이내요 겜은 재미있지만 광고시간이 너무 길다. 그래서 하기 싫어진다. 광고가 너무 많아요. 좀줄여주세요.집중력이 깨져요. 광고 보는 시간이 너무 아까워서 요런 게임은 두번 다시 안한다. 이렇게 광고 심한 겜은 첨이네요 도가 지나치다 재밌게 하던 기분도 광고땜에 폭발한다 결국 제거.. 머리가 좋아지는 느낌이에요! 광고도 안뜨고 집중하기 좋아요. 재미는 있는데 3번인가 4번틀리면 지우기가 안되고 광고를 봐야 해서 좀 피곤해 지네요. 너무 좋은 프로그램입니다.다만 광고를 해도 어느정도 해야지요.광고를 아예 하지말라는건 아닌데...정도가 지나치면 안될듯해요 쉽게말해 너무좋은 장점이 99개인데 1개의 단점이 너무 커서 99개의 장점을 다 쓸모없게 만드는 효과인듯해요. 광고 하셔요 대신 적당히 해야 자꾸자꾸 게임을 하고 싶어집니다. 스도쿠 너무 좋아요.화면 하단이며 게임중간중간 광고를 적당히 해주시면 좋겠어요 광고때문에 별5개 받을 좋은 프로그램을 별3개만 드립니다. 화면 하단에 광고는 필히 삭제를 하시는게 게임하는데 방해만 될뿐아니라 게임 자체를 다 망치는 효과입니...
전체 리뷰 광고가 아주아주 미친듯이 나옵니다. 해도해도 너무 한듯 광고가 화면에 넘치게 나와서 x버튼이 없어서 게임을 할수가 없어요ㅠㅠ 게임은 좋구요 광고가 많아서 화가 날려고해요 ㅠ 좋은데 광고 진짜 오지게 많아요... 와파 끄고 해도 조금씩 뜸 게임은 좋은데 광고가 너무 많음. 심지어 그 광고들도 바로 안없어지고 x눌러도 또 다른 광고창 떠서 광고하나 끄는게 너무 번거로움 게임은 좋으나 광고가 넘 많아지네요 어느 정도는 이해하지만 심하다 싶을 정도입니다 심심할때 옛날 추억 떠올리며 간편하게 하기 좋은 게임이네요 도데체 광고를 어떻게 만들었는지 이해를 할수가 없네요. 다른 게임에서 3문제 풀때마다 광고가 하나씩 나오는데 방해가 아주 많이됩니다. 그리고 무슨 사진 하나만 띡 붙여놓고 그걸 광고라 해요. 문구도 거짓인거 알고요. 다른 사람 리뷰에 답글다신거 봤는데 광고 없애는 그런 버튼 누르라고하는데 그거 유료일겁니다. 그만하세요 비행기 모드에서 실행됩니다. 메뉴 번역이 좀 이상하지만 플레이하는 데에는 전혀 문제 없습니다. 연필기능은 매우 편리합니다. 광고는 클리어시에만 나오기 때문에 한숨 돌리기에 적절한 타이밍이라고 생각되네요. 해외여행시 필수 어플! 개발자분께: 매질->보통, 단단함->어려움, 이렇게 변경해 주세요 :) 단순하면서도 시간을 요하는 묘리가 재밌음 다른 스도쿠 는 광고가 게임중간 중간 나오는데 비해 한판 끝나고 나서 나오니 좋음 광고가 너무 많아여..,진짜.... 만족합니다. 흥미진진합니다. 물론 뇌가요. 광고가 너무 수시로 나와요.광고 없애주세요 좋은데. 광고가 너무 많아요~~ 광고가 넘 길어서 게임을 못하겠어요~~ㅠ.,ㅠ 좋아하는 스도쿠를 편리하게 즐길수 있네요 재미있음 아이,어른 모두 즐겁게 할수있어요 진짜 광고 개많네 게임을 하는거진 광고를 보는건지 에휴 머리쓰는게 은근 재밌고 추천합니다. 광고를 위한 광고에 의한 게임!!! 폰이 뜨거워짐. 고작 퍼즐 게임인데 뭘 숨겨놨길래 머리쓰는거 싫어하는데 점점 요령이 생겨서 재밌네요 게임한판에 광고가 몇개야 대체 처음 해보지만 재밌고 두뇌게임이라 좋아요.. 한판에 앞뒤로 두개의 광고.. 너무 과함 편리한 서비스제공으로 중독성 쩝니다 처음 앱 설치한 날은 광고없더니 둘째날부터 리뷰대로 광고 어마무시.ㅋㅋ 바로 삭제합니다~ 처음 시도해 봅니다 자주 하다보며 두뇌에 아주 좋을것 같네요 스도쿠 재밌는데 광고가 너무 많습니다. 매게임시 광고를 봐야해서 게임삭제합니다. 게임에 광고를 끼우는건 운영을위해 어쩔수 없다해도 광고를 짧게는 10초 길게는 40초이상을 매게임시 시청해야되는건 너무 심하네요. 땅파서 게임운영하는거 아니니 이해하려해도 요즘 게임들 너무 심하네요. 광고때문에 게임집중도 하락으로 게임하기 싫게 만들어요. 인터페이스가 넘 불편해요 칸 선택하고 번호를 클릭하면 칸 개수만큼 반복을 해야한다는건데 그거보단 번호 먼저 선택하고 칸 클릭하면 선택된 번호로 계속 들어가는게 편하지 않나요?? 터치수도 줄고요 이건 스도쿠가 어려워서가 아니라 사용법땜에 계속 실수가 일어나네요;;; 실수 3번하면 게임이 삭제가 되네요ㅋㅋ 어이없고요. 브레인아웃하는데 광고가 개많이 나오던데 나가는 버튼도 없고 아무내용없고 거짓정보만 30초동안 보여주는 광고를 무슨 이유로 봐야하는지 모르겠네요. 네, 광고 없애기 버튼 누르라고 하지 마시고, 그거 유료입니다. 무려 6,900 원이나 되는거고요. 광고를 만들려면 재밌게 만드시던가 하세요. 그리고 홍보방법이 광고밖에 없는거 저희도 아는데 나가는것도 없이 시간을 낭비해야되는게 너무 싫어요. 광고에 써있는 문구 다 시선끌라고 그러는거 알고요. 다른 리뷰 답글보니까 앱 꼼꼼히 만드느라고 광...
전체 리뷰 소코반? 이 뭔지 모름 그냥 숫자를 넣고 있네 어려워 초급수준도 너무 어려워 ㅠ 게임은 돈을 내야 재밌게 하는법이지. 광고 없으니 을마나 좋아? 스토크는 할만한대 너무 광고가 심어져있어서 하기가 실어지네용 광고 너무 많아요. 너무 재밌어요~근데 광고가 너무 많아요 지난번에 업데이트를 하면서 광고가 너무 심하게 많아짐. 카톡 보내고 오면 광고하고 짜증나서 광고 본 상황에서 카톡 보내고 오면 광고 2개 봐야함. 머리 운동에 상당히 좋았어요. 누구나 해볼 수 있는 놀이로 건전하고 유익하네요. 전문가급은 어렵군요. 해서 시간이 너무 많이 걸려요 때론 30분도 더 걸리는군요. 그래도 자주 합니다. 진심으로 한마디 안하는데 뭔 광고만 계속뜨는지... 끝나면 광고뜨고 시작하면 광고뜨고 광고로 많이 돈버시겠어요..아유참 너무 재미있어오ㅡ. 가족들과 합께 하면 좋을 것 갔아오. 그리고 저가 스토쿠를 좋아해서 입니다. 근데 1스테이지 깨자마자 바로 광고가 나와서 그거 때고는 너무 재미있는 게임 입니다........ 광고가 너무 많아요 광고가 너무 많음 같은숫자가 색칠되어있어 풀기 쉬움 남은숫자도알려줌 아직까지는 괜찮은듯 광고가 없은데. 계속 없었으면 광고 조ㄲrㅊl 많이 나옴 그거랑 별개로 연습장모드상태에서 실수넣으면 숫자 자꾸 통통 튀는데 내가 풀고싶은데 왜 자꾸 알려주는지 모르겠음 한번씩 해보면 머리회전에 도움될 거 같아요 오랜만에 머리쓰니까 힘들지만 재밌네요^^ 문제랑 난이도가 적당함 광고가 좀 있긴한데 거슬리는 정도는 아님 광고가 너무할정도로 많음... 광고 너무 많음",4.6,퍼즐
