title,reviews,scores,genres
War Robots. 6대6 택티컬 멀티플레이어 전투,"게임 그래픽은 최상입니다. 다른 게임이랑 비교되죠. 돈 만 있으면 이기는 게임입니다. 서버 관리가 정말 안되는 게임입니다. 서버 관리 문제로 광고 보면 주는 보상도 안줄때 많고요. 게임 중간에 나가면 탈주 리그라고 게임 못하게 만드는데, 본인이 나간게 아니라 서버과 개판이라 중간에 나간거 가지고 탈주 리그 보내서 일주일 이상 게임 못하게 합니다. 2번이나 당해 봄. 탈주 리그 보낸 기간의 과금 보상도 그냥 삭감됩니다. 여기 발 안들여 놓으셨다면 다른 게임 추천합니다. 5~6년전 란슬롯 전성기 시절에 하다가 멘더,웨이랜드 시절에 접고 최근에 복귀한 유저입니다. 과금유도가 심한편인거는 어느정도 납득되고 벨런스도 잘 맞춰지지 않은것도 넘어갈수 있지만 게임 자체에 문제를 일으키는 핵쟁이, 서버 자체의 랙걸림현상등으로 플레이하는데 있어서 꽤나 큰 피해를 봅니다. 다른것들은 넘어갈수 있지만 서버랙은 넘어가기가 힘드네요 이점 고쳐주시면 감사하겠습니다. 현재업대이트이후로 그래픽,로봇생김새,쾌적한플러이등등 아주많이좋 아졌습니다.하지만 ((밸런스패치가시급합니다.너무 강한 로봇을가진사람들이게임의한판을뒤집어놓습니다 예를들어래벨등이 같은사람들끼리 매이치킹을하거나.))입니다.워로봇은 엄청난게임입니 다. (모바일게임이란게밑기지않습니다.♡♡)(꼭 읽어주세요^-^) 현재는 너무 능력 위주의 전투가 되어 다양하고 화려하긴 해도 예전의 재래식 전투 느낌이 나던 시절이 그립기도 합니다. 그래도 종합적으로 봤을 때 이만한 게임이 또 없는, 상당히 재미있는 게임입니다. 현질 유도가 심한것만 제외를 하면 괜찮은 게임입니다. 무소과금이어도 초중반에는 어려워도 꾸준히 하다보면 괜찮은 로봇과 무기들이 많이 생겨서 후반에는 정말로 할만 합니다. 다만 예전에 있었던 복귀유저에게 주는 금화 보상 시스템이 다시 생겼으면 좋겠네요... 초반에는 괜찮습니다. 재밌어요. 하지만 후반으로 갈수록 돈으로 사는 무기, 로봇들이 많아지며 자연스레 게임에 돈을 쓰지 않은 유저들은 게임에서 뒤쳐질 수 밖에 없습니다. 돈으로 사는 무기들을 제작할 순 있지만 무기, 로봇 각 하나를 만드는데에만 1달 이상의 시간이 소요됩니다. (로봇 한대에 최소 3개의 무기가 필요합니다.) 가볍고 짧게 즐기실거면 추천, 진지하게 하실거면 비추드립니다. 광고먹튀가 너무 심하네요. 광고 보고 바라던 리워드 안주는 악랄한 짓도 많고 싫컷 광고 보게 하고 인터넷,장치문제 핑계로 리워드 안주고 쌩가고..인터넷 등의 문제면 아예 광고 재생을 하질 말아야지.. 돈없어 현질 못하고 광고라도 보면서 겜하겠다는 나같은 거지는 광고 봐주는 이득도 하찮습니까? 별점 -5개가 없어서 한개 드립니다. 그래도 나름 게임은 재밌어서 한동안은 할랍니다. 광고먹튀 하지마쇼 안녕하세요 워 로봇 3년 정도 한 유저입니다 현재 저는 다이다입니다, 현질없이 어찌저찌 잘 해 나가고 있지만, 너무 많은 현질러들 탓에 점점 게임이어려워지고 있습니다, 언제는 또 갑자기 등장한 핵쟁이탓에 게임 분위기가 많이 떨어졌어요 최근에 핵쟁이가 많이보이던데 핵 단속을 해주셨으면 합니다, 그리고 현질 유도좀 줄여주세요. 안녕하세요 저는 4년 가까이 하고있는 플레이언데요 이 게임의 장점은 일단 그래픽이 좋은것 같습니다 다른게임에 비해 컴퓨터같은 화질을 갖고 있어서 처음블레이 할때 꽤 흥미를 가져왔구요 둘째는 누구나 쉽고 간편하게 조작할수 있다는 점에서 별2점을 드립니다 다른게임은 조작법을 외우는 경우가 많았는데 이게임은 그런점이 하나도 없어서 좋습니다 셌째는 다른게임은 플레이하면 모드가 몇게 없는데 이게임은 여러가지 모드와 매주 랜덤으로 무한전이나 현질해야 하는 로봇을 무료로 사용할수있어서 지겹지는 않아 보이고요 업데이트 하는게 조금 느리기는 하지만...
전체 리뷰 제가 아까 리뷰를 봤는데 이거 완전 복사+붙여넣기가 맞네요. 왜 내용을 똑같이 보내죠? 질문에 대한 적절한 답변을 해야하는데 어떻게 쓸모없는 답변을 하죠? 저 지금 2년 동안 플레이 하고 있는데 핵쟁이들 처리 안 하시는가 보내요. 그리고 21레벨에 타이탄 얻을 수 있다는데 저 이미 30레벨이에요. 이러면 저 한테 보상은 뭐죠? 다른 게임은 서버 문제로 사과보상까지 주는데 이 회사는 플레이어들의 마음을 이해하지 못하는 것 같네요. 그리고 풍신을 방패 활성화 상태에서 걷게 수정하셨는데 방패가 쓰레기인데 왜 씁니까? 그리고 요즘은 소규모...
전체 리뷰 워로복의 유저들을 위해 말을 해보자면, 워로봇의 업데이트는 약 한달 반 주기로 돌아갑니다. 메타는 약 3~6개월 정도로 교체되고요. 심한 현질을 하지 않고서도 충분한 실력과 적절한 업그레이드 투자를 하면, 게임의 흐름에 맞추어 갈 수 있습니다. 워로봇의 공식 사이트에서 정보를 수집하고 유튜버들로부터 최신 뉴스 소식을 얻어 앞으로의 로봇의 전망과 평가를 잘 생각해 보십시오. 세다고 해서 무조건 좋은 무기나 로봇이 아닙니다. 오히려 픽률이 높으면 너프될 가능성이 높겠죠. 렉과 발열은 퀄리티 좋은 게임치고는 심하지는 않습니다. 다만, 와...
전체 리뷰 업데이트로 파프니르의 공중 이동속도가 너무나 느려졌습니다. 매우 정말로... 다음 업데이트에서는 파프니르의 공중 이동속도를 높여주십시오. 부탁드립니다. 그래픽,무기,다양한 로봇 등 그런건 다 괜찮은데 레드 와이파이가 많이 뜨고 핵도 종종 만나고 있습니다.그리고 발사를 하고 나면 딜이 안 들어 갈때도 있습니다.빨리 고쳐주세요. 초반에는 할만해요. 로봇 키우는 맛도 있고요 근데 후반으로 가면 현질유도가 다른 게임에 비해 너무 심해요. 그리고 현질을 하지 않으면 게임을 못할정도로 밸런스가 맞지 않아요. 그래도 소과금, 과금러들은 할만해요. 무과금이신 분들은 안하는걸 추천 드려요. 출시때부터 하고 있는데 재미 있어요. 이번 업그레이드(2022. 0127) 버그때문에 손실 발생하네요. 로봇 업그레이드 완료 팝업이 계속오고, 게임 끝나고 광고 보기가 실행이 안돼서 손해 보고 있어요... 빨리 고쳐주세요 음..음 ㅇ..으,으이? 저 여러분들 이슈가 있습니다-/ 이거 보셨다면 지금 접속해서 전투 눌러보세여 ㅋㅋㅋㅋㅋㅋㅋ 몰 하는진 몰라도 와이파이-데이터 최상 인데도 화면이 안뜹니다;;ㅎㅎㅎㅎ 놀랍네여 (문제: 화면이 알고싶다). 로봇이 업그레이드 해서 강해지는건 좋은데 무기 추가와 난이도를 높이기 위해 강한 적 로봇을 참가해주셨으면 합니다. 그래도 이 게임은 저의 베스트 게임 입니다. 완전 최고입니다! 별 10점 중 1점도 아까움. 게임의 퀄리티는 결국 플레이어의 재미를 추구. 그 재미는 과금을 한만큼의 만족도를 전제하에 어느정도 지속이 되게 만들어야 하나, 물가가 오르는 것에 반영은 투철하되 경기가 안 좋은 것은 반영은 안하고 과금한 무기와 기종은 천하무적인 반면 1분기가 지난 전시점 과금 무기는 바로 너프시켜 쓰레기로 만들어버림. 역시 이번 업뎃 기종들도 사기 에바이고, 올해 30만원 과금을 힌 것도 결국 쓰레기 폐기처분행. 이럴거면 차라리 PS5를 사는게 낫겠다. 그래픽도 최상이고 게임 플레이도 재밌긴 하나, 과금 유도가 심한것 같습니다. 환불도 안해주시고요 딴분들은 환불하고 골드 깎이는데 왜 그걸 바라는 나는 환불이 안되는건지 그래픽이나 여러 cg그래픽 같은 시스템은 아주 모바일 게임 치고 훌륭합니다 근데 현질러와 일반인에 로봇 차이가 큽니다 그문제는 개선을 해야 할것 같습니다 그냥 갓겜임 이겜 업데이트도 꾸준히하고 이벤트도 많아서 좋아요 근데 업데이트 하고나서부터 갑자기 전투를 못함........ 뭐지.....(현제는 전투가능 업데이트 버그였나.........) 재밌긴합니다 그래도 현질유도가 심해서 조금 발리기도하고 게임 밸런스가 안맞기도 하지만 그래도 조금만 현질하고 잘 키우면 재밌게할수있으니 별5개 드리도록 할게여 제가 아레스를 골드로 구입하려고 한번 눌렀는데 갑자기 터치하니깐 드르륵거리면서 한번 더 사졌네요. 그냥 제 실수라고 생각될 수 있지만 골드양이 2번 구매할 돈이 안됬는데 구매가 되서 골드가 -3845로 되어있습니다. 혹시 아레스 조각을 회수하고 골드 12000개를 다시 돌려줄 수 있나요? 로봇이동속도를 더 빠르게 만들어 주세요 그리고 메뉴를 더 복잡하게 않만들으셨으면 좋겠습니다 그리고하얀색 로봇을 옛날처럼 등급을 높게했으면으면 좋겠습니다 열심히 모아서 산건데 갑자기 가격이 급격히 내려가니 좀그렇네요? 보상이라도주세요. 너무 재밌네요ㅎㅎ좋은 로봇을 구매하기도 생각보다 좋은거 같고요. 약간 아쉬운 점이 있다면...퀵 매치를 하면 상대팀과의 밸런스가 안맞을 때가 많은 것 같습니다. 너무너무 재미있고 로봇이라는 주제가 너무나도 좋은데 딱 한가지 단점이 있어요 어제 골드가 203개 였는데 오늘보아하니 103개 무려 버그로 100개가 사라졌어요 이 버그만 좀 수정해 주시면 완벽한 게임이 될것 같아요 현질하고~ 시간 투자해서 무기 강화하고 로봇 강화 해 놓으니~~업데이트 이후로 쓰레기를 만들어 버렸음ㆍ저것들 맘대로~~하루 만에~~도대체 이런 업데이트는 처음 보는것 같네ㆍㄱ새끼들 솔직히 이게임은 처음 나왔을때 재미있었는데 점점 업데이트하면서 재미가 없어지고 현질 하라는게 많아지고 광고도 요즘에 더 많이 나와요 다시 옛날처럼 돌아가면 인기가 올라가지 않을까 생각합니다 현질해서 로봇, 무기 뽑아서 현질해서 업그레이드 해놨는데 밸런스 맞춘답시고 성능 다운이라니! 말이되냐! 어떤 제품 삿는데 결함생겼다고 그 기능을 빼버리면 얼마나 억울하나! 처음 부터 밸런스 맞춰서 출시해라! 옛날에 즐겨하다 다시 복귀한 유저입니다 일단 게임은 재밌지만 업데이트를 안하는거 같고 유저가 잘안잡혀서 대부분AI가 많아서 제대로 즐기기 없렵네요 하지만 재밌기 때문에 별4개 드립니다 여기서 궁금한게 있는데 이게임말고 다른 로봇게임이 있었는데 정말 그립네요 업데이트가 진행이 될수록 너프도 심하고 렉도 심하다 폰이뜨겁질 않았는데 이젠 조금하면 폰이 너무 뜨겁다. 업뎃 신중히 하시고 무리한 과금 안하게 해 주시길... 게임 지우고 싶어짐 게임자체는 매우 깔끔한 디자인과 UI가 조화를 이루지만 무한 경쟁모드 에서 중국인 이름으로 된 봇들이 진짜 플레이어들을 죽이고 자살하기도 합니다. 이런 경우 때문에 순조로운 게임 진행을 하지 못하고 결국 다시 게임을 하게 됩니다. 무한 경쟁모드의 봇 배치를 빼주세요. 팀 데스매치도 포함입니다. 밸런스 붕괴,티어 붕괴 처음해보는데 잼있네요.긍데 속도들이 너무느려요..현질안해도 기본이동속도좀 높여주셧으면 합니다 이게 진짜 재밌어요 타격감 겁나 쩔어요 근데 현질 유도가 좀 있지만 재밌어요 그리고 무과금도 잘 할수 있도록 유저들에게 로봇 좋은거 하나 씩만 주셨으면 좋겠어요 그럼 안녕!!!😄 이 게임은 정말 좋고 옛날 때부터 만들어져 가지고 퀄리티가 더 좋아지고 좋은 게임으로 만들어졌고 현질 과도 를 좀 하지만 재밌고 그리고 퀄리티가 엄청 좋아 가지고 재밌게 할 수 있는 게임입니다 플레이 하기에도 괜찮고 디자인면이나 그래픽면에서 다 괜찮은 게임입니다. 그런데 좀 심한 현질유도, 무기 벨런스, 무기 가격에 비해 무과금으로는 터무니없이 벌기 힘든 골드 등의 문제때문에 오랜만에 깔아도 조금 즐기다 말고 지우고를 반복하고 있습니다. 이 문제 조금만이라도 검토해서 수정해주시면 좋을것 같습니다. 게임은 정말 잘 만들었음 퀄리티도 높고 그래픽 화질 다 좋음 하지만 한가지 문제가 있음 현질을 안하면 게임 진행이 어려워질 정도임 초반에는 괜찮은데 후반 가면 현질러 유저들이 등장함 그리고 밸런스가 터졌음 픽셀건 보다 밸런스 못 맞추는 게임은 처음임 [3년차 무과금 vs 3달 한 현질러] 하면 현질러가 너무 쉽게 이김 적어도 100만원은 써야 후반가서 잘 할수 있음 음..이게임은 퀄리티는 좋은편 있을건 다 있으나 그만큼 아쉬운점이 많다 이게 게임을 좀쉬다 들어가면 몇천 골드씩 복귀보상이 있는데 이 골드를 잘사용하면 쉬면서 생긴 구멍을 막을수는 있으나 조금 하다보면 구멍이 생깁니다(크레딧이 모자르기 시작합니다) 허나 이복귀 보상을 준다는 점과 세일을 한다는 점을 본다면 조금에 현질로 꽤나 큰 수익을 얻을수 있다. 또 게임은 매칭이 길지 않으며 플레이어 수준들도 낮지않은 편이다. 요약 1.할수록 모자르는 자원 두둑한 복귀보상,비교적 자주하는 세일이점을 이용해 조금만 투자하여 꽤나 큰 수익을 얻을수...
전체 리뷰 2번째 평가인데 제일심한건 게임 매칭기준이 리그별로 대전하는방식이 아닌 6vs6 대전시 양쪽 트로피총합만 비슷하게 맞혀서 매칭하는 방식인것 같습니다. 충족값만 맞으면 10000트로피 챔피언하고 2000트로피골드하고 대전하게 만드는 너무 불공평한 방식입니다. 당연히 패배하면 최저 마이너스트로피를 받게되고 5게임정도 연속패배를하면 리그순위도 그만끔 떨어져서 신규유져들은 몇달하고 그만두는 악순환이 발생하겠죠. 현질유져들도 같은 현질유져들과 반복해서 대전하면 순위도 더디고 핵유져 현질유져 섞여서 게임하는 현상이 반복되면 당연히 게임을 그만...
전체 리뷰 지금까지 게임 하면서 솔직하게 느낀점들을 말해보자면 일단 게임성 자체는 정말 좋음. 특히 로봇, 메카같은거 좋아하는 사람들은 정말 좋아할 수 있는 게임임. 또 이펙트도 과하지 않게 게임성을 잘 살렸음. 로봇도 과금하지 않아도 게임하면서 최신 메타로봇들 어느정도 얻을 수 있어서 골드~명사수 정도까지는 겜만해서 올라올만함. 단점이라고 하면 매칭시스템인데 다른 리뷰에도 나와있듯이 천상계에 있어야할 레벨의 로봇이 패작으로 내려와서 학살을 하는 경우가 상당히 많이 발생함. 그리고 가끔씩 인터넷 연결문제가 발생하고 게임중 렉이 심하게 걸리는 ...
전체 리뷰 업그래이드가 많고 레벨올리기가 힘들고 로봇이느리지만 그래픽도괜찮고 뽑기가많아 무기를 많이 얻을 수 있어 재미가 쏠쏠합니다. 패작러관리좀해주시지 제발 리그관리좀해달라구요.게임을할수있게만들어줘야지요 이게뭔가요진짜 패작러들때문에 재미가없어지내요.서버관리도제대로안하고 진짜최악이내요. 매칭을 트로피개수에 맞추는게 아니라 로봇의 총 개수 로봇과 무기의 레벨 타이탄의 레벨 계정의 레벨대 에 맞춰야지 할만할것 같네요 지금은 돈 많이쓴 사람이 기기는게임이 됬어요 게임은 잘만들었으나 운영이 아쉽네요.전략을 짤수있는것도 좋고 뭐 무기조합을 다양하게 하는것도 좋으나 무기간의 성능차나 로봇간의 성능차가 너무 커서 실력이 거의 의미가 없게되버리는 구간이 있어요. 물론 무과금도 오랜시간플레이해서 무기와 로봇을 모으면 되지만 그 구간에선 현질을 하고 안하고 차이가 너무 극명하기 때문에 안하면 실버 금 열쇠 얻는게 너무 느리고 고통이네요 겜운영 뭣같이 하네. 핵쟁이들은 잡지도 못하고 매칭 들어가면 블랙화면에 먹통이고 랙 쩔고. 참... 7년된 겜이 이모양이냐. 환불 요청하고 접을란다. 잘 놀았다. 워로봇 3년차 유저입니다. 네, 쓰레기니까 하지 마십쇼. 현질유도도 현질유도이고, 게임에 과금러들밖에 없어서 상대가 안됩니다. 오랜만에 들어왔는데, 한판 하고 게임 바로 삭제했습니다. 하지 마세요... 유저들 쓰레기로 생각하는 게임...현질하면 뭐하나 현질해서 어느정도 만드니 새로 출시하는 로봇 위해서 너프... 적당한 너프는 말 안하지만 완전 패물 만들고 이게 뭔짓 게임 3년 넘게 했지만 더이상 현질 할 맘없다..로봇 새로 나올 당시 성능을 보고 구매했는데 말도 안되는 너프는 유저들 주머니에서 돈 강탈하는것과 뭐가 다른지....아오준 너프때부터 뒤통수 치는게 점점 심해짐 안녕하세요 war robots을 4년동안 플래이 한 유저입니다. (복귀 유저 입니다) 솔직히 엄청엄청 발전했어요. 예전에 접었는데 자꾸만 생각이 나요. 1.(단점) 무과금과 과금의 차이 일단 현질유도는 조금만 있지만, 현질을 하지 않으면 그냥 과금러 1명에게 온 팀이 소멸합니다. 제가 직접 경험한건데 스톰 리치가 진짜 그냥 제 팀을 게임시작하고 5분도 안된채 다 전멸시켰습니다. 뭐 경력이 있다면 대처법도 알긴 알죠 하지만 제가 노덴즈를 가져왔음에도 불구하고 그냥 제 노덴즈를 없엤습니다. 이거 매칭 시스템이나 무료로 무기를 몇개 주셨...
전체 리뷰 로봇이나 무기 아이템은 현질 유도하면서 접속 불량은 개선 안하는 것 같군요. 모바일게임인데 접속하는데 1분이상걸리고 전투중에 다시연결 중이라고 하면서 그 사이 로봇 데미지 입어서 죽고 아이템 버프 사용해서 접속하면 플레이어 찾는 중이라고 하고 에혀 스트레스 해소 하려다 스트레스 받는 것 같아서 2년 넘게 즐겨온 게임 이젠 그만 접을랍니다. 워로봇 4.3.0 부터 해온 유저입니다. 그래픽도 좋고 정말 재밌는 게임입니다. 니쁜 점은 없지만 굳이 찾자면 매칭시스템을 티어가 아닌 로봇과 무기에 맞춰서 매칭을 해 줬으면 좋겠습니다. 예를 들어서 티어별로 매칭을 한다면 현질러나 양학러들이 게임에 난입해 문제가 생길수 있습니다. 예를 들어 챔피언티어에서 양학질한 사람이 실버티어 무한경쟁에 난입해 맵을 쓸어갈 수도 있습니다. 다른 건 정말 재밌고 마음에 들지만 매칭시스템을 좀 비꿔주면 좋겠습니다. 픽소닉 힘내세요. 업데이트가 겁납니다. 이번 업데이트 후 광고보기가 안됩니다. 전에도 이러더니. 다음 업글에서는 해결될려나. 재미있네요... 다만 로봇들격차가너무심각하게차이나네요 발란스가조금... 신규로봇 너무자주나와요... 힘들게맞추면 제대로사용도 못하고 또....업글 후덜덜... 게임은 좋은데 밸런스페치좀 부탁드립니다 저희는없는 좋은 로봇트가 있네요 그리고 무기 차이가 커요 이정도만 고쳐주시면 좋겠네요 그리고 핵이 양학하고 다녀요 와우! 이 게임은 정말 현질을 안하고는 정말 할수가없는 게임이군요! 말로는 표현하기도 정말 역겹네요! 이게임은 무과금을 철저히 배척하는 미친 게임입니다! 게임이 이럴수가 있나 싶을정도로 게 임이현질러와무과금의차이가엄청납니다! 이럴수가!하지만 맞습니다! 진짜 이대로가 맞 는 건 가 요 ! 게임자체는 재미 있습니다. 하지만 현질유도가 심니다 물런 워로봇이 로봇을 뿌려서 기분도 좋아지는 재미있는 게임입니다!!!!!! 다들한번씩 꼭 해보세요!!!!!!!! 로봇도멋있고 스릴도 있어서 너무너무 좋습니당 마음같아선 1000000만점 입니다 거의 다 좋은것은 이게임에 다있는것같아요 그정도 이기에 로봇을 좋아하시는분들 플레이 해보시면 좋을것같아용~~~^^ ㅋㅋㅋㅋㅋㅋ MK3 딜찍누 망겜이 되어버렸네 참ㅋㅋ 작년만 해도 그마찍은 무과금 고인물입니다만, 기껏해야 MK2 한두개 있는 가난한 상태에요. 그럼에도 MK3나오고 성능압도 확실하게 당하는중.. 기왕 과금러들과 배틀하실거면 다이아까진 찍고 내려오시는걸 추천합니다. 재밌어요.근데 제가 힘들게 얻은 좋은게 있는데 저순위대기열인가 그거때문에 게임 매치가 30분씩 걸려요. 재미있는데 서로 직선으로 싸우는게 좀 그러네요. 속도도 초반에 너무 느리고요 장점:로봇이다양함 스킬도다양함 단점:현질유도심함 인벤토리기능없음 로봇조각을합치려면10000개나현질로얻어야함 총평:로봇조각을 500,3000로바꾸고 골드99999999를모든 플레이어에게 지급하자 와..... 제가 이때까지 했던 게임중 가장 재밌네요^^ 하지만 저는 무과금 하는 사람인데 로봇 가격이나 총가격이 너무 높네요ㅠㅠ 몇년째 워로봇을 복귀했다가 삭제했다가 하면서 틈틈히 즐기는 유저 입니다. 일단 시간이 지날수록 고퀄이고 다양한 로봇과 다양한 무기가 나옵니다. 물론 밸런스를 위해 로봇과 무기 등의 산성을 만들어 게임내 밸런스를 조절하지만 역시 비싸고 좋은 로봇과 무기가 휠씬 셉니다. 적당한 게임 플레이 센스로 이길수 있지만 좀 힘들구요.. 무과금 유저들을 위해 지금 실행하는 이벤트도 좋지만 예전처럼 이벤트로 미션 성공시 로봇or무기 를 주셨으면 하고 유저들이 게임시작 로딩이 느리다고 합니다. 게임이 시작될때 리소스를 받아오는 시간이 좀 많이 길고 ...
전체 리뷰 갬은 재미있는데 보상광고는 90프로 사기꾼들입니다 광고는 다보고 보상안주고 광고정지되면서 화면 멈추게만듬 30초 지나면 갬 나가야함 뭐 그럭저럭 킬링타임용으로 즐기고 있어요 그래픽도 처음보다 많이 좋아졌구요 다좋은데 업그레이드시간이랑 골드로 업글하는거 좀줄여주세요 너무비싸요 이게임에현질도많이하고 오래한게임인데 아쉽네요,,, 이보세요 이런 미친게임 다잇나 내 계정 내로봇 다 사라졋네요 60만넘게 결제한 계정이 왜 사라졋나요 빨리 복구 시켜줘요 아니면 결제한 금액 환불 해주세요 빠른 답변 부탁드려요 과금하지 않을 것이라면 학살당할 준비를 하라. 업그레이드에 시간은 물론 돈도 많이 든다. 시간도 돈으로 살 수 있는 구조를 가지고 있다. 게임 자체는 단순한데, 과금을 위해서 격납고 인터페이스는 아주 난잡하다. 당연히 돈을 벌어야한다는 것은 이해하지만, 로봇 업그레이드하는데도 충분히 엄청난 돈이 드는데도, 거기에 타이탄, 모선, 드론, 조종사까지 추가하고 전부 유로로만 업그레이드가 가능하다니. 이건 선을 넘었다. 개발자님 업데이트 하고 나서 전투모드는 있느데 쾩매치 와 비컨러시 무한경제 도네이션 팀데스매치등 이 없네요... 이 오류좀 고쳐주면 좋겠습니다 그래서 별은 한개 입미다. 업데이트하고 전투모드에서 아무런 모드가ㅜ안뜨네요 전투 시작할수 없어요 ㅠㅠ 처음엔 재미있지만 가면갈수록 로봇좋은걸 가지고있는 사람이 게임을지배하네요 무과금유저한테도 좋은로봇을 얻을수있는 혜택을 좀 더 주세요 실버 모으기가 어렵다는 것이 단점이지만 퀄리티와 게임성 조작성 모두 뛰어난 좋은 게임입니다! +추가적으로 조각을 구매해야만 살 수 있었던 고급장비는 제작할 수 있게 있게 되어 현질유도가 좀 줄어든다 싶었으나 몇달전까지만해도 제작가능했던 orkan, taran등 일반적으로 많이 쓰이는 좋은 무기를 제작할 수 없게 만들고 또 골드로밖에 살수 없게 만들어 이젠 다른 방향으로 현질 유도가 좀 있는거 같습니다 처음 나왔을 때 부터 해오던 유저입니다 요즘 신 로봇이 많이 나와 옛날 메카와는 밸런스는 붕괴되지만 전 그래도 잘 하는 편입니다 여기서 꿀팁은 무기와 로봇을 꾸준히 업글 하시구요 23렙인가? 그쯤 가면 큰 로봇이 헤제됩니다 그걸로 버티는것도 추천드립니다 일단 무지성으로 박지마시고 로봇과 무기의 특징과 사거리 장점 단점을 잘 생각하셔서 게임을 플레이 하시면 현질러 신무기,로봇등을 견더내실수있습니다. 하지만 고인물은 옛날 메카를 좀 더 많이 활용합니다 솔직히 예전보다 과금유도 떨어진건 인정해야합니다. 이제는 게임만 열심히 해도 최소 2티어덱으로 맞출 수 있습니다. 전 하루에 두세시간씩 꾸준히 해서 현재 파프니르 mk2 11렙이고, 명사수 리그에서 아주 게임을 괜찮게 하고 있습니다. 그리고 현질러들은 겜 재밌게 하려고 현질하는거라 구지 현질러끼리 매칭할 필요는 없다고 생각합니다. 그런데,지금까지 말하며 간과하지 못한부분이 하나 있는데, 그것은 바로 최소'2티어'덱이라는 겁니다. 업뎃 한번 될때마다 압도적으로 강한 로봇들이 나옵니다. 그래서 그런지 구 로봇들이 약해보이는건 사실입니다...
전체 리뷰 정말 복잡하고 난해하게 만들어 놨네요! 신규진입 주의! 뭐가뭔지 알수없을 정도로 현질위한 옵션 설정 복잡하게 해뒀음. 고인물끼리 다해먹는 곳이니 시간낭비 하지 않도록 하는것이 좋을 듯 하네요 전2015년부터 게임을 시작한 게이머 입니다. 일단그래픽과 로봇에능력이 잘구성되어 있어 재밌습니다. 그리고 제가 오래동안 보았더니 업데이트도 빨리빨리 되더라구요. 그래서 정말추천하는 게임입니다. 아직까지는 재미있어요스토리 전개가 매우 흥미롭습니다 여기에서 더좋은 전개가 있었으면 좋겠습니다 이번 업데이트로 버그 발생 빈도수가 대폭 늘었네요.. 빨리 고쳐주세요 현질이 필요한 겜이지만 그래도 그래픽이나 게임 진행은 재밌기 때문에 한번 해보는것도 나쁘지 않음 ●전진시 특히 속도가 느린 로봇일경우, 가다가 멈추는게 자주 있어요. 공격버튼 주변 좌우 시선 처리와 조작시, 문제 (패치필요) ●.페인트가 적은 로봇 (ex 아오퀸2개, 불가사리 2개, 호버1개, 도크1개.. )의 페인트 추가!! ●파일럿 로봇에 주둔시. 어둡게 변경됬는데 ,예전처럼 다시 밝게 보여 주세요 모바일게임중 그래픽은 최고 원탑입니다 쉽고 간편해서 재밌습니다 강추!!@~ 4시간가속광고를 봤는데 가속이 안돼는 버그가 있어요 그것만좀 고치면 좋겠네요 내가 처음으로 진지하게 리뷰씀 1~17레벨까지는 현질러와 무금으로하는 사람들에 차이를 잘 못느꼈는데 한 21레벨부터는 로봇을 구매할수있는개 없다. 상대가 되는 것들은 2000골드하고 10000퍼즐 한다. 무기가 1000골드다. 전보다 골드를 얻는게 쉬어졌으나 여전이 어렵다. 1레벨부터 20레벨 까지 골드 1도 안쓰면 2000은 모을수도 있을거 같다. 골드랑 퍼즐로 구매하는 로봇 성능차가 많난다. 게임 자체는 재미있다. 그래픽아주좋고 핵쟁이도 만나본적이 없다. 과금러와 무과금에 차이가 너무 난다. 최근엔 쪼금 좋아짐 게임은 재미있는데 어제부터 모드가 하나밖에 안 돼고 게임하고 승리해도 명해점수도 안줌 그래서 조금 아쉬움 현질만 하면 실력에 상관없이 양학하는 게임,이 게임 6년동안 봐왔는데 현질러 전용 게임 수준이고 매칭 시스템도 최악임,28레벨이 무기랑 기체가 전부 현질로 떡을 쳐서 MK2 랑 MK3가 넘쳐나는데 리그 점수가 비슷하다는 이유로 같은 게임에 매칭시키고 게임 끝나고 신고 30번 넘게 해도 며칠 후에 게임하면 또 만남, 리그 점수같은거 다 없애고 무기랑 기체 레벨 기준으로 게임 매칭 시키면 지금보다 확실히 200%는 나을거라고 확신함 메칭 시스템 개같이 만들어놓고 먹히지도 않는 신고 시스템 만들어놓은건 진짜 멍청한 생각인듯,지금 기준으로...
전체 리뷰 전에는 완전 재밌고,꽤 비싼 로봇들도 열심히 모아서 사는 재미가 있었지만 최근에는 현질만 하면 게임을 이기고 현질 안하면 져야하는 그런 게임이 되버렸습니다. 거의 현질 한 유저와 현질 안한 유저들을 나눠서 매칭을 잡을 필요가 있을 정도로 현질 요소가 너무 크고,신규 유저들을 더이상 영입할 수 없을 정도가 되버린 게임입니다 워로봇을 출시시점부터 7~8년가량을 즐기고 있는 명사수 티어의 유저입니다. 게임을 오래전부터 즐긴 제가 보기에는 워로봇의 게임성 자체는 훌륭하고 독특하다고 할 수 있습니다. 그럼에도 제가 별을 한개밖에 드릴 수 없는 이유는 운영자체 방식에 문제가 너무 많다고 생각하기 때문입니다. 첫번째로 운영적인 문제로 보자면 가장 잘 알려졌다고 할 수 있는 ""현질유도"" 입니다. 픽소닉의 돈줄이라고 할 수 있는게 War Robot이라는 점은 저도 잘 알고있습니다. 하지만 유저들의 입장으로 보기에는 다른 모바일 전투게임과는 비교도안되는 가격의 10~...
전체 리뷰 이제 접을때가 되었나보네 밸런스 잡는건 좋아 원래있던 날면 빨라지는거 없애고 지상이나 똑같은 스피드로 만드는건 너무하잔아 안그래도 무기는 개떡같이 쎄지는데 등신들 ㅡㅡ 재밌는게임입니다 전토도재밌고 현질도 조금만 하면 금방 고수가 될수있어서좋습니다 등급이 오를수록 느낌이 쎄함... 아직 골드고 다이아 직전인데, 게임에 유리하려고 시간을 들일수록 더 강하고 등급 높은상대를 만나는 느낌이다.. 물론 이게 당연한건데 다이아 등급이랑 골드등급이랑 차이가 매우 크다.. 골드는 나같이 현질안하고 시간들여 템을 맞춘 사람들이라면, 다이아는 모든 무기렙10이상, 좋은무기으로 무장한 현질러들.. 등급 올리지말까봐..ㅋㅋ 하지만 게임은 재밌다 한 5년한 사람으로 장비 업그레이드 시간 예전으로 줄입시다 6레벨 로봇 7레벨 만드는데 4일은 너무한거 아닙니까? 언젠가부터 갑자기 업그레이드시간 늘어나더니... 에휴~ 최소 9레벨은 되야 전투에 나가 볼수나 있는데(명함도 못내밀지만) 로봇과 장비 레벨 맞추다 시간 다보내고 해볼만하면 새로봇 나오고 이건 업그레이드 하는데 실버들고 업글시간 줄이기위해 골드들고 이건 너무 심한거 아니에요 운영자님은 꼭 제 댓글을 읽어주시기 바랍니다. 게임은 재밌는데 점점 과금러들을 위한 게임이 되는거 같습니다.30레벨에서 매칭을 돌리면 최소 2~3명은 과금러 입니다.그리고 게임 저는 골드인데 상대는 명사수나 챔피언이 나오는 경우가 있습니다. 이 점을 빨리 고쳐주세요.그리고 지금 제가 계정을 본캐로연도을 할려는데 계속 버그만 걸립니다. 그리고 매칭도 똑같이 버그 걸립니다. 빨리 없에주세요. 안 없에면 게임 영원히 접겠습니다. 워로봇을 거의 4년 넘게(출시했을때부터) 한 사람으로써 정말 재밌습니다 앞으로도 계속 잘되길! 게임을 즐겁게 '했던' 옛날 유저 입니다 옛날이나 지금이나 이런 게임은 현질하지않고 다른 현질러들 잡기엔 긴시간이 든다는건 알고 있어서 몇년인진 모르지만 3-4년 쯤은 되었을거에요. 중간에 접고 오랜기간 후에 접속하면 많은 보상 주던걸 이용해서 골드 뜯어 먹기도 했었죠. 그런데 요즘엔 옛날엔 몇백 골드면 얻던걸 퍼즐이라는 형태로 더 어렵게 얻을수 있게 해놓았고 현질유도는 진짜 심각하게 많아 진것 같네요. 게임을 시작하면 초반엔 봇들만 상대해 쉽긴하지만 조금 큰 후엔 과금 현질러, 썩은물들이 레벨과 맞지않게 만나는 경우도 있어 옛날이...
전체 리뷰 다운로드는 느리지만 게임은 이번 업데이트로 엄청 그래픽이 쩔어요! 작전 패스 끝날때 희기 무기도 줘서 기분이 좋을 때도 있어요 근데 실험실에서 부품으로 얻는 무기나 로봇이 골드로 사게 되는 것 만 없에주세요 왜냐하면 제가 gust 세트로 2개 만들려고 했는데 이제 골드 무려 2000으로 사야해서 세트를 못 맞추고 1개 만 얻게 되어서 너무 아쉽습니다. 그래도 픽소닉 화이팅! 게임이 상당이 재미있어요. 근데 점점 돈을 쓰게 되는... 그래도 좋아요 진짜 빡치네요 제가 이게임을 3년동안 했는데 진짜 옛날이 그립네요... 옛날에는 재밌고 할만했는데 지금은 현질유도가 많고 무과금러들은 무조건 망겜입니다 현질안하면 그냥 패배하는일이 많습니다 현질러때문 몇번을 당했는지 진짜 밸런스 조정좀 하세요 무과금로들에게도 게임 재밌게 만들어주세요 현질만 하면 무조건 이깁니다 진짜 망겜이네요 현질유도하고 돈 빨아먹으니까 기분이좋으세요??? 무과금러들은 비추천합니다 진지하게쓰는거니까 이거보고 패치좀 해주세요 해봤는데 재밌었어요 그런데 로봇이나무기가격 좀만내려주시면안되나요? 저도쎈무기 얻고싶은 데 너무많이질러야해서 근데 재밌어요 드론 업데이트 이후 게임 플레이 중 문제가 크게 없으나 대기실에서 화면 전환 렉이 심하여 5g 4칸인데도 불구하고 1분이상 소요됩니다. 추가적으로 광고 스킵도 사라져서 더 이상 현질이나 게임하고 싶은 마음도 사라지고 2년 넘게 플레이 했는데 안타깝네요 만약 다음 업데이트까지 안고쳐지면 삭제하고 떠날랍니다~ 옛날에 재밌던 기억이 있어서 다시 깔았는데 들어가질 못하네요. 그리고 옛날에는 복귀보상이있었는데 다른 댓글을 보니 복귀보상이 사라졌다는데 그건 사실인지는 모르겠고 (사실이면 아쉽네요) 로봇을 골드로 살수있었는데 이제는 퍼즐조각으로 사야해서 많이 하기 싫어진 그런 느낌.... 마지막으로 하나 더, 어느구간 이상으로 올라가면 더 이상이기기가 힘들때가 있는데 제 실력이 없는건진 모르겠지만 매칭 잡힐때 상대가 너무 잘하는것 같아요 그정도되면 현질을 안하고서 이기기가 너무 힘들어요 아무튼 지금 다시 하려고 깔았는데 격납고로 들어가질 못해서 ...
전체 리뷰",4.1,액션
