title,reviews,scores,genres
궁수의 전설,"12스테이지 98% 상위에 있는 유저인데 진짜 피지컬 갈고닦아도 한계가 있음. 비싸지는 업그레이드 비용에 같은 유닛볼때 마다 안그래도 짜증인데 데미지가 3방 맞으면 죽고 심지어 아이템 나오는거 3스테이지 때 까지 나오는 것만 해도 충분함 그냥 공속 더블샷, 치명타, 공격력 업만 나와도 스테이지 3~4개는 더깬다고 장담함. 미리 말하지만 아이템도 완벽한 에픽 있어도 꾸림. 그냥 중간 중간 접속해서 포인트먹고 시작하자 마자 포인트머고 죽어버리삼 그게 시간 낭비 안함 Pvp 버그, 핵 쓰는 유저들 때문에 하기싫어졌습니다. 배틀시즌4인데도 스피드핵 무적쓰는것들 많이보임. 잡으려는 노력은 하시는지.. 수준별로 제대로 매칭되지도 않고 버그로 튕겼는데 보석만 날리고 현질유도하는 것 같음. 수준별로 체력 똑같이 맞추던가... 과금/비과금 유저나누거나 pvp하면 좋을듯 챕터 들어가서 룰렛까지 돌렸는데 갑자기 꺼졌거든요. 다시 키니까 룰렛 돌려 나온 코인은 다 사라졌네요. 그리고 방금은 챕터 12하고 나온 코인이 만원이 넘었는데 레벨 10짜리 링 두번 강화하고 12에서 강화하려니 코인이 모자르다고 나오는데;; 코인은 충분히 있었거든요. 다시 껏다키니 코인이 또 증발했네요... 시작하면 방치와 회피만 하면 한판한판 하다가 게임이 끝납니다. 저번에 한번 돌파 못하던 곳을 돌파해서 접었던 기억이...ㅋ...어쨌든 쉽게 한판이 끝나더라고용 장점 및 단점을 알려드리겠습니다. 장점:방치+회피는 한판을 빨리끝낸다. 단점:멀티신청 중 플래이어가 늦게들어온다. 단점은 하나 더 있습니다. 단점:채팅이 안돼고, 악마라고 쳐도 너무 개X끼 이다. 장점도 더 있습니다. 장점:에픽무기 다음인 완벽한 에픽은 전설재료이다. 전설은 현질상자에서만 얻어진다. 입니다. 평가는 끝이고요 별은 5개(사실1,000,000개 찍고싶었지만 한계가...
전체 리뷰 쓰레기 게임, 버그가 넘 많음 플레이 도중에 버퍼링 생겨서 죽는 경우도 다 반사고 원정다닐 시 스킬 제공이 아예 안되는 경우도 10차례 이상, 타유저와 플레이 할 경우 중국인들 핵으로 인해 속수무책임 플레이 할 때마다 난이도 밸런스가 천차만별이라 스테이지 별로 타파불가능한 경우의 수도 많음 현질 유도 오짐 또 몬스터 알 가속시 번개가 꼭 하나씩 안들어옴 과금한지 하루만에 새로산 휴대폰이 불량처리되서 기기를 새걸로 교환받았습니다 그리고는 재다운로드를했는데 초기화 상태네요 같은 구글아이디를 사용하면 자연적으로 승계된다고 나와있던데...그래서 환불요청했더니 자기네들 정책이랑 맞지않다고 반려되고...계정복구를 해주던지 환불을해주던지 해주세요. 광고는 좀 봐야 하지만 심한정도는 아님. 한판에 아이템은 잘나오면 흰템하나 나와 합성해서 올리기 겁나 힘듬. 무과금으로 가능은 하나 라운드 깨기 어려워 노가다로 레벨올려 랩빨로 올라가야함. 보석모아 아이템 뽑아도 팟탬도 잘안나옴. 흰템이라도 잘나오면 템노가다라도하지...30랩대인데 아직 흰녹팟템임.. 보라템은 구경도 못함 타격감도,좋고,스릴도,있어요,겜은 정말 잘,만들어데 운영이아쉽워요하면,할수록,제작진 의도가,보여요 컨츄롤과 장비로 챕터을,마스터 하는것이 아니라는느낌이자꾸들어요 궁수의전설은 할때 없을때 심심할때 스트레시 받을때 하는 게임입니다.(개인생각) 버그가 없지만 그래도 재밌는 게임입니다 그래서 꾸준히 하다보면 더쎄지고 더 강력해져서 정말 스트레스가 풀려서 좋은 게임입니다! 재밌네요! 한가지 말하자면 버그가 좀 있어요.그래도 아직까진 심한버그를 보진않았고요. 와파없이 할수있어서 좋고 별10000000개 드리고 싶을정도로 재미있게 하고있는 게임중 하나입니다! 이게임 제작자님은 평~생 행복하실거에요! 무빙과 패턴만 알면 그리 어럽지 않은 게임입니다.노력만 하면 장비도 에픽도 1달 ~2달사이로 만들수 있어요 그리고 캐릭터도 열심히 하면 얻을수 있기에 전 강추합니다 아 그리고 가끔 너무 어럽다 무슨 이런 게임이있나 이겜 쓰레기네 하시는분 1주일만 해봐요 님들 생각이 확 달라질겁니다. 아주아주 재밌어요 지금까지 잘 플레이 하고 있고요 재밌습니다 다만 기는 하나가 추가 되면 좋겠습니다 그 기능은 바로 상대방이 나 한테 무기 펫 등등 이런걸 줄수있게 할수있는 기능이 추가 되었으면 합니다 그리고 다시 한 번 말하는데 이 게임 진짜 너무너무 재밌습니다 꼭 다운 받길 추천 드립니다 재미있어요...ㅎ 한번씩 시간 비었을때 하기 딱 좋은 게임이에요. 그런데 계속해서 게임 한판이 끝나면 불법적인 경로로 이용시 계정이 정지당한다고 메시지가 뜨면서 코인 보상같은거... 전부 받지를 못하네요. 이건 필수로.. 좀 고쳐주셨으면 합니다. 궁수의 전설은 많은 변화가 있었습니다. 히어로모드,더 많은 챕터,시즌, 아무튼 많은 변화가 있었죠 저는 궁수의 전설이 갑자기 생각나서 해봤는데 원정,더 많은 능력,더많은 장비들,새로운 챌린지, 이런것들은 저의마음을 서로 잡았습니다. 앞으로도 많은 천텐츠와 제미를 돋구웠으면 좋겠습니다. (멀티모드는 언제 개선 되나요? 답변주세요:)) (추가) 와이파이가 없으면 게임이 안된다는 게 아쉽네요ㅠㅠ 일단 챕터10까지왔는데 너무 어렵네요ㅠ 이건좀 개선해 주시면 감사하겠습니다 처음 하는건데 생각보다 더 재미있고, 중독성있어요. 그리고 광고도 별로 없네요.그런데 PVP모드도 있으면 좋겠어요. 그래서 PVP모드를 한 사람과 4~5판을 하면서 첫 판에는 랜덤으로 스킬 하나를 받고, 첫번쌔 판에서 진 사람은 두번째 판에서 스킬을 랜덤으로 하나를 얻고, 이긴 사람은 진 사람의 스킬을 얻고, 랜덤으로 스킬을 얻는 과정으로 진행해서 보상 3개정도 중에서 하나를 선택해서 얻는 그런 방식이면 좋겠어요. 그래서 랭킹도 만들고. 없어도 없는대로 재미는 있는데 늘 같은 방식으로 하니까 조금 새로운걸 하고싶게 되서 다시 썼어요...
전체 리뷰 저질스런 방법의 광고가 부쩍많습니다. 예를듣어 쿠팡 광고는 광고닫기버튼을 고의로 잘못 누르게 흰화면에 작은 흰색닫기버튼으로 클릭유도등.. 있던정도 떨어지게 만드는 광고들의 관리가 필요함 겜은 옛날에 거랑 똑같음. 단순하고 재밌음. 단점은 컨텐츠가 좀 많음 좀 줄여도 될듯. 옆에 도전은 괜찮은데 매인 화면에 뭐가 많음. 제일 맘에드는건 몬스터들 말투임. 진지하게 진심으로 진짜진짜 정말 최고로 귀여움 너무 귀여워서 얘들 말할때마다 캡쳐해놓음. 너무 귀여워. 몬스터한테 이런 귀여움을 느낄줄이야. 항상 즐겁게 하고 있습니다... 그런데 요번에 배틀패스를 구입했는데 아무리 눌러도 보상상자가 까지지를 않네요... 분명 열수 있는 상자인데 말이죠... 제설치를 해보고 데이터 초기화를 해봐도 고쳐지질 않습니다. 해결부탁드립니다 와이파이기 연결이 되있는데도 연결중으로 뜨고 캐릭터 레밸업시키는 시간이 오래걸려서 불편해요.ㅠㅠㅜ 여러거지 기술, 무기 캐릭터 있고 여러가지 모드가 있고 주기적으로 이벤트 하는 게임 하지만 무기, 장비 등이 추가되면 이전의 장비보다 당연히 좋게 나오고 그 무기를 뽑게 하도록 과금 유도가 있음 주기적으로 이벤트를 하지만 솔직히 다 똑같음 수집하고 교환하고.... 과금유도가 패키지도 있고 패스도 있어서 심해 보일 수도 있지만 시간으로 커버가 가능함 다른 게임들은 시간으로도 커버 못하는 게임이 많음 여기까지가 ... 2021년도 까지임 게임이 후반부로 갈수록 심해지는 과금유도 현상이 생겨서 이 게임 역시 이제는 무소과금 유저에게는 차...
전체 리뷰 진짜 여태 껏 제가 한 게임 중에 가장 만족도가 높은 게임 입니다. 광고도 안 나오고 돈도 잘 모이고 노가다 인 듯 지루하지 않아 재미있어요 지루 하다고 느껴 질 때 레벨업이 되서 좋고 레벨업 하러 들어갈 때마다 돈이 부적하다고 뜬 적이 없는 것 또한 너무 좋은 것 같아요 근데 별점이 4점 인건 그냥 왠지 뭔가 허전하다고 느껴져요 부엉이 같은 팻을 더 추가해 주시거나 아니면 특수효과? 비슷한 공격탬도 나왔으면 좋겠네요!😁 걍 모바일게임은 이런스타일 겜이 제일 어울리는 것 같음. 조작 단순에 매번 랜덤 선택지로 매판 다른 느낌을 주는 게임 재미는 있는데 하다가 오류가 너무납니다 한번씩 엄청느리고 에너지도 숫자가 왔다갔다 하네요 2년전부터 재미있게 플레이했던 유저입니다. 이게임은 심심할때마다 플레이할 수 있어서 좋고 제가 좋아하는 장르 게임이여서 2년동안 플레이하고 있는 겁니다 이 게임 추천 게임도 너무 재밌고 좋은데요 보석수급이랑 게임플레이하는데 필요한 번개가 너무 부족해요 꼭 읽어보시고 개선좀 해주세요 그냥 특색 없는 양산형 게임 해볼만은 하지만 오래하기에는 무리가 있다 처음 부터 다시 무한 반복 질려버림 싱가폴이지만 딱 중국산 게임 같은 기분 요즘 중국도 따라 카피하는건 잘 하네 특색이 없어 저는 너무 너무 재미있게 즐기고있어용~♥♥제가 2번째로 제일 좋아하는 게임이에용~!!진짜 진짜로 추천드려요~!!! 재미는 있고 광고도 별로 없지만. 밑에 별다섯개들. 왱지 번역기 돌려서 올린거 같음. 재밌습니다!!근데 옛날에 섭정햇던 그 옛날 게임 다시 진행해주시면 안될까요..?이 게임 보니깐 그 옛날 게임이 생각나서ㅓ..ㅜㅜ 지금 게임 접속해도 연결중 로딩만 뜨고 이상합니다갑자기. 보석받는 리워드 광고만 네번째봐도 보상을 안해주고 계속 오류납니다ㅡㅡ 신화급 장비를 제외한 모든 장비 고장 장비에서 분해 가능하게 해주셨으면 좋겠어요 ~ 어느순간 갑자기 아이템 드랍률이 떨어졌습니다. 장비던전 돌때 보통 4~5개 나왔는데 이제 3개 나오네요... 일반던전도 2~3개에서 하나로 줄었고요... 거품 다빼고 솔직한 리뷰 작성합니다. 게임 자체는 조작도 단순하고 스킬을 조합하는 재미도 있어서 킬링타임으로 하기 정말 좋습니다. 다만 게임하면서 조금 불편한 점이 있었는데 개선해주시면 좋을 것 같아요 :) - 몹 체력바가 안보이는 버그 - 적과 적의 투사체를 제외한 오브젝트의 투명도를 조절하는 기능 (아군 펫과 적 // 그리고 서로의 투사체가 분간이 안가요..) - 에너지 회복 속도 상향 - 스테이지 진행에 따라 난이도가 지나치게 상승하는 점 (몹체력 하향 / 강화효율 증가 / 투명도 조절기능 도입 등으로 난이도를 조금 낮춰주시면...
전체 리뷰 게임 재밌네요 3챕터부터 난이도가 급상승한감이 있지만 그래도 렙과 장비 업글해서 깨야지 하는 생각으로 하니까 어려운게 오히려 좋은점이 된것같습니다. 번개20개 제한은 괜찮은데 차는 속도가 10분에서 7분정도로 내리면 좋을것같습니다. 무기마다의 특성도 괜찮고 하지만 장비 상자의 열쇠를 주는 빈도가 좀 더 자주있었으면 합니다. 등급이 여섯가지인데 현질을 안하면 그중간인 에픽,레어등급 아이템도 얻기도 힘든 상황이니까요.. 적어도 레어까지는 장비를 맞추기 쉽게 패치 해주셨으면 좋겠습니다. 부족한 점들 1. 강화 되돌리기 시스템 초보자들이 템이 더 좋은 것들이 얼마나 있고, 자신에게 맞는 아이템이 무엇인지 알기전에 강화하여 손해를 봄. 2. 적을 밀쳤을 때 벽처럼 공격이 막히는 곳에 들어가짐. 시간이 지연되고, 발사체를 사용하는 적들의 경우에는 발사체는 그자리에 남고 적만 벽에 들어갓다가 다시 나옴. 3. 매 판마다 들어가는 에너지가 많음. 게임이 재미있으나 한판에 5개나 소비되서 게임을 즐기다가 마는 느낌이 들어서 아쉬움. 4. 스테이지 시작 시 돌리는 룰렛에 스크롤 포함되었으면 좋을 듯. 스크롤 구하는게 늦어지는 ...
전체 리뷰 정말 오랜만에 접속 했는데, 착용하고 있던 고대의레전드급 쏘우블레이드와 살아있는폭탄 두가지가 사라지고 없네요. 어렵게 만든건데 도대체 무슨 오류인가요?? 재밋는듯. PC의 아이작의 구속같은 로그라이크류 게임을 그대-로 박아넣은게 아닌 모바일 환경에 적절하게 반영한 점이 인상깊음. 리뷰 대부분은 에너지 부족하다고들 하시는데 이겜이 무료로 다운되는 이상 부분유료화부분은 할말없다고 봅니다. 추후에 버그픽스, 더 다양한 몹과 보스, 추가어빌리티 등등 더 많고 새로운 요소(신캐라던지,다양한 모드 등..), 지속적인 업데이트가 이루어진다면 충분히 갓겜이 될수잇다고 봅니다. 확실히 재밋지만 갓겜이 될 그날을 위해 별은 4개 조작 간단하고 꿀잼게임입니다. 몇가지만 패치로 추가되면 좋겠습니다. 안쓰는 장비 분해해서 재료를 수급할 수 있게 해주세요..재료 모으기 빡셉니다.. 에너지도 없는데..그리고 1판당 소모되는 에너지를 5보다 적게 줄이던지 레벨업을 하면 최대 보유 에너지량이 늘어나게 해주세요.. 20개 너무 적어요.. 5개씩 깎이는데.. 그리고 광고.. 15초 짜리로 줄이면 안되려나요.. 30초 너무 깁니다..그리고 마지막으로.. 장비 종류들 업데이트 해서 늘어나면 더 재미날듯..서로 다른 장비를 합성할 수 있게 한다던지..뭐 여러가지? 자유분방하게 돌아다니며 정밀하게 캐릭터를 조준하는 몹들에비해 자신의 캐릭터는 움직임의 공간이 턱없이 부족, 매우 불편한 조이스틱 이동. 초반 스테이지부터 꼴에 어렵게 만든다고 몹체력은 또 뒤지게 높음. 현질유도는 말할것도 없고 플레이하는 시간을 고려하면 돌아오는게 매우 적음. 사운드와 이펙트는 arrow.io를 거의 그대로 빼다박음. 멈추면 공격한다는게 이 게임만의 고유한 특징이지만, 그마저도 공격캔슬이 되는 경우 다반사, 렙업시능력으로 공격속도가 자주 나오지않는이상 컨트롤적인 요소가 플레이어의 생각대로 따라가주지못함. 위와 같은 ...
전체 리뷰 장점: 이런류의 게임이 별로없어서 참신함 단점: 1. 난이도 조절 실패- 현질을 해서 상자를 많이 까지 않는 이상 챕터 5부터 깨는게 거의 불가능 2. 데미지 분배- 분명히 멀티샷이면 600데미지가 두번 들어가야 정상인데 300씩 나눠서 두번들어감. 이러면 멀티샷 의미가있는지; 3. 에너지 소모량- 한판당 에너지 5개씩 소모하는데 에너지 하나 차려면 12분을 기다려야함. 그럼 한판당 1시간을 기다려야하는 셈. 4. 코인 레벨제한- 무과금으로 즐기고 싶은 사람들이 그나마 데미지 올리는 방법이 재능올리는 것일텐데 이것마저도 레벨제한이 ...
전체 리뷰 궁수의 전설을 재밌게하고 있는 플레이어 입니다. 핸드폰의 성능 문제와 제 컨트롤 문제로 아직 스테이지 3에서 벗어나지 못하고 있는 뉴비이지만 개선할 점이 있어보여 리뷰를 작성합니다. 먼저 적이 위아래로 움직이고 있고 캐릭터가 그 방향의 수직으로 있으면 초근접 상태에서도 맞추질 못한다는 것입니다. 발사속도 때문에 멀리서 공격할 경우 맞추질 못한다면 이해하겠는데 매우 근접한 상태로도 맞추지 못하는 것은 문제라고 봅니다. 2번째로 타켓팅 문제입니다. 기본적으로 근접한 몬스터를 우선순위로 두는 것으로 보이는데 뒤에 있어서 맞추지 못하는 몬...
전체 리뷰 폰으로 할 수 있는 적당히 좋은 로그라이크라고 생각합니다. 자동조준과 자동사격방식은 모바일에 어울리는 컨트롤방식, 거기에 맞춰 공격과 리스크를 잘 조절한 게임인것 같습니다. 아직 다 키워 보진 못했고 게임 진행에 도움이 될 언락을 다 얻진 못했지만, 모바일에 적당한 컨트롤과 어려울수 있는 난이도지만 성장으로 극복하는 게임플레이가 나쁘지 않다고 생각합니다. 단점은 에너지란 리미트를 줘 흐름이 끊키는점, 특수효과 소리가 너무 단순하고 모노톤인점입니다. 최적화도 되면 좋겠지만 3D게임인 이상 감안해야할 부분일것 같습니다. 4챕터 49단계 까지 플레이 후기 우선 게임은 중독성있고 재밌었습니다. 근데 불편한 사항들이 많았어요 예를 들면 1)어빌리티라고 하나요? 세개중 하나를 뽑아 쓰는데 이게 무슨 능력인지 써보기 전에는 대놓고 크리티컬 이런 능력 외에는 알 방법이 없습니다. 도감 같은게 필요하다고 생각하구요 2) 화면 밑쪽에 이동할수 있는 스틱이 있는데 캐릭터가 밑에서 움직이면 괜찮지만 위로 올라가면 화면을 스틱이 가려서 탄알을 볼수가 없습니다 이건 보완을 좀 해주셨으면 합니다!!! 필수 일듯)) 3) 상자를 까야하는데 보석을 모으는게 생각보다 어렵습니...
전체 리뷰 재미있게 하고있습니다. 하지만 개인적으로 게임을 플레이 하는데 있어서 너무 끊어지는 감이있네요. 각 스테이지가 매번 한번에 클리어 되는게 아닌 이상 당연히 입장 재화를 소모하면서 플레이를 하게되는데 수복속도가 너무 느립니다. 재능을 해금하고 레벨을 올려야 클리어할수있게 만들었으니 당연히 스테이지 클리어가 막히는 부분이 존재하고 결국 입장재화를 소모하고 플레이가 끊어지고 재화가 회복될때까지 너무 오래걸려요. 퀘스트 같은 형태로 입장재화를 챙겨주고 회복에 드는시간을 줄여주셨으면 합니다. 그리고 마지막으로 몇몇 벽이 통과되지않던 투사체가...
전체 리뷰 재밌다! 그러나 버그가 너무 많다! 1월 29일 업데이트후 랙이 너무 심하다! 게임 진행이 불가능할 정도로 랙이 심해졌다! 기본적으로는 재밌지만 운에 좌우되는 스테이지 진행이 짜증을 유발한다. 이는 스테이지 레벨업 마다 습득 가능한 스킬이 랜덤 3슬롯에서 하나를 선택하도록 되어 있는 것에 기인하는데 게임이 진행 될수록 업그레이드의 종류는 늘어나는데 슬롯은 여전히 3개이니 결과적으로 게임이 진행될 수록 유저가 원하는 스킬이 나올 확률이 급격히 떨어진다. 추가되는 스킬들이 강한 것도 아니고 '펫 강화'나 렌덤 공격인 '메테오'같은 도움 안되는 스킬 위주이다 보니 결국 진행이 될수록 게임은 초반의 감각과는 거리가 먼 짜증나는 운빨 의존이 된다. 향후 스킬 습...
전체 리뷰 에너지를 11분마다 1개씩 차서 게임을 거의 한시간에 한판 밖에 하지 못해서 11분 마다 1개가 아니라 11분 마다 5개씩 차게 하거나 한 판당 드는 에너지수를 줄일 필요가 있어보임.그리고 플레이를 하고 나면 받는 플레이어 레벨을 올릴수 있는 경험치의 량이 너무 적다.던전이 올라 가면 올라갈수록 난이도는 어려워지는데 받는 양은 똑같아서 점점 어려워짐 따라서 챕터가 올라갈수록 받는 경험치 양을 늘릴필요가 있음. 한 챕터 중에 중간 보스를 틀리어 할때마다 몹들의 HP나 공격력은 점점 세지는데 반면 플레이어는 레벨이 11레벨 까지로 제한...
전체 리뷰 두말할 것 없이 굉장히 재밌습니다. 처음에 별기대감 없이 게임을 시작했으나 딱 한판하고 바로 빠져들었습니다. 적절한 난이도, 타격감, 여러가지 스킬을 레벨업 마다 하나씩 얻어서 매판마다 새로운 플레이를 할수있게 만들어 전혀 질리지가 않습니다. 별로 좋지않은 조합이 나와서 오기도 많이 생기구요. 모든 부분에서 만족감이 드나 에너지가 아쉽네요.. 더 플레이하고 싶으나 에너지가 너무 적어 원하는 만큼 할수가없어 가끔 짜증도 났습니다. 광고를 보고 5의 에너지를 얻을수있지만 그것도 소모성이 있구요. 광고를 보고 계속 플레이 할수있도록 만들...
전체 리뷰 이 게임은 재미는 확실하게 보장하는 게임이라고 생각한다. 다만 단점이 있다. 첫번째는 스테이지 난이도 3스테이지부터 어려워지기 시작하는데 스무스하게 올라가면 괜찮지만 스테이지 마다 난이도 상승량이 보입니다. 두번째는 무기진화(?)시스템과 사용되는 게임머니량 무기진화의 경우 같은 등급의 무기를 총 3개나 모아야 하며, 드랍률도 낮고 난이도 또한 높은편이다. 그리고 캐릭터의 자체 스텟을 늘리기 위해 필요한 요구 재화량의 증가수치가 높다고 생각한다.무기 강화도 마찬가지. 밸런스 개판인것만 빼면 제법 괜찮은 게임입니다. 다양한 스테이지와 무기, 장비, 능력들을 맞춰가면서 캐릭터를 육성하는 재미가 있습니다. 하지만 3단계쯤 가보신 분들은 공감하겠지만 맵은 좁아터졌는데 몬스터는 더럽게 많이 소환되고 몬스터의 이동속도, 공격범위도 심상치 않습니다. 세로화면의 최고단점은 유저시점에서 시야가 제법 좁아진다는 것인데 이렇게 스테이지 난이도를 막무가내로 짜다보면 어려운 게임이 아닌 그냥 대충만든 양산형 게임급 수준(밸런스 생각안하고 아무요소나 막 구겨넣고 아무튼 어렵다고 개기는 방식의 수준) 밖에 더 안된다는 점...
전체 리뷰 버그를 보고합니다. 어떻게 해서 이 버그 트리거가 작동되었는지는 모르겠지만, 2스테이지에서 개인 능력인 '시작할 때 스킬 하나 선택' 을 하고, 다음으로 넘어갔더니 레벨창이 사라졌습니다. 그래서 그런지 몬스터를 죽여도 레벨업이 안됩니다. 확인 부탁드립니다. 또 다른 버그는, 가끔씩 중간보스의 체력이 안 보일 때도 있습니다. 1스테이지는 잘 모르겠지만, 2스테이지에서는 특히 거미보스의 체력이 보이지 않습니다. 이것도 확인 부탁드립니다. 다음은 2스테이지의 뱀의 인공지능입니다. 뱀을 최소 2방향을 막는 벽 근처로 유인하고 그 반대편으로...
전체 리뷰 에너지 모으는 방법이 별로 없음. 에너지 다쓰면 1개에 10분임. 던전 1개 말고 에너지 1개. 던전 한판 다시돌려면 최소 50분이 필요함. 이건좀 아니지;; 여기서 1개에 5분정도만 해도 필요한 시간이 절반으로 줄어드는데;; 그리고 사막스테이지에서 빨간공 뱉는놈이 머리를 쭉 내밀면서 뱉는데 왜 그게 지형을 넘어가는지 모르겠음. 모션을 머릴 위로 쭉 내밀면서 뱉으면 이해하는데, 모션이 머리를 앞으로 내밀면서 뱉는데;; 요약하면 1.에너지 얻는방법 개선 2.일부 몬스터 모션 개선 챕터 4까진 재밌게 했으나 챕터5부턴 도저히 엄두가 나지않는 난이도와 성장폭이 너무작아 진행할수록 쌔졌다는 느낌이 적은 것이 단점입니다. 보통 성장으로 몇몇 스테이지는 호쾌하게 넘어가는 맛이 있어야하는데 너무 컨트롤 중심이라 현질을 해도 맞는건지 의문이들고 괜히 지른것 같은 느낌이 듭니다. 페이 투 윈은 재밌는게임이 되려면 지양해야된다는 입장이지만 왜 장비 육성시스템을 넣어놨는지 궁금할정도입니다. 정말 한달 꾸준히 참을성있는 분만 그 성장의 재미를 느끼겠지만 그 텀이 상당히 길어 개구리가 냄비물에 천천히 온도를 올리면 뜨거운물이 되...
전체 리뷰 무기마다 설명보면 어떤건 공격력이 쎈대신 공속이 느리고 어떤건 공격력이 약한대신 공속이 빠르다고 되어있는데 실제로 무기 스텟을 보면 공격력이 전부같고 공격속도표시가 없네요. 이런부분들은 좀 업데이트해줬으면 합니다. 그리고 한국어 번역이 좀 어색한 부분들도 있고요. 게임은 너무 재밌게하고있습니다. 대신 에너지수급이 정말 극악이네요.... 개선이 필요한듯 게임 자체는 재미있는데, 에너지 때문에 좀 짜증나네요. 에너지 최대는 고작 20인데, 충전되는데 걸리는 시간은 너무 길어서 게임에 몰입되기도 전에 에너지 다 쓰고 할 수 있는게 없어 한번 할때 오래할 수 없으니 좋은 게임임에도 게임성이 안좋게 느껴져요. 최대 에너지 갯수를 늘리거나 충전시간을 단축시키는 방법도 있을거 같고, 아니면 에너지 최대치나 충전시간 단축등을 재능같은 것 처럼 강화시킬 수 있는 시스템을 도입시키는 것도 좋을 것 같네요. 장점 1. 실력이 반영되어 플레이를 할 수 있음 2. 스테이지마다 몬스터가 랜덤으로 등장하여 질리지 않음 3. 각 맵마다 각각의 특징이 있음 하고 싶은 맵 플레이 가능 단점 1. 번개소모 극심 (한판에 번개5개...충전시간 번개하나당 10분정도) 2. 난이도가 올라갈수록 실력보단 아이템에 의존하게됨 (한마리 잡다가 다른몹한테 얻어맞고 죽음 ㅋㅋㅋㅋ) 1. 쉽게 빠져들 수 있게 잘 만듦 2. 게임 기회가 4번(에너지 20개 중 한 판 5개) 광고보면 +5회 (5번) 3. 3번째 섬 꽃대가리 2마리 보스부터 난이도 극악 그 전까는 컨트롤로 커버가능 4. 아이템 및 애완동물 도감 있었으면 함 5. 인간적으로 난이도 하향필요. 6. 난이도 하향 안할거면 캐릭터or스킬 상향 필요 7. 과금요구도는 쏘쏘함. 해도 되고 안해도 됨 3-19까지만 깨보고 난 후 후기작성했음 게임 자체는 재미있는데 일부 몬스터들의 패턴이 게임에서 제공하는 조작으로 해결하기엔 회피난이도가 지나치게 높은것들이 존재하며 딜찍누가 강제되는 상황이 자주 나옴. 라운드마다 맞으면서 올라가는걸 상정하고 개발했다기엔 회복조건이 쉽지도 않음. 요약하면 재미는 있지만 적의 패턴 디자인은 개선점이 많다. 개발 방향이 과금유도를 의도한 것이라면 성공적. 드래그하여 캐릭을 움직이기에 순간반응이 반박자 느림. 몹들에게 갑자기 둘러쌓여서 타겟 지정으로 공격당하면 컨트롤에 답이 없음. 오래 생존하면 할수록 몹들에게 계속 맞을 수 밖에 없는 구조임. 그래서 생존 스킬은 도움이 거의 안 되고 오로지 빨리 죽이는 공격 스킬 만이 도움이 됨. 광역 스킬은 벽 반동과 조합이 되야만 도움이 됨. 계속 해보면 공격속도 공격력 몹반동 멀티샷 스킬만 기다리고 나머지는 쓰레기 스킬이 되어버림. 스킬들은 랜덤이고 계속 안 나오면 열 받게 됨. 스킬 밸런스가 엉망임. 순간 회피가 중요한 구조인데 드래그 컨트롤...
전체 리뷰 2년정도 꾸준히 하고있는게임입니다.무과금으로 매일 접속해서 템모으고 합성에서 올리고 개노가다 해서 100만렙에 전투술(레전드)만 빼고 전부 고대의 레전드입니다. 전에는 돈이며 템이 잘 모으기힘들어서 건의했는데 오랜시간이흐르니 그런생각이안드네요. 게임하다가 이벤트에 무한탐험 하다가 한판에 오랫동안 가서 그런지 버퍼링 도 생기고 캐릭터 멈춤현상 또는 멈춤이 돌아왓을때 앞으로 이동하는현상. 공격이 잘안나가는 현상. 그리고 렉 도 많이 걸립니다. 이런 현상 안생기게 해주세요. 그리고 스크롤 되팔기나 교환기능 생기면 좋겠어요. 몇개의 랜덤으...
전체 리뷰 음.. 얻을수있는 기술이 추가된건 좋은데.. 별로 쓸모없는 기술들이 많아져서 더 효율적인 기술을 고르기가 너무 힘들어져서 게임이 시원시원한맛이 사라짐. 기술들이 늘어나는것 만큼 레벨업 할때마다 3개중 하나를 고르는것도 4개나5개중 고를수있게 늘어나야 밸런스가 맞지않을까 싶음... 스킬 구더기 나올때마다 너무 힘들고 하기 싫어지는 ㅠㅠ... 대부분 만족은 합니다만 에너지가 너무 적다는 점과 10층씩마다 나오는 보스오류를 제의합니다. 먼저, 한 판에 사용하는 에너지를 3~4로만 낮춰도 괜찮을 것 같습니다. 두번째로, 5스테이지인 잊혀진 성에서 10층이나 20층에 나오는 늑대보스에서 데미지를 입지도 않았는데 1초마다 피가 닳기 시작하면서 자꾸 5초도 안되서 죽어버립니다. 오류 빨리 고쳐주세요. 컨트롤도 중요하지만 운에 따라 진행이 빠를 수도 느릴 수도 있음. 재능 레벨 업 비용 굉장히 비싸고 장비 수급 똥망이라서 현질하지 않는 이상 성장속도 굉장히 느림. 근데 업글해도 그리 쌔지지도 않음.. 그리고 무기 사이드 추천. 뎀지 쌔고 모션 캔슬 가능함... 현재 일반2개 레어2개로 4챕터 감.. 근데 4챕터가 한계일듯 11챕터 진행중인 유저입니다. 챕터를 클리어 하면 할수록 느끼는 것이 있는데 뭐냐하면 히어로 모드가 있는데 노멀도 왜 어려워야 합니까? 입니다. 업데이트 진행하니 난이도가 더 올라갔더군요 유리한 아이템 드랍률을 올려주시던가.. 드럽게 어려운데 아이템도 쓰레기 같은거만 자꾸 줘서 실패 성공 상관 없이 홈으로 그냥 나가버립니다 너무 재밌어요!! 근데 챕터가 올라갈수록 어떤 보스는 쉽지만 어떤 보스는 너무 어려워서 진짜 한달동안 시도했는데도 못깨겠네요 ㅠㅠ 그래도 너무 재밌어요! 게임성 자체는 재미있으나 그래픽 깨짐 현상 , 발열, 렉 이 세가지 문제가 너무 심각함. 그래픽 깨짐 현상은 픽셀처럼 보이는 부분이 너무 심함. 발열은 3D 최신 게임 어느걸 돌려도 심하지만 이 정도 그래픽이라면 그렇게 높은 사양을 요구하지 않아 보임에도 불구하고 심각할정도의 발열이 문제. 렉 현상이 제일 심각한데 캐릭터 컨트롤러가 특정방향으로 고정되서 움직이지 않는다던지 움직이는 버튼을 아무리 움직여도 움직이지 않는다 던지 하는 문제가 발생해 게임 자체에 흥미가 식어버림. 이러한 요소들을 개선할 경우에는 좋은 게임으로 발전할수 있...
전체 리뷰 게임 진짜 재밌고 잘 만들었습니다. 지금 월드6까지 깻습니다. 하지만 후반으로 가면 갈수록 게임이 숙련도나 스테이지에 대한 이해가 아닌 스킬의 운빨에 따라 결정이 됩니다. 멀티샷, 전방 화살등이 아닌 회전하는 스킬로만 나오면 그냥 똥챔이 됩니다. 어떤 특정 스테이지는 입장후 3초도 버티지 못합니다. 게임은 재밌고 즐길만한 게임으로는 정말 좋은데 컨트롤하는게 저만 그런지는 몰라도 진짜 않먹어요;;;저는 움직인다고 움직이고 있는데 왜 캐릭토는 거의 제자리걸음처럼 조금만 움직이고 잘 않먹어서 가만히있을때가 더 많아요;;이게 개인의 문제면 제 핸드폰이 문제겠지만 다른 개임이나 평소에는 잘 되었고 이 게임의 컨트롤을 하려고 하면 그렇게 되요.수정을 해 주시던가 확인을 해 주세요. 안녕하세요! 즐겁게 플레이하고 있는 유저입니다. 자투리 시간이 날 때마다 플레이하는데요. 저에게 있어서 나무랄 데가 없는 완벽한 게임..이였으나 스테이지가 가면 갈수록 한계에 부딫히는 상황이 역시나 많아집니다. 그럴 때마다 강함을 추구하는데 있어 장비뽑기, 장비강화, 장비융합, 재능 업그레이드 가 있지만 뽑기도 몇 일에 한 번 하는 추세라 뭔가 전투력을 올릴만한 새로운 기능이 있으면 쉽게 질리지도 않고 더욱 많은 유저들을 사로잡을 수 있을 것입니다. 일단 재밌다 재밌는데 첫째. 단계가 가면갈수록 능력이 많아지는데 쓸모없는 능력이 많아진다 어찌보면 운빨겜인데 능력선택폭이 너무 넓어져 쓸모없는능력을 삭제시킬수있는것도 필요해보인다 둘째. 에너지칸이 너무 작다 한번에 20개밖에 못채우는데 한판하는데 5개가 든다니... 칸을 늘리던가 에너지를 없애는방향이 좋아보인다 셋째. 능력도감이나 몬스터도감이 필요해보인다 능력,몬스터에 대한 설명이 있었으면 좋겠다 넷째. 보스몬스터는 깨면 룰렛을 돌리는데 이미 체력이 다 차있는데 회복이걸리거나 쓸모없는 능력이 걸리면 보스깨는맛이 없어진다 보스깨면 룰...
전체 리뷰 가면 갈수록 난이도 밸런스가 말이 안됨. 나의 캐릭터가 쎄지는 것보가 몹들이 쎄지는거 더 큼. 쓸모 없는 스킬들이 너무 많고 스킬들이 제대로 안나오면 스 챕터를 깨는 것은 불가능에 가까움. 몬스터 몹들 하나하나마다 공격늘 피할 방법은 있긴하지만 한 스테이지에 나오는 몹들의 조합이나 수 때문에 너무 어려워짐. 좋은 게임이지만 챕터를 깨면 깰수록 너무 어려워서 하기가 싫어질 정도 할거면 나처럼 혼자 빡쳐가면서 하지말고 딱 챕터7 히어로 모드 4까지만 하길 추천 최악이다. 난이도는 그야말로 극악이나 다름없었다. 처음에는 어찌저찌 피할 수 있었으나 맵이 새로 개방될 수록 난이도는 더욱 개 같아진다. 공격력이 딸려서 몹을 잡지 못하면 한 턴이 지나가 몹은 새로 추가되고, 캐릭터가 몸을 숨길 만한 구석은 더욱더 사라지며, 그 다음엔 죽는다. 따라서 죽지 않으려면 몸을 숨길 구석을 찾아야 하며 그러려면 공격력이 뛰어나야 하는데, 그러면 결국 좋은 무기가 필요하다. 그래, 돈이다. 유저에게 과금을 유도하는 것이다. 노가다? 그것도 할 수 있을 때 얘기. 4판 돌리고 다시 4판을 돌리려면 자그마치 2...
전체 리뷰 재밌게 즐기고 있습니다. 다만, 케릭터 주변을 돌면서 원거리 공격을 방어하는 방패 효과가 펫(부엉이)의 공격도 막아주고 있습니다. 펫(부엉이)이 케릭터를 공격하는 것이 아닌데도 효과가 적용되는 것은 이해하기 힘드네요.. 게임 자체의 중독성은 매우 띄어납니다. 어빌 시스템은 본인 기량의 한계를 명확히 알게 하는 타 아케이드 게임과는 다르게 랜덤의 요소로 그 한계를 모르게 하여 게임을 더욱 질리지 않게 하는것 같습니다. 다만 아쉬운 사항을 정리하겠습니다. 1.악마가 아닌 경로로 획득하는 크리티컬 증가 lv2의 크리데미지 증가 미적용. (제발 고쳐) 2. 에너지 수급량의 저조함. (최대치를 늘리고 수급량을 늘리던가 광고 횟수를 늘리세요. 1시간에 1판하는 수급은 과금유도할수있지만 오히려 반감을 삽니다.) 3. 무기별 밸런스 붕괴 낫>활>부메랑>소우블레이...
전체 리뷰 게임을 3달정도 하고있는 유저입니다. 재미있고 플레이하는 방식이나 아이디어는 좋습니다. 하지만 현질을 하지 않고 다음 단계로 넘어가기가 매우 힘든구조입니다. 랜덤으로 배정되는 능력과 일정레벨에 도달하면 돈이 있어도 레벨을 올리지않는이상 능력을 업그레이드 못한다는 것에 관련해서 다음 단계로 넘어가는 것이 매우 힘듭니다. 뽑기를 해도 좋은 아이템이 나오는 것도 아니라서 이 부분좀 잘 해결된다면 아주 재미있는 게임이 될 것 같습니다. 로그라이크게임에 특성이 획일화 된게 맘에 안듬. 가장 강력한 특성은 공격력 크리티컬 공격속도에 멀티샷이나 전방화살정도 넣는건데, 이건 문제가 없음. 근데 원 시리즈나 검 시리즈 같은건 왜 만든건지 모르겠음. 쓸모도 없고 조건타지고 않고 쌔지도 않고. 버프를 시키던가 리멬을 하던가 해주셈 플레이 방식이 꽤 불편합니다. 수동 공격이나 적어도 방향키 고정 등은 필수로 추가해주시는게 바람직하지 않나 싶네요. 또한 몬스터의 밸런스도 조절이 필요하다고 봅니다. 이는 개인적인 의견이지만, 게임 특성상 투사체를 전부 피하기엔 캐릭터의 몸집이 있어, 필수적으로 맞게되는 경우가 후반으로 갈수록 빈번해집니다. 근데 몹의 데미지는 계속적으로 쎄지니 꽤나 억울한 사태도 발생하곤 합니다. 감사합니다. 레벨업 직후에 히어로 레벨업을 하려고 할 때 네트워크 오류뜨는 버그가 있습니다. 해당 버그는 레벨업 직후에 히어로 레벨을 올릴려고 하면 네트워크 오류라고 뜨면서 히어로레벨을 올리지 못 하는 현상인데 반대로 재능 레벨업은 가능하다는 것 입니다. 네트워크 오류라고 떠서 게임 재부팅을 하면 레벨은 다시 낮춰져있고 만약 재능 렙업을 하였다면 재능은 적용이 된 상태가 됩니다. 해당 버그는 스테이지를 1개 더 돌아서 경험치를 조금이라도 더 얻으면 바로 해결이 가능한 문제이지만 혹여나 전력을 다 써서 스테이지를 더 못 도는 상황이 오는 경우라면...
전체 리뷰 간만에 할게임 찾았네요. 좋아요. 근데, 갑자기 재능 레벨업과 스테이지 보상을 눌렀을때 로딩이 계속 걸리다가 나중엔 네크워크 오류. 나중에 다시 시도하라네요 몇시간 전부터 계속 이래서 보상을 받을수도, 재능렙업 할수도 없습니다. 빨리 고쳐주시기 바랍니다. 와이파이도 아무 이상없었고, 폰에 문제도 없어서 문의드립니다 게임 자체는 굉장히 중독성 있고 재미있다. 하지만 지나친 수준으로 '클래시 로얄', '브롤 스타즈'와 UI 및 그래픽 스타일이 비슷하고 심지어 몇몇 리소스는 트레이싱하거나 그대로 가져온 흔적이 보인다. 또한 화살 발사 및 경험치 획득 사운드 또한 Arrow.io의 것을 정말 그대로 훔쳐왔다. 무단 도용 및 표절한 리소스들을 교체한다면 4~5점을 줄 만한 게임이다. 하지만 레벨업 마다 어빌리티를 고르고, 상자를 개봉하는 등 기본 시스템들 또한 다른 게임과 굉장히 유사해 개인적으로 좋게 평가하고 싶진 않다. 조이스틱 크기 설정을 할 수 있으면 좋겠습니다. 스마트폰 및 태블릿 크기에 따라 조이스틱 크기도 달라집니다. 무엇보다 현재 조이스틱 크기가 너무 커서 캐릭터의 반응성이 늦습니다. 손 이동 반경과 경로가 너무 큽니다. 그리고 캐릭터의 이동속도도 너무 느려서 이동속도를 빠르게 하는 기능을 추가했으면 좋겠습니다. 감사합니다 게임 자체는 재미있게 잘 하고 있습니다. 5스테이지 나무밑둥형 보스가 너무 자주 뛰어오릅니다. 연속 6번까지 봤습니다. 횟수재한이 필요합니다. - 장비 재조합기능 추가 같은 등급의 같은 장비 2개로 원하는 장비로 변환 ex) 레어 데스사이드x2 =>레어 용감한 활 융합처럼 사용가능하고 보석이나 골드로 이용료를 받으면 많이들 사용할거 같습니다. 겜 자체는 무척 재미있고 할거없을때 하기 좋음 하지만 게임을 하기 위해 필요한 번개가 접속하면 없어지는 등의 치명적인 버그가 매우매우 자주 일어나고 데이터 없이 플레이하는게 어렵다는게 단점. 또한 스킬트리와 보스가 랜덤하게 나오기 때문에 스테이지를 클리어하는던 운이 상당히 많이 작용함 현재 챕터6 서식중입니다. 챕터5랑 챕터6의 위치를 바꾸는것이 어떠신지.. 챕터5가 챕터6보다 압도적으로 어려운거 같습니다. 많이 어려워하시는 분들을 위해 밸런스 조정을하면 좋겟습니다. 그리고 상자시스템에 대해서 건의 하고싶은게 있습니다. 상자를 열때 상자가 4종류로 나누어져서 고를수 있으면 좋겠습니다. 예를 들어 '무기상자,갑옷상자,반지상자,팔로워상자' 이런식으로요 ㅎㅎ.. 네트워크 오류가 너무 오래 계속됨 장비강화도 안되고 부활도안되고 심지어 새로운 맵깨도 다음맵으로 넘어가지지도 않음. 지금이거 리뷰쓰는거 보면 데이터, 와이파이 문제도 아님. 운영자가 이런 문제가 있어서 미안하다면서 메일을 보냈는데 그거 열리지도 않음 네트워크 오류 때문에. 이거 빨리 고쳐야함. 1. 4판하면 끝나는 번개량은 너무 적습니다; 2. 게임 몬스터가 많아지면 렉때문에 캐릭터가 화살도 못쏘는 경우가 많습니다. (특히 챕터3같은데서 노란해골 나오면 몬스터가 순간적으로 많아지는데 그때 렉 심합니다) 3. 다이아나 골드 모으는데에 시간이 많이 걸리는데 같은 스테이지만 몇번 계속 돌다보니 질리는 느낌이 있습니다. 퀘스트의 종류를 늘리던지(예를들어 골렘 10마리를 잡아라 같은) 다른 이벤트 맵 등을 만들어줬으면 합니다. (항상보면 외 광고하는 건 맵으로 안만들까요? 그것보고 오는건데) 4. 스킬 설명이 필요합니다. (팔로워...
전체 리뷰 게임은 진짜 재밌습니다.. 근데 아쉬운 부분이 너무 많습니다. 먼저, 한번 플레이할때 20개중 5개가 소모 됩니다; 두번째는 아이템 드롭률 그닥 좋지않고, 게임플레이 중 렉이 자주 걸립니다(그래픽 낮춰도 똑같습니다) 또 게임 벨런스가 좀 안맞다고 생각합니다. 한번 맞을때 피해량이..;; 마지막으로 동기화... 요즘은 잘되니까 다행이긴 합니다. 밸런스 패치가 시급함. 현재 11스테이지인데 후반 갈수록 레벨업할때 나타나는 선택지의 밸런스가 무기의 수, 데미지를 제외하고는 전부 별로일정도로 안맞음. 펫이나 주위를 도는 검이나 원에도 많은 데미지를 부여한다면 더욱 다양한 플레이를 할 수 있을거같음. 한 스테이지를 계속해서 깨는 동안 레벨업선택지에 무기강화 관련이 나오지않으면 그냥 죽고 다시해야지라는 생각밖에 안들고 스트레스만받음 물론 좋은 무기를 사라는 유도를 하는 것일 수도있겠지만 현재의 뽑기시스템, 강화시스템 모두 결제하기 싫도록 만들어놨음 다른 게임들보단 훨씬 재미있어서 몇 달이나 계속하고 있습니다만, 역시 아쉬운 점은 좀 있습니다. 1. 이벤트맵 난이도 '눈앞의 위협'이 문제. 체력, 공격력 둘 다 2배씩 했는지, 챕터보다 체력은 적지만 데미지는 더 쎈 기형맵. 빨간 슬라임 둘, 갈색 늑대 둘이 같이 오면 답이 없음. 10층 이후 기준 데미지가 일반몹 2천, 보스 5천(투사체는 3천?). 어빌리티 운 좋아야 겨우 깸. '빗발치는 화살'도 같은데, 피하면 되니 그나마 양반임. 2. 아이템 확률이나 다양성 큰 문제 못 느낌. 다른 게 먼저 패치돼야 함 3. 숨겨진 알림...
전체 리뷰 정말 좋은게임이긴한데 플레이어가 지정한 몬스터를 타격할 수 있어야 조금더 재밌게 즐길수 있지 않나 싶네요. 몬스터 특성상 먼저 치면 불리한 몬스터들(황금해골, 빨간색 돌진하는몹- 체력 0되면 분열함)은 나중에 쳐야 효율적으로 체력관리도 하고 전략적으로 몬스터 특성 파악하고 공략하는 재미가있는데 지금은 근접 몹이 있으면 무조건 가까운거 알아서 치거나 가끔 근접 몹이 달려드는데 멀리있는거 치고 있어서 컨트롤도 안되고 답답하고 그저 무빙치는 게임으로밖에 플레이 할수가 없어서 좀 아쉽습니다.. 이벤트 던전 돌던 중 갑자기 화면이 멈추더니 터치가 안먹네요. 강제종료시키고 재실행하니까 실행이 안됩니다. +데이터 켜고 실행중인데도 네트워크오류때문에 광고 보고 받는 추가보상들이 지급이 안되네요. 이벤트던전도 못들어가고 게임이 엉망입니다. 스토리모드 역시 끊기기 일수이며 게임중간에 튕겨버려서 강제종료되어버립니다. 출시된지 1년은 훌쩍 지난걸로 아는데 관리좀 제대로 하시기 바랍니다. 갓겜입니다. 폰게임 거의 해본적 없는데 이거는 진짜 꾸준히 하고 있습니다. 소액과금으로 13챕터 진행중입니다. 13챕터에 땅에서 튀어나오면서 빙글빙글 돌면서 발사체 사방으로 발사하면서 공격하는 보스가 있는데 밸런스 패치가 필요해 보입니다. 다른 보스들은 어렵더라도 패턴이 있는데 이 보스는 패턴이 없습니다. 12챕터에 나오는 화살 쏘는 보스는 굉장히 어렵지만 패턴이라도 있었습니다. 패턴을 어렵게 만들어 깨지 못하는 것은 전혀 문제가 아닙니다. 그런데 패턴이 없으면 말그대로 운빨겜이 되어버립니다. 안 그래도 어빌리티 잘 떠야깨는 운빨겜...
전체 리뷰 타격감은 모바일겜중최고라고 봐요 그중독성같은타격감에 다른겜은안되요 버그유저좀 잡아라. 괴물대결에서 시작부터 우리진영에 있는데 신고버튼도없고 듀오에서 얘들죽으면 처리좀 해라. 다음단계진행도 못하고 짜증나게 시간버리고 이 게임은 내가 해본 게임들 중에서도 괜찮은 편에 속한다. 일단 기본적으로 컨트롤이 그리 어렵지 않으나 유저의 실력에 따라 결과물이 천차만별이다. 거기다가 어빌리티를 그때그때마다 찍을수 있게 휘발성으로 해놓으니 과금유도가 크지 않다. 그러나 유저를 당황하게 만드는 벽뚫는 탄환은 내가 보기엔 없애는게 맞지 않나 싶다. 벽을 만든 이유가 전혀 없을정도로 상대의 탄환이 기가막힌 고각으로 캐릭터의 먹아리에 명중하기 일상이기 때문이다. 그리고 고유 특성도 랜덤으로 돌리는것이 나쁘지 않지만 열댓개를 여는 동안 아예 열리지않는 특성칸도 있기때문...
전체 리뷰 안녕하세요 궁스의전설을 재미나게하고있는유저입니다. 어느순간부터 네트워크 오류가 계속 떠서 폰도 꺼보고 와이파이연결도해봤는데 계속 네트워크 오류만 뜨더라구요 그래서 지웠다 다시 깔았는데 첨엔 되더니 다시 안되기 시작합니다.... 현질도 어느정도 하고 깻던판도있는데.. 다 없어진 상황이고 현재도 되지않는상황입니다.. 조치 부탁드릴게요... 간단하게 게임설명하자면 애로우.io + 아이작임.난이도는 아이작을 살짝더뛰어넘는정도. 장점은 두 게임을 짬뽕시켜놓음으로써 중독성을 극대화 시켰음 이게 이게임의최고장점. 두번째로 듣는사람마저 경쾌하게해주는 타격감. 장점은 여기까지 단점은 꽤있는데 첫번째로 가끔가다 겜이 불가능할정도로 렉이 걸림 10초정도 뒤에 풀리긴하는데 그때와서 풀리면 뭐하나 난 빈사상태일텐데... 두번째로 에너지 회복이 너무 느림 하나 충전당 11분인가 그정도 하는데 한판에 5개를 잡아먹으니 한판할려면 대략 55분정도 기다려야하는게 너무 아쉬움 광고로 수급하기엔 ...
전체 리뷰 16챕터 유저인데 밸런스가 너무 안맞는것같아요 그리고 장비 조합할때 동일한거끼리 조합 말고 그 부위면 다 조합하게해주세요 게임은 재미가있으나 컨트롤하다가 움직임이 끊기고 다시부활이 씹히는등 버그가존재하며(다시부활은 현질로 얻는데 이것이 씹히면...) 약간의 운이 필요합니다. 쓸때없는것만뜨면 게임난이도가 급격히 상승합니다. 애너지는20개가 한도고(1판당 5애너지소모) 4판하면 몇십분을 기달려야 합니다.",4.3,액션
