title,reviews,scores,genres
루나 Re : 차원의 감시자,"게임이 정말 불편합니다 편의성이란 눈을 씻고도 찾아 볼수가 없네요, 그리고 광고제거를 구입해도 접속 유도를 위해 매 시간 마다 꼬박 꼬박 들어가서 챙겨야 하며 광고가 안나올 뿐이지 10-20초 뒤에 보상이 들어오고 보상 들어오기 전에 뭘 하면 보상이 안들어옵니다,심지어 횟수는 차감 되는데(1일 10번 획득 가능)보상은 안들어오는건 일상입니다. 이건 단 하나의 예 일 뿐이고 문제는 정말 많고 콘텐츠는 던전, 그리고 형식적인 대전 하나 밖에 없습니다 던전도 그냥 파밍요소라 사실상 그냥 파밍 할려고 하는 게임이라고 생각하면 됩니다. 제일...
전체 리뷰 데이브스튜디오 제작사 게임은 처음 접해보는데 특유의 그림체나 느낌이 너뮤 좋아서 3일째 진행중입니다. 지금꺼지 해왔던 국내 타게임에 비해 난도가 있는편이지만 데이브만의 스타일이겠거니하며 적응하려 노력중입니다. 다만 게임 내의 편의성부분은 '데이브스타일' 이라고 보기가 힘듭니다. 예를들어 파티편집시 카드정보와 잠금설정이 표시되지않아 개개인이 직접 구분할 방법을 찾아서 장착해야하는점, 또 아이템드랍정보에서 획득상태의 아이템을 통해서만 도감을 접할 수 있는점, 영웅목록 > 상세정보창에서 화살표 기능이 최초 영웅목록에 노출된 화면의 순서와...
전체 리뷰 일단 재밌어요. 재밌는데 무과금으로도 가능하지만 무과금으로 하려면 시간이 오래 걸려요. 하지만 그래도 재밌어요. 시간 남을때 한번씩 스태이지 몇회 돌려놓으면 재료 같은거 금방 모으긴 해요. 이 게임은 노가다 하기실어하는 사람 한테는 추천하지는 안아요. 첨엔 전 좀 어렵 더라구요 근데 게임 이해도가 높아 질수록 재미가 급상승 낮과 밤의 공락의 차이 충분히 게임을 즐길수 있게 도와주는 과하지도 약하지도 않은 광고 시스템도 좋구요 폰에 자꾸 손이 가게 하는 겜이네요 용병 시스템과 무기 획득등도 괜찮지만 영웅이나 영웅 진화 비용이 너무 비싼게 아쉬워요 좀 낮춰 주심 좋을거 같아요 그래도 재미 있네요 ㅎㅎ 1시간 정도 해본 느낌으로는 좀만 더 신경쓰면 좋은게임이 될거 같은데 아쉽다는 생각이 듭니다. 일단 첫번째로는 영웅 경험치 수급이 재화(현질)밖에 없다. 던전에 경험치물약 수급처를 만들어줬으면 합니다. 개발자님들의 방침이 성장을 억제시켜서 컨텐츠 소모 속도를 조절하려는 생각이라면 오히려 상점에서만 경험치 물약을 판매하는 것은 무,소과금과 핵과금러 사이에 좁힐 수 없는 간격을 만드는 최악의 시스템이라고 생각합니다 둘째,캐릭터는 너무 아기자기하고 잘만들었는데 설명이 너무 부족합니다. 얘가 탱커인지 힐러인지 작은 아이콘 하나만으로 그걸 ...
전체 리뷰 전략짜서 하는 거 별로 안 좋아하는데 자동전투되고 그때그때 원하는 방식으로 전략택할 수 있어서 게임 자체는 별로 어렵지 않아서 좋아요 다만 캐릭 레벨 올리는 거나 강화 각성 등이.. 좀 어려운 거 같습니다 쉽지는 않은 게임인거 같아요..물약이나 아이템 같은거 얻으려면 현질도 어느정도 필요한거 같고 좋은점은 게임 오토 돌려놓는 기능이랑 싸우는 속도 배속이 있는건 좋은거 같아요. 그리고 퀘스트 깨는거 좋아하는 사람들은 재미있게 잘할거 같아요. 아기자기 하고 재화 충분히 확보 할 수 있다면 더 신나게 즐길 수 있을 듯 합니다. 우선 보스레벨 깨려면 쉽지 않아여ㅋㅋㅋ그래서 더 집착하게 되는듯 ㅋㅋ 재미있습니다! 정말 아기자기하고 이쁜 캐릭터. 진행이 한편의 동화와 소설을 읽는것만 같다. 현재로도 완성도 높은 재미를 제공하는데, 이제 갓 출시한 게임인 만큼 업데이트 되면서 추가될 컨텐츠와 캐릭터도 매우 기되됨! 그림체와 캐릭터가 너무 아기자기해서 좋아요ㅎ완전 취저! 근데 갈수록 스테이지 깨는게 은근 어렵네요 뭐 깨는재미에 하는거라 그것도 나름 재밌는데 영웅 렙업이랑 장비 강화가 좀 빡시네요ㅎㅎ그래도 재밌어서 계속하게되네요 게임은 괜찮은데 UI가 너무 불편함.. 파티 설정할 때 정보를 볼 수 없어서 엄청 헷갈리고 카드나 템을 주는 스테이지가 따로 있는데 표기를 안 해놔서 그 많은 스테이지를 일일이 다 눌러봐야 함ㅡㅡ 일단 재밌어요. 캐릭터가 아기자기해서 귀여워요!! ☺️ 초반에 사냥이 약간 더딘감이 있지만 재화나 열쇠 수급도 좋아서 무과금으로 충분히 즐길 수 있어요. 조금 아쉬운 건 영웅 각성이 시간이 좀 걸린다는 거? 이것만 빼면 좋아요! 아기자기한 영웅들이 이뻐요. 이뻐서 더 신나게 재미를 붙기면서 할 수 있어요. 그치만 챕터를 깨는 건 조금 많이 어렵데요. 보유 영웅이 너무 약해요. 캐릭터 및 화면 구성은 좋은데 캐릭터 육성 및 아이템 업그레이드는 난이도가 어려운 편이어서 흥미가 줄어들수도 있어요~ 무과금으로 하기에는 시간투자가 필요합니다. ㅎㅎ 그래픽이 마음에 드네요. 보상도 후하게 주는편이라서 스토리 진행도 어렵지않고 뽑기 수급도 어렵지않아서 조반부터 흥미롭게 진행가능해서 만족합니다 캐릭터들도 귀엽고 초반 지원도 괜찮은것같습니다 다만 초반부터 난이도가 높아서 진전이 더딥니다 그리고 영웅들 장비같은걸 배치할때 쪼끄만 캐릭터들로 나와서 헷갈릴때가 있어요 재미있네요! 조작도 어렵지 않고, 다만 아이템 드랍률을 조금 올렸으면 합니다. 너무 안 나오는 느낌이에요. 그래픽과 배경음악은 좋은데 타격감이 아쉽고 개인적으로 전작보다 재미 없는거 같습니다. 시스템도 쉬운편은 아니고 게임 난이도 자체도 상당히 높습니다 그래픽도 좋고 쉽고 아기자기 귀엽고 챕터깨는 재미가 있어요ㅋ 게임설명 보면 쉽지만 어렵다~ 훅 와닿아요. 챕터가 가면 갈수록 깨기 어려워져서 깨고나면 기분업~동시에 중독성업 이네용ㅎㅎ 거인과나도 즐겁게 플레이 했는데, 여기 게임은 그림맛집인것 같아요 ㅎㅎ 귀엽고 수집욕구를 자극하는 캐릭터들이라 뽑기한번이라도 더 하려고 열심히 접속하게 되네요 ㅋㅋㅋ 캐릭한개로 타격하는맛은 없지만 파티로 몰아치는 이팩트도 화려해서 재미있게 플레이중입니다.:) 캐릭터들도 예쁘면서 디테일하고 내용과 하는방법도 재밌어서 좋아요 여러모로 재밌긴 한데 레벨업이 잘 안돼가지고 잘 되게 해주시면 더 좋고 나아질것 같아요^ㅇ^ 나름 할만해요. 그런데 월드맵으로 이동시 로딩이좀있음. 그리고 파티한애들끼리만 따로 선택할수있으면 좋겠음. 장비나 용병 재착용시? 보유하는 모든캐릭선택임. 파티하고있는 캐릭외우지 않는한... 일일이 대조하면서 착용해야함.... 에러임. 캐릭터 아기자기하고 귀엽네요 자동과 배속 모드가 빨리 실행되네요 1챕터가 길어서 아직 할 수 있는 게 많지는 않지만 스킬 화려하고 재미있어요 캐릭터가 너무 귀여워요 자동스킬도 되고 3배속 빠르게 전투도 가능해서 지루하지 않게 하고있어요 낮과밤이 시간마다 바뀌는것도 신기하네요 ~ 다른 게임은 퀘스트 진행만 해도 다음 스테이지로 넘어가는데 이 게임은 어느 정도 시간을 투자해야 넘어갈 수 있어서 성격 급한 사람은 하기 힘들지도.. 캐릭터도 귀염뽀짝하고 재밌어요ㅋ 스테이지 깨는게 조금 더디긴 하지만 제가 이런류의 게임을 많이 접해보지 못해 강화를 잘 못시켜서그런거같기도 하지만 나름 재밌게하고있습니다 :) 아이템 수급할때 광고를 한번보면 다 얻어졌으면 좋겠고 원거리 캐릭터 근거리 캐릭터를 적절히 섞어놓고 스테이지가 깨졌으면 좋겠다... -0-; 캐릭터가 귀여워서 보는재미가있네요, 초반 진행은 쉬울것같은데 재화수급이 살짝아쉬운것같아요 일단 계속해보렵니다 방치형보단 뭔가 더 하고싶은데 진득히 앉나서 할 시간은 없다면 딱 맞는 게임. 아기자기한 맛과 생각보다 깊은 전략성, 특유의 파밍하는 재미가 어우러져 깊게 빠져들 수 있다. 잼밋따. 게임이 아기자기 하며 ui도 편해서 초반에 게임이 수월하네요. 게임이 진행되면서 가끔씩 스테이지를 클리어하기 힘들어지면 장비와 카드를 강화시키면서 플레이 하니 클리어 가능해지면서 재미도 쏠쏠하네요. 동화 같은 그림체가 눈길을 확 끕니다. 하지만 게임 자체는 흔한 자동 전투 게임이라 흥미롭게 플레이 하기는 힘든 게 있습니다 영웅 업글이 어렵고 무기 획득도 쉽지 않은데 진행에 무리는 없어요. 장비강화나 영웅 업등 튜토리얼이 좀더 보강됬으면 해요 서버에 저장된 데이터가 현재 폰에 저장된 데이터보다 이전데이터라면 최신데이터로 게임할수있는 방법이없음.. 이말은 결국 롤백된다는거임 진심빡침 수집의 재미와 1성이나 2성을 5성까지 키우는 재미가 좋습니다. 다만 상태이상(출혈, 저주 등)이나 설명이 부실해 진입장벽이 높습니다 첨엔 좀 어려웠는데 소탕권쓰고 자동사냥 하루정도 쓰니까 쉬워지면서 재밌네요. 편의성이 좀 불편하긴함 캐릭터들이 아기자기하고 귀여워서 모으는 재미가 있고 자동 전투가 가능해서 편리하고 재미있게 게임을 할 수 있어서 좋아요! 캐릭터가 귀엽고 재미는 있지만 스테이지을 넘어가면서 난이도가 어렵지만 개인적으로 한번 해볼만 합니다. 재미있어요 공부중이 때문에 자주 못하지만 개인적 추천하고싶음 그레픽도좋고 난이도도 적당하고 3배속으로 할 수 있어 좋아요 1시간 정도 해본 사람 글 보고 공감못해서 적음 경험치 수급처가 현질밖에 없다고 하셨는데 기본적으로 주는 재화가 엄청많다고 생각함 거기다 골드로도 살수있는데 현질밖에 없다고 하시고.. 아는만큼 보인다는데 딱 아시는 만큼 보셧나보네요 ㅋㅋ 캐릭터가 아기자기한 모습이 귀여워서 보는 재미가 있네요 오늘 처음 시작했는데 게임 설명이 좀 부족해서 아쉽지만 이것저것 찾아가는 중이라 시간 가는줄 모르고 빠져드네요 재미있습니다~ 다 좋은데 영웅 이름을 아직 덜 외운 뉴비가 덱을 짤려고 하면 일일이 캐릭터들을 다 눌러서 자리이동을 시켜봐야하는데 너무 불편해요 항상 영웅들 이름을 표시해주면 좋겠어요 처음에는 쉽게 편리하게 할 수 있어서좋았요. 하지만 그후부터 레벨업을 많이 하지 않으면 할 수가 없어요 숴움나이도데도 캐릭터가 아기자기하고 그래픽도 좋네요 재미있게하고는 있어요 아이템이나 영웅 설명이부족하고 잘보이질않아요 캐릭터가 아기자기하고 귀엽습니다. 자동이라 편하기 한데 난이도가 높네요. 그래도 하다보니 괜찮은것 같아요. 게임이 중독성이 있네요. 렙이 오를수록 할만해요. 캐릭터도 아기자기하고 그래픽 보는 맛으로 계속하고 있어요. 시작한지 얼마안되서 더 해봐야알것같지만 조작법도 간편하고 자동플레이 할수있어서 시간떼우기 좋은 게임인것같아요 퀘스트 클리어 하는 재미도 있고 다양한 전략도 필요합니다. 캐릭터는 정말 귀여워요 그댄 게임이조금 난이도가 있네요..응..진짜 난이도 높아요..그리고 게임 할 수가 없네요 들어 갈 수가 없어요 캐릭터들은 귀엽지만 레벨업이 시간이 좀 걸리고 게임이 좀 어려워요 영웅 성장이 너무 어렵네요 캐릭은 아기자기 좋은데 좀 정신이 없네요 캐릭특성이나 성장 방법에 대한 설명이 있었으면 좋겠습니다 그래도 스테이지 하나하나 지나가는속도는 참 좋네요 캐릭터도 아기자기하고 뽑기 시스템도 잘 되어 있습니다 그리고 던전을 가다가 갈림길 나오는 것도 신박하네용>_< 오늘 처음해보는건데 꾸준히 재밌게 할 거 같아요~♡ 게임 그래픽이 다른 게임이랑 달라서 신기하고 좋고. 게임 시스템 방식이 마음에 듭니다. 그래픽이 넘 마음에 드네요~동화 한편을 보는 듯한 느낌?그리고 타격 사운드도 괜찮고 꽤 잘 만든 게임 같음^^ 처음에 무슨게임인지 모르고시작했는데 보는맛도 있고 도트캐릭들이 굉장히 매력적이라서 재밌네요 처음 게임 설명 따라하는거 지루하지가 않아요! 브금이나 효과음도 매우 좋고 영웅 일러는 귀여운것도 있고 고퀄인 것도 있어요 뽑기도 괜찮고 보상도 좋아요 전반적인 디자인도 좋고 뽑을 수 있는게 다양해서 좋은데 아이템 수급이 좀 힘들어요 게임 자체는 아기자기하고 중독성 있어요! 근데 전 게임에 비해 난이도가 좀 높은 게 아쉬운 면은 있지만 오히려 너무 빨리 끝나서 할 게 없는 게임보단 괜찮네요! 캐릭터가 아주 귀엽고, 약간의 난이도가 있어서 더 좋은듯하네요. 현질유도도 거의 없어서 좋아요. 흠.. 리뷰쓰기 민망할 정도임.. 너무 완성도가 떨어지는 게임이랄까.. 화려하지 않으면 스토리라도 재밌던가 조작이 재밌던가.. 그림체라도 이쁘던가 흠... 그림도 내용도 단순한 것 같지만 계속해서 플레이하니까 중독성이 있는 것 같습니다 시뮬레이션 게임은 많이 안해봐서 잘 모르는데 캐릭터들이 아기자기하고 귀여워서 플레이에 자꾸만 손이 갈 것 같네요ㅎㅎ즐겁게 열심히 플레이해보겠습니다 캐릭터도 좋고 재미있습니다. 하지만 스테이지가 넘어가면서 난이도가 더어려워지네요. 하지만 개인적으로 한번 추천합니다! 캐릭터가 이렇게 귀여운 게임은 처음이예요. 그래픽도 아기자기 깔끔하고 점점 난이도가 올라가는게 재미나네요. 시간가는지 모르고 밤이 깊었네요. 다운이 빨라 좋구요 처음부터 배속사용이 가능해 루즈한 느낌이 없어 좋아요 캐릭터 넘 귀엽도 조작법도 간단하고 진영도 알아서 해주니ㅋㅋ 편하네요 전략적인 겜은 원래 싫어 했는데 해보니깐 재미있고 재미들려서 계속 하는중..갓겜 진형 저장해놔도 게임 껏다키면 초기화되네요.. 수정됬으면 좋겠습니다 전투방식이 마음에 들며 3배속도 설정이 있다는 점이 장점이라고 생각이드네요~ 초반 난이도도 높고 뽑기확률 역시 극악이고 골드 수급처도 현질아니면 모으기 어렵습니다.. 그리고 강화 재료 수급 역시 어렵습니다 5성승급하는재미도 쏠쏠하네요 단 레벨3성 으로 깨기힘든곳도 있지만 캐릭터랑 용병들키우는게 재밌네요 캐릭도 귀엽구 스테이지가 좀 어렵긴 하지만 재밌어욤>_<!!! 추천합니당~~~ 재밌어여 근데 캐릭터 레벨업이나 장비.카드 등 얻는 방식을 좀 쉽게 해주셨으면 좋겠어요 캐릭터도 귀엽고 초반엔 쉽지만 계속 할수록 어려워져요 그치만 재밌습니다!! 3배속도있고 자동도빠리빠리하고 쉽고 간편해서좋네요 재미있습니다. 포인트 적립 때문에 받은 게임. 노가다가 없다가도 뽑기때문에 있는 듯헌 느낌.. 운 없으면 하루종일 돌리고 있어야됨. 그럭저럭.. 튜토리얼 자체가 기본적인 rpg게임에 대한 지식이 없으면 이해하기 힘듬. 전투나 포지션에 대한 기본적인 설명 좀 해줬으면 좋겠음. 캐릭터가 귀여워서 진행하는데 재밌긴한데 전체적인 밸런스 조정이 어렵네요 캐릭터들이 귀엽고 재밌네요ㅎ 근데 하다보니까 맵이 너무 복잡하고 렙올리는것도 몬스터들 난이도도 너무 높아요..; 아기자기한 케릭들로 빠르게 속도 조절하면서 자동으로 사냥하니깐 손도 많이 안가고 재미있내요 케릭모우는 재미도 솔솔하구요 매우 매우 어려우면 확률도 낮다 뽑기 중복이 심한거 같다. 다른 여타 게임과 성질이 비슷하다 재미있는 것 같아요! 특히 캐릭터 일러스트들이 예뻐서 캐릭터 뽑고 모으는 재미도 있어요 :3 드디어 기다리던 게임이 출시 되었네요 조작감도 편리하고 동화같은 이미지가 너무 마음에 들어요^^ 몽환적인 분위기에 귀여운 캐릭터 좋네요. 그런데 스테이지 진행이 좀 힘드네요. 내가 못하나봅니다. 너~무 어려워요! 챕터 1을 못깨서 보상이고 뭐고 암것도 못받게 해놨네! 이렇게 어려운 게임 난생 첨이네요~ 튜토리얼도상세하고 전투도 배속되서빠르게진행가능해서 좋네요 아기자기해서 보기도 편하고 나름 재미는 있는데.. 넘 복잡함이 있어서 좀 헷갈리지만 재밌네요 1시간 넘게 하고 있는데 보스들은 강하고 영웅들은 너무 약해요.... 현질 유도가 심한.... ㅠㅠ 일단 해보시길... 아직 오픈한지 하루도 안지나서 없는게 좀 있지만서도 재미는 있네요. 잠깐이라도 게임 해보시고 결정해보시길 ㅋ 캐릭터가 귀엽고 아기자기해요. Ui가 조금만 더 컸으면 좋겠는데 너무 작아서 그게 아쉬운... 캐릭터가 귀엽고 재미는 있는데 길이 여러군데라 스테이지 깨는데 좀 어렵더군요 겜속도가 3배가 되는거랑 자동스킬이 로봇같지 않고 되게 자연스럽게 진행됨 나쁘지 않음 한번해보셈 퀘스트도 빨리빨리 진행되고 힐링타임으로 즐길 수 있을 거 같아요 아직까지는 할만해요.! 스테이지끝나면 광고시청시 3개 전부 여는 것도 나쁘지않을것같아요! 아기자기하고 귀여워서 좋네요. 자동사냥도 있어서 어렵거나 힘들지 않아요:) 새로운 게임. 영웅 소환 기회는 많은데 4성이상 잘 안나옮. 키우는 재미가 솔솔 다른게임은 지루하고 몇분해도 뭐가 무엇인지 모르겠고 하다가 말던데 이건 재미 있네요 시간가는지 모르고 계속 하게 되네요 못된건만 배워서리 과금유도 겁나심함.초반 몇분하면 바로 막힘.인게임 들어가면 욕하고 나가는 사람밖에없다 ㅋㅋ 먼지 모르게 넘 복잡함 게임만 보면 단순한데 하면 모바일 게임치 번거롭고 복잡함 제가 하는 방법을 잘 모르는 지 캐릭터 레벨업이나 장비 같은걸 틈틈이 맞춰야 하고 챕터 깨기 힘드네요",3.9,시뮬레이션
