title,reviews,scores,genres
Subway Surfers,"간단하고 심플한 조작으로 누구나 쉽게 접할수 있으며, 스코어나 랭킹이 나보다 높은 유저를 따라잡는 맛도 있으며, 다양한 BGM를 내 취향대로 골라 듣는것도 장점 요인이다. 스코어가 올라갈수록 속도상승이라는 변수로 몰입감이 장난아니며, 손도 바빠진다. 정말 잘만든 갓겜 시간 때우기에 굉장히 좋은것 같습니다만, 아이템 가격이 너무 비싼경우가 있습니다. 그리고 캐릭터마다 조금씩 다른잠을 추가해주면 좋겠는데 외형만 다르고 아무 능력이나 점프 효과등 없는것이 몇 있는게 좀 아깝습니다. 가격좀 수정해주세요 이 게임에 문제가뭐나면 데이터 불러오기를 했을때 불러오기가 실패하면 기존에 있던 계정 진행상황이 리셋되고 새계정 정보로 덮여버림. 그래서 이천만점 찍었던 계정정보가 전부 새로만들어진 데이터에 계정이 연동되면서 덮어쓰여져버림. 계정 불러오기가 실패하면 연동되는걸 막아야하는데 안막고 그대로 덮어버려서, 앱을 지웠다 깔고 다시 연결해봐도 계정이 초기화되서 이전 계정정보고 불러와지지 않음. 저번에서 계정 리셋되서 다시하고 겨우 회복했는데 또이러니 정떨어짐... 이제 이거 접을거고 게임 이거 안고치면 가까운 시일내에 망한다. 외국에도 이 버...
전체 리뷰 Big kahuna라는 보드를 구매하고 기능 잠금을 해제하여 보드가 날아다니는 능력, 보드를 탑승했을 때 항상 낮은 자세를 유지하는 능력을 사용했습니다 그런데 하늘을 나는 능력 하나만 있을 당시에는 날개를 점프를 했을 때 보드가 날개를 활짝 펴고 활공했지만 항상 낮은 자세를 유지하는 기능을 업그레이드하자 날개가 조금만 펴졌습니다 항상 낮은 자세로 달리는 기능을 꺼도 손잡이만 사라질 뿐 날개는 잘 펴지지도 않은 아까의 상태와 같았습니다 이거 좀 어떻게 해주십쇼 초1때 시작해서 지금 중3까지 해오고 있는 게임. 내 청소년기엔 항상 얘가 있었음. 그 과정에 라이더, 피아노 타일, 배그 다 있었지만 얘만 결국 살아남았네. 고맙다 항상 진짜진짜 오랜만에 하네요 오랜만에 하니까 너무 재밌고 퀘스트 깨기고 쉬워요! 다음 업데이트도 하면 너무 재미있고 즐거울수 있습니다! 진짜 꿀잼입니다!!친구들이랑 간단하게 할 수 있고..배경음악이나 디자인이 너무 예뻐용!!렉도 잘 안걸리고 광고도 많이 안나와서 너무 좋아요..ㅠㅠ🥺한국도 나온적이 있어요!!그리고 캐릭터들도 진짜 예쁘고 코인을 많이 안모와도 많이 살 수 있는점이 좋습니다..ㅠㅠ그리고 죽고나면 너무 아쉽고 열쇠도 쓰기 싫을때 20초짜리 영상만 보면 바로 부활될 수 있어서 최고기록도 높일 수 있어요..그리고 또 죽으면 뜨고!!한 3번운 뜨고 다음부터는 열쇠 사용하라고 해요!! ❤아이템도 잘 나오고 점점 빨라지는거,장애물 피하기가 점점 어려워 지는거 등...
전체 리뷰 이게임 아주 즐겜하던 유져 입니다 그런데 이벤트 코인을 20000개 모았는데 다 사라져버리고 여러가지로 버그가 있네요 힘들게 모은 아이템 등이 갑자기 한번에 날라갈수 있습니다 조심하세요 예전에 진짜 많이 했던 게임 추억에 빠져서 찾아서 다시 해봤는데 여전 하네요 ㅎㅎ 한번 해보시는걸 추천 합니다!! 재밌습니다 재밌긴한데 일일미션하고 재접하면 한게 날라갑니다 이거 오류있는거 같은데 고쳐주세요 이거 왜 코드 입력 버튼이 없나요? 코드를 입력하려고 설정에 들어가보니 코드 입력 버튼이 없어요. 없어진건가요? 아니면 저만 없는 건가요? 코드 입력해서 코인 좀 받으려고 했는데..... 코드 입력하는 곳이 없어요... 이 리뷰읽고 빨리 해결 좀 부탁드립니다. 제발요 ㅠㅠㅠㅠㅠ 가능한 빨리 부탁드립니다. 그냥..너무좋아요. 추억도 추억인데 10년이 넘도록 이 게임을 유지해온게 너무 대단한것 같아요. 붐박스도 다양하고 원래 오리지널 음악에 한 편곡도 정말 좋구요. 거의 기차겜 원조인 서브웨이서퍼, 너무 좋습니다ㅠㅠ 제가 옛날에 했던 게임중에 제일 재밌고, 제 추억을 책임져준 게임이라서 다시 시작했는데요. 와.....진짜 초심 안잃고 운영 엄청 잘하고 있더라구요. 그 특유의 브금이 너무 좋았어요. 조작법도 예전 그대로 간단해서 하기 쉬웠었구요. 캐릭터들도 많아지고.....하......눈물이 나네요......흑......쨋든, 이대로 쭉쭉 운영해주십셔. 사랑합니당. 이게임은 장점과 단점이있습니다 좋은건 자기도 모르게 자기자신이 도망치는것 같아서..ㅋ 더 잘하게 돼고요 ㅋ 집중력,자기자신에 스피더,등등 좋네요 안좋은점은 캐릭터가 있는데요.. 자꾸 캐릭터만 가지고싶어서 하는건지.. 코인,보석등등 모으려고 하는지 저도모르게 ㅋ 캐린터가 모으는데 좋은데 캐릭터를 모으려고 하는짘ㅋ 그래섴ㅋ 별점3개 드리도록 하겠습니다다!!♥♥ 이게 너무 재밌어요 광고도 많이 안 나오고 캐릭은 너무 귀여워요 만들어 주신 분들께 감사드립니다 와.....이 게임은 잊을 수 없는 명작입니다!!!! 어릴때 즐겨하던 추억이 있는데요 요즘 코로나 때문에 집에만 처 박여 있어서 심심했는데 갑자기 이 게임이 머릿속에 떠올라서 깔았더니 변함이 없어 너무 좋았고요 캐릭터도 멋있고 제일 만족스러운 것은 어릴때 이 게임을 제일 즐겨했는데 아직도 잘 운영하고 있다는게 너무 좋습니다^^ 제작자님 앞으로도 좋은 게임 만들어 주세요^^ 그리고 코로나 조심하세요~~~~^^ 와~ 이거지! 내가 어릴때 진짜 맨날 하려고 엄마 폰 뺏어서 최고 기록 새우고 싶어했던 게임!ㅋㅋ 이게 아직도 있다니 놀라울 따름입니다 진짜 너무 재밌고 광고도 사실상 정말 안나와요ㅎㅎ 와이파이 없어도 쌉가능한 게임이고 추억 되살리면서 꿀잼 게임 하고 있습니다 ❤❤ 예전에 비해 약간의 변화를 준 느낌은 있는데 예전에 비해 완성도가 많이 떨어지는 느낌이 드네요. 버그가 심하게 많네요. 게임이 끝난 후 코인 두배로 하기 위해서 비디오를 볼려면 눌러지지 안네요. 덤블 5번 부딪히라고 했는데 덤블 그냥 통과하네요.그리고 아이템이 예전에는 반짝 빛이 나서 어디 있는지 알았는데 빛이 안나서 아이템을 그냥 지나가기 일쑤네요. 그래서 짜증이 나네요. 광고도 안 나오고 게임도 어렵긴 하지만 재밌어요 추천해 드릴게요 재밌어요!!동생이장말좋아해요!! 앞으로도 좋은 거 갖고 오세요! 4살때엄청많이 한 게임입니다ㅎㅎ 10년이 다되가네요 생각이나서 이게임을 다시 깔아봤습니다. 바뀐게 정말 많네요 7살때 부터 지금까지 쭉 해 왔는데 너무 재미있어요 한 번 해보시길 추천 드립니다 진짜 오랫동안 하고 있는 게임인데요 재미있게 이용하는 중입니다 근데 솔직히 인간적으로 생각했을 때 광고가 많은 건 맞잖아요 .. 짧게짧게 한 판 끝날 때마다 광고가 나오니까 지겹네요 ;; 그리 고 추가할 내용이 있는데 .. 위로 뛰어야할 걸 옆으로 가는걸로 잘못 인식하는 경우가 많더라고요 그 점 고쳐주시길 바라겠습니다 🙏 음.... 다좋은대 와이파이 없이도 쉽게 할수있고(물론 광고는 못 보지만)케릭터가 좀 아쉽네여ㅠㅠ 좀더 예쁘게 만들어 주시지ㅜㅜㅠㅠ 나름돼로 이 그림채에 어울리긴 하지만... 좋은대 아쉬운개 3가지나있내요 1번째 너무 재미없다. 2번째 채릭터 불만족 3번째 와이파이 안되는곳에선 광고 못봄 제 개인적인 생각 이지만 뻔히 계속 똑갔은 러쉬만 나와요ㅠㅜㅜㅠ 제 개인적인 생각이 많들어가서 별 4개는 줍니다. 여러분한탠 어떨런지요? 추천합니다 이게임은 재미있는데 업데이트를 주기적으로 하지 않는다면 플레이를 할수없다는 단점을 갖고있네요. 업데이트하라는거를 무시하고 플레이를 하려했더니 업데이트 버튼만 화면에 있는채로 멈춥니다. 프로그램 자체는 재미있는데 업데이트를 하지 않으면 플레이를 할수없다는점이 매우 안타깝습니다. 제가 여러 가지 게임을 접해 본 결과 이게 제일 재미있습니다. 일단 더럽고 치사한 광고가 의도치 않게 절대로 나오지 않고 승패에 집착해서 분노를 자아해 낼 일이 없는 아주 깔끔한 게임 입니다. 난이도도 이 정도가 제일 적당합니다. 너무 어려워서 좌절한 적이 없을 정도이기에 꾸준히 해 올 수 있었습니다. 심심할 때 시간 때우기도 좋습니다. 적극적으로 추천합니다!! 몇년간 플레이해온 유저입니다. 게임 자체가 다른 달리는 게임에 비해 훨씬 박진감 넘치고, 광고도 제가 보지 않는 한 나오지 않아 좋네요. 그래도 조금 아쉬운 점은 슈퍼 운동화? 를 신고 차 위에서 점프를 하면 건물에 부딫혀 죽더라고요. 그 점이 살짝 아쉽습니다 현질 유도 없고 광고도 사실상 안나온다고 볼 수 있다. 난이도 너무 어렵지도, 쉽지도 않다. 상점이 너무 비싸다고 하는데 이게 적당한거다. 옛날부터 꾸준히 해올 만큼 질리지 않고, 캐릭터나 아이템 모으는 재미도 있다. 컨셉도 잘 잡았다고 생각 된다. 시간 때우기엔 최고인 게임.. 오랫동안 유일하게 하던 게임이라 별점 5개로 하려 했는데 어제부터 갑자기 잘되던 게임이 시작하는데 뜨는 로딩 화면에서 게임 화면으로 넘어가질 않습니다 계속 로딩이라고만 뜨는데 새로 설치하면 그동안 산것, 모은 것, 기록, 캐릭터 다 초기화 되는데 어떻게 좀 고쳐주세요 페이스북을 안해 페이스북 로그인이 안되있어서 복구 할 수도 없습니다 이전부터 하던 게임인데 간만에 플레이하니 재미있네요. 광고시청시 아이템 2배로 주는게 2배로 안들어와요!!!!ㅠㅡㅠㅜ 근데!!!! 게임 끝나고 박스 열어서 아이템 받을 때 광고를 보면 2배로 준다고 하잖아요? 열심히 광고보면서 2배로 아이템 받았다고 생각하고 있었는데 가만보니 2배로 아이템 획득 되던게 아니더라구요.... 분명 보상받을 때는 2배로 받았다고 뜨는데요. 오류인가요?? 얼른 고챠주세요 ㅠㅜ 얼른 라디오랑 기타 같은거 모아서 우리애들 옷 바꿔주꾸야 재밌고 광고도 많이안나오는데 광고나오면 ×누르면 광고가 사라져용! 이벤트 보상 캐릭터도 마음에들고 좋아용! 이벤트 보상:멋진캐릭터도 있고 신기한 캐릭터도있어요! 따운로드 해보세요 넘나 넘나 재밌는겄! 전 유치원갔을때 부터 함. 전아직도해용! 너무 너무 재밌어서 별 5개줌! 따운해보셈! 재밌음! 넘나 재밌는겄! 앙 기모띠~~! 완전 꿀잼! 대박 최고기록 갈때하고 캐릭터 코인으로 사면 진짜 기분좋음 또, 광고도 안 나오고 원할때.(보상2배로받을때.) 그럴때만 나옴. 완전 추천게임!그리고, 시리즈마다 배경 바뀌는게 와전 꿀잼! 예, 할로윈,크리스마스. 옛날엔 빌려했는데 이제는 마음거한다.! 완전 추천합니다. 제 인생작인듯 캐릭터랑 스킨도 다양하고 맵도 시즌별로 바뀌어서 질리지도 않습니다. 광고로 벌 수 있는 아이템이나 부활이 꽤 많고 계속 미션도 주니까 오래 재밌게 할 수 있어요! 👍👍 제아들이 어린시절에 많이했는데 저도 따라서 하던 게임이네요~ 오랜만에 게임을 설치해서 해봤더니 ~~ 너무~ 재미있어습니다~* ^^추억에 잠겨서 1시간동안 했네요~~😀 너무 즐거운 시간 이였습니다 ~~😍 옛날에 2012년 쯤인가? 구글플레이게임 연동이 대중적으로 활성화 되지 않았던 시절... 서브웨이 서퍼에서 무슨 이벤트를 했었음. 어떤 뽑기를 하면 아주 극악의 확률로 당첨되는 게임머니(포인트)를 엄청 많이 주는 일종의 로또같은 이벤트였음. 근데 그 이벤트 중에서도 어떤 기간 동안은 보상이 5배였나? 그랬었음... 아무튼 그때 내가 1등 보상 당첨된 것도 대박이였는데, 마침 그때가 5배 보상 이벤트 중이라, 당첨금을 5배로 받아서 더욱 대박이였던 기억이 있음 ㅎㅎ 그 이후로 질려서 삭제 하게 되고, 물론 구글 연동이 활성화 되기 전...
전체 리뷰 첨엔 조금하겟는데 너무빨라져서 손을댈수가없네요ᆢ적당히 빨라야하는재미도잇고 어느정도 욕심도내보겟는데ᆢ에효 저는 이 게임을 강력추천 하는 유저인데요, 정말 재밌어요❤ 제가 서브웨이서퍼를 하면서 아이템도 많이 업그레이드하고 그랬는데, 제가 핸드폰을 봐꿨는데 다른 앱들은 계정이 남아있는데 서브웨이서퍼만 계정이 남아있지 않아요 복구할 수 없나요~? ( 최고기록은 1940000 , ×는 최고레벨 ×30 나머지 스폰 아이템 시간 늘리기도 많이 업그레이드 했습니다.) 이거 어릴때 진짜 많이했었는데 지금 해보니깐 오랜만이고 정말재밌네요ㅎㅎ!달리기 게임하시고 싶으신분들은 한번씩 이거 깔아보세요! 강추입니다 캐릭터 모아논거 보다보면 오른쪽에 하늘색 별이 있는것도 있고 없는것도 있는데 그게 뭔가요? 초등학교 때부터 성인이 된 지금까지 매일 하고 있는 정말 좋아하는 게임입니다!! 너무 재밌고 좋아요 하지만 보드 구매할 때 1개씩만 구매할 수 있는게 조금 불편합니다. 원하는 아이템 갯수를 입력 후 바로 구매할 수 있었으면 좋겠어요 그냥 넘기려고 했는데 더이상은 못참겠네요. 플레이 하다가 장애물에 걸려 광고보기를 하면 4분의3이 버그 때문에 검정화면으로 떠서 다시 나갔다 와야 되네요.이 리뷰 쓰기 전에도 그랬고요.그것 때문에 지금까지 모은 플마의 절반이 안들어왔습니다. 짜증나는 버그니 빨리 고쳐주셨으면 합니다. 90만점 까지 광고 보면서 계속 갔더니만 거기서 다시 광고 한번 봤을뿐인데 왜 초기화 되죠? 이게 원래 광고를 많이 보면 초기화가 되나요? 기록이 되있으면 괜찮은데 기록도 안되있고 이거 왜죠? 진짜옛날에 있던건데 아직도있었네요~~ㅋㅋ 오랜만에하니까 엄청재밌네용ㅋㅋ 재미지내요 시간때우기로좋아부러서이요이요 1000000점까지 갔는데 부활할려고 광고보니까 초기화 되어있네요ㅎㅎ 정말 부스터란 부스터를 다썼는데ㅎ 쓰레기 겜 이 게임이 믿을실 뿐은 믿으세요.이게임이 예전에 저희 형아가 30만인가 300만으로 한국 서버 1위 였거든요.근데 지금은 일주일에 한번씩 바껴서 이제 랭킹을 볼수 없겠지만 30만인가 300만 찍는데 3시간 걸렸다고 합니다.아무튼 이게임이 추억에 게임이라서 추천 합니다.이 게임이 랙 걸린다 광고 나온다 하는데 광고하고 랙은 와이파이 끄면 됍니다.저도 형아 처럼 한국서버 랭킹 1위하고 싶지만 제길력 안돼서 이렇게 글 올립니다. 어떻게 하면 잘 할수 있을까요? 노래 왜 바뀜? 옛날의 그 경쾌한 노래도 들을 수 있게 노래 선택 기능 만들어주셈 음 일단 재밌긴 한데 추가해주실 내용이 있습니다 그것은 뭐냐면 바로 처음시작할때 너무 느려서 건너뛰는 기능이나 아님 처음시작할때 기본속도를 조금만 올려주세요 처음하시는분들은 지루해 하실수도 있거든요 그거 하나 추가해주시면 감사하겠습니다.재밌게 플레이 하고 있습니다 응원드립니다😁 게임은 심심할때마다 재밌는데 현질한거랑 모은돈이 증발되서 별한개 덜 드릴게요, 게임은 재밌음 서브웨이 서퍼 진짜로 재밌고! 시간가는 줄 모르는 게임이에용! 앞으로도 계속 할거구 다른친구한테도 소개하고픈 게임인것 겉네용! 광고만 보면 좋은 것도 많이주고요 버전이 많아서 아주 좋고 재미있어욥 처음할때는 버그도 없고 재밌었는데 점점할수록 버그가 많이남.. 갑자기 앞에있는 코인 1~2개가 없어지기도 하고 심지어 자석이나 신발같은 아이템도 그냥 사라짐,, 딱히 플레이에 큰 지장이 있는건 아니지만 뭔가 불편하고 기분나쁨..ㅠ 이거 광고도 별로 없고 와이파이 없이 하는 게임은 대부분 재미 없는데 이게임은 진쩌 재밌어서 좋아요^^근데 예전엔 안그러다가 요즘 자꾸 랙(?)이 걸리더라구요..이게 왜그러는 모르겠어요..ㅠ.ㅠ고치는 방법 좀 알려주세요 방법이라도 모르면 왜 그러는지 알려 주시면 감사하겠습니다. 전세계 10억명이 하는 이유가 있었구나 그리고 게임 출시 10주년 ㅊㅋㅊㅋ 아니... 겜한지 얼마안되었을땐 재미있음 근데 솔직히 이거 1등하려면 3~4시간 폰붙잡고있어야하는데 2시간정도 지나면 귀찮아짐 플레이도중에 게이껐다가 켰을때 자동저장되는거라도 있으면 하겠는데 그게 없으니 하기싫어지네... 아 그리고 보상도 개 적어 15000?? 1등해도 저거밖에못받고 흥미가 없어짐 너무 재미있어용❗❤❤ 옛날부터 계속 해왔는데 꾸준히 재밌는 것 같습니당😘 광고도 그렇게 많이 나오지도 않고 현질 없이도 재미있게 즐길 수 있어서 너무 좋아용ㅠㅠ💗✨ 앞으로 계속 업데이트 해주시공 캐릭터 가격 쫌만 낮춰주세용~~😊💖 제가 유치원때 엄청 많이한게임 정말 재밌네요 진짜 개추억겜 오랜만에 해보고싶어서 깔았습니다 지금해도 재밌네요ㅋㅋㅋ 다 좋은데 언젠가부터 게임이 아예 안 들어가져요 로딩만 계속하고 ... 화면이 그대로에요 앱이 멈췄다는 알림도 없고 도대체 뭐때문에 그런건지 모르겠네요.. 좋긴 좋은데 렉이 심하구요 죽었을 때 광고 보면 살아나는 버튼을 누르면 어제까지만 해도 안그랬는데 오늘 계속 게임을 살아서 이어서 시작이 안되고 렉걸리면서 나가져요.. 진짜 좋은 앱인데 이건 불편해요. 그리고, 게임하다 중간에 갑자기 왜 중지되면서 나가져요?? 게임좀 봐주시면 감사하겠습니다..!! 페북연동하신분들 알려주세용ㅠㅠ 트로ㅍㅣ점수(하이스코어라고 써있는점수)랑 탑런(일주일에 한번바뀌는거)뭔차이죠? 트로피모양인건 최고기록 깨도 안올라가네여 설마 저 트로피 점수가 제 모든 점수중 최고기록인가요? 육년도 더된거라 남아있을리가 없는데.. 아주예전에 플레이한 무과금유저 518만 까지간사람입니다;;; 올만에 생각나서 다시깔고 계정 복구했는데 기록은 그대로인데 제가 쓴 보드 텔레포터 보드/ 바운서 보드 및 캐릭 몇개 다 복구안되고 초기화 되었네여;;; 캐릭이야 꾸준히하면되는데 보드는 진짜 노가다하며 산건데... 다시할맛이랑 엄두가안나네여;;; 재밌는데 오른쪽으로 슬라이스를 하면 완쪽으로 캐릭터가 가져요. 그리고 시작버튼도 ㅇㅏㄴ눌렀는데 맘대로 시작하네요 이것만 고쳐주시면 별 5개하고도 남겠네요 전 이 게임을 열심히 하다가 중간에 개인사정으로 잠시 못하게 되었는데요.... 예전에 영어로 있는 패치가 더욱 나은것 같습니다...... 판정도 너무 안좋아졌고 이 패치이후로 이 게임으로 절대 랙이 안걸리는 S105G를 사용해도 랙이 약간 불편하게 걸리네요.. 동작을 하면 캐릭터가 느려지거나... 화면이 자주 끓기네요.. 게임시작초반에는 할 수 있어도 게임 시작 중후부분에서는 동작이 많다보니 랙도 심해져서 반응이 제대로 되지 않고... 어쩌다가 동작이 씹히네요... 하루빨리 이 랙을 없애는 패치를 부탁 드립니다.... 저의 느낌이겠...
전체 리뷰 완전 추억의 게임이에요 어렸을때 많이했는데 오랜만에 하니까 너무 재밌네요 약간 업데이트 되긴 했지만 그래도 광고도 안나오고 진짜 재밌어요 고민하실필요 없고 바로 까세요 아까 깔아서 계속 플레이 하고있는데 지금까지 광고 1도 안나왔어요 10억명이 까는데도 다 이유가 있었네요👏 에전보다 최적화가 잘됫네요! 하지만 돈을 표시하는 부분을 k단위로 나타넨것은 조금 불편합니다. 그래도 그것빼고 다좋습니다.화이팅!! 안녕하세요. 저는 이 게임을 3년 넘게한 플레이어입니다. 이 게임 설명 장점: 재미있다. 캐릭터 잠금 해자하기 쉬움. 여러가지 이벤트가 있음. 캐릭터가 특이함. 단점: 음..... 그다지 단점은 없네여 그래서!! 좋습니다. 대박 강추합니다.ㅎㅎㅎ😀😃👍👍 안녕하세요.저는 이게임을 플래이한 유저입니다.장점부터 말해드리죠. 이게임은 데이터가 필요없기 때문에 할게임 없을때 하게 좋습니다.그리고이게임이 오래된 게임이고도 불과하고 유지하는거에 칭찬을 해드리고싶습니다.아마도 2017에나와서 제가친구랑했던기억이너오르네요. 단점을 말해드립니다.단점은 캐릭터얻기가어려웁니다. 하지만 여전히갓겜이네요.ㅎㅎ 점점 갈수록 빨라저서 재미가있고 광고을 봐도 살아날수있고 열쇠를 줘도 사라날수 있어서 재미있어요 그리고 캐릭터가 다양해서 여러가지 캐릭터을 모으는재미!! 그례서 별☆☆☆☆☆ 줌니다!!!! 광고 관련 최악. 진심 광고로는 전세계 최악!!! 전엔 화면 정지하는 광고 너무 많아서 광고를 몇번씩 더 보게 하더니... 이젠 30초 짜리 광고 보고도 또다시 5초 짜리 광고 또 뜸. 그거 봐야 끝나네. 에라이~ 광고 업체 뭐라 하지말고 그런 광고를 받는 회사가 100% 잘못임. 별 하나도 아까움. 진심 게임 잘 만들어놓고 광고로 돈벌려다 이미지 폭망!!! 진심 극혐 수준임. 유저로써 30초 짜리 광고 봐줬음 됐지 싶은데? 바로 5초짜리 광고는 뭔데??? 왜 붙는건데? 욕을 한사발 하고 싶으나 참음. 광고도 잘안나와서 좋아요. 그리고 캐릭터이 특이해요. 분명히 며칠전까지만해도 잘하고 있었는데 깁자기 앱에 들어갔다나오는걸 몇번 반복해도 화면이 멈춰있어요 ㅠㅠ이것좀 고쳐주시면 별10개 아니,무한개 드려요 게임은 재밌지만 점수를 올려도 정지가돼니 무슨게임을 하냐고요 매번이렇게돼면 하나마나지점수올려도 올라가다정지돼서 점수도모두없어지는데 안녕하세요 이 겜 3년차 랭커유저입니다 제가 오늘 겜을하다 광고를 봤는데 갑자기 겜이 튕기더군요 그때 제가 점수100만점을 달렸는데 그 점수가 날아갔어요그리고 열쇠도 4개쯤 썻는데 이케 됬네요 제가 음악을 틀고그래선진 모르겠는데 이유좀여 그리고 서버를 바꾸려하면 이상한 시계(?)모양만 뜨고 바뀌질 않네요 이유좀요 그리고 감사합니다 문의사항이요.. 아이폰 쓰다가 갤러시로 바꿨는데 아이폰일때는 돈이랑 열쇠가 남아돌아서 캐릭터니 보드니 많았거든요? 페이스북연동하고 갤럭시오니까 최고점수만 남아있고 남은 아이템이나 기록들은 다 사라졌네요.. 이거 복구 안되나요? 그냥 하긴 너무 아까운데요.. 저 어렸을때 겁나 많이 했던 게임이네요... 막 1~2시간동안 이게임만 핸드폰 용암 될때까지 계속 했었는데~앞으로도 이런 인기 많이 끌어주시고 저의 어릴적 추억의 게임으로 남아져주셔서 감사합니다! 2번 연속 슬라이딩이 어렵습니다. 미스터리 박스같은 아이템 구매할때 10개 동시뽑기같은거 있으면 좋을 듯 합니다. 이 게임은 정말 10억명의 플레이어가 하는 이유가 있네요.ㅎㅎ 제가 별 5개 말고 100개 1000개를 더 줄수 있지만 별이 5개밖에 한정이.되어 있어서 아쉽네요..ㅎㅎ 일단 많이 재미있습니다, 이 게임에 대해 업데이트나 더 많은 아이탬들 캐릭터들을 많이 만들어 주세요. 이 게임 회사는 참 좋겠네요.(이 게임으로 돈을 많이 벌 수 있기 때문)ㅋㅋ 이거는 심심할때 주로 하는건데 와이파이 없이도 할수 았었어 진짜 강추드립니다!!!!! 렉도 안걸리고 그리고 여행갈때 뭐 차타고 어디든지 갈때 와이파이가 없이도 할수있는 게임이라 진짜 강력추천 드립니다!!! 제가 방학때 집에만 처 박혀있어서 이겜 완전 갓겜 이라고 볼수있어요 그리고 제 동생도 핸드폰이 겜이 있어요 이겜 넘나 재미있어서 별5개 줄 의미가 있네요 진짜 너무 좋아요! 광고도 원할 때(보상 2배로 받고 싶어서 일부러 광고볼 때 등)만 나오고 요즘에 업데이트되서 새로나온 맵도 이쁘네요❤ 광고보는게 안돼서 다음 스테이지로 넘어가질않아요 결제만 엄청했는데 ㅡㅡ 광고도 많이 없고 게임도 너무 재미있는데 왜 보드를 탈때마다 화면이 깜깜해지는꺼져 너무 짜증나요 다시 실행해야지 원래대로 돌아오고 빨리 개선해주세요 너무 재밌어요 그리고 한번 해보세요. 게임은 재밌는데 , 자녀가 10만원 이상을 결재했어요. 몇개는 취소되던데 나머지것도 취소 해주세요. 뭘샀는지 조차 모르겠어요. 캐릭터도 필요없어요. 기본만 있으면 되요 4백만점 찍었는데 다이아라니....사람들 겁나 잘하자너... 한번씩 기차위에서 옆으로 이동할때 기차사이에 껴서 부딪히는 버그가 있습니다. 제 예상으로는 점프캔슬하면서 생기는거 같은데... 고쳐주시면 감사하겠습니다 순발력 을키울수있어서좋아요 재밌게 질 하고 있습니다 리뷰 쓰다가 깜빡하고 못 쓴 게 있어서 더 적어봅니다 사물과의 충돌 판정 범위가 업데이트 전에 비에서 더 엄격해진 거 같아요.. ㅠㅠㅠ 충돌 범위 판정을 완화시켜주시면 좋겠어요.. ㅠ 재밌긴한데 너무 뻔해요 1ㄷ1 모드도 추가됬으면 더 재밌을듯 그걸로 트로피 만들어서 트로피 갯수에 따라 등급 매겨서 그 등급에 맞는 상품 만드는것도 나쁘지않을듯 그리고 그 트로피 갯수를 활용한 랭크를 만드는것도 계속 그냥 혼자 달리면 지루함 저이거 한.....6살때 했던것같아요 이때 영어 못해가지 혼란했었는데 ㅎㅎ 추억이네요 친구가 추전해서 깔았는데 넘넘 재미있어요요 편하게 할수 있는 게임이여서 좋아요 바르셀로나 아이템 모으는 이벤트 20시간 기다려라해서 하루 기다렸는데도 왜 계속 20시간임?? 업데이트해서 더 재밌네용!! 음....시간 때우기 좋은 게임인듯요ㅋㅋㅋㅋ 캐릭터도 현질 안해도 살 수 있어서 되게 좋아요! 렉도 많이 안 걸리고 광고도 많이 안 나와요 지금도 재미있게 하고 있는 게임입니다✌😋 제가 1학년때 부터 즐기던 게임입니다.그런데 기차게임이느것 같기도 합니다만 지금 전 나이가 어느정도 늙 (?)었기 때문에 그래도 늙어도 재미가 있어서 초댕들이 맪이 하는 게임이라고 생각햅니다.와파 없이도 될 것같습니다.그리고 몰촌 할때나 그럴때 시간 순사가기 짱 좋은 꿀 게임입니다.그러니 망설이지 마시고 한번 플레이 해보시길 바랍니다.광고도 필요할때만 나와서 부담이 전혀 없이 즐길 수 있고 아이템도 많아서 경찰이 쫓아올때 피할수도 있습니다그럼 ㄲㄱ!이 게임 깔아보시길 추천추천 강추!그럼 전 2만! 재미있네요 컨트롤 좋고 무엇보다 제가 이런거 하면 살짝 어지럽던데 그래픽이 진짜 잘 따라와요 지금 한국순위에서 88000찍었구요 플레이도 쉽고 재미있게 하며 고인물 되려 연습중! 별 10000개도 부족할 듯ㅎㅎ 게임 나왔을 때부터 했던 것 같은데 벌써 9년째 플레이 중이네요. 출시 9년만에 한국어 패치가 되다니...ㅠㅠ 감격스럽습니다! 이제 play버튼만 누르던 시절은 갔다... 이제는 업적도 미션도 모을 수 있다!! 와......이거진짜착하게해주내요!!!!처음 할때도알려주고,추억에남아요!이게임 만든 제작진님 코로나항상 조심하시고,새해 복 많이받으세요~^^힘들지안고,행복하게 살으세요~~~^^♡",4.6,아케이드
